category,name,price
Food Cupboard,BELMONT Choco Break 8 Pack,£1.25
Food Cupboard,BELMONT Milk Chocolate Caramel Wafer Bars 8 Pack,£1.69
Food Cupboard,BELMONT Milk Chocolate Wafer Bars 9 Pack,£1.35
Food Cupboard,BELMONT Jammy Wheel Minis 6 Pack,£0.99
Food Cupboard,THE PANTRY Mini Marshmallows,£1.29
Food Cupboard,BELMONT Custard Creams,£0.45
Food Cupboard,DOMINION Mini Gems,£0.89
Food Cupboard,DOMINION Fruit Pastilles,£0.89
Food Cupboard,CUCINA Tomato Passata,£0.49
Food Cupboard,WORLDWIDE FOODS Easy Cook Long Grain Rice,£1.25
Food Cupboard,CUCINA Bolognese Pasta Sauce,£0.69
Food Cupboard,BELMONT Chocolate Chunk Cookies,£1.09
Food Cupboard,WORLDWIDE FOODS Brown Rice,£1.39
Food Cupboard,BELMONT Milk Chocolate Malted Milk Biscuits,£1.19
Food Cupboard,THE PANTRY Madagascan Vanilla Extract,£0.85
Food Cupboard,SPECIALLY SELECTED Egg Tagliatelle,£1.45
Food Cupboard,HARVEST MORN Frosted Flakes Cereal,£0.95
Food Cupboard,THE PANTRY Strong White Bread Flour,£1.09
Food Cupboard,SOLESTA Extra Virgin Olive Oil,£6.19
Food Cupboard,BRAMWELLS Reduced Salt & Sugar Ketchup,£0.89
Food Cupboard,DOMINION Flix & Mix,£1.35
Food Cupboard,THE DELI Pickled Pink Onions,£0.99
Food Cupboard,ASIA SPECIALITIES Sriracha Sauce,£1.99
Food Cupboard,DOMINION Fruit Chews,£2.69
Food Cupboard,BELMONT Wafers 5 Pack,£1.29
Food Cupboard,THE PANTRY Fast Action Yeast 8 Pack,£0.89
Food Cupboard,THE PANTRY Cornflour,£1.75
Food Cupboard,THE PANTRY Golden Syrup,£1.25
Food Cupboard,BRAMWELLS Classic Piccalilli,£1.25
Food Cupboard,DOMINION Liquorice Allsorts,£0.89
Food Cupboard,BRAMWELLS BBQ Sauce,£0.79
Food Cupboard,BRAMWELLS Baked Beans with Sausages in a Rich Tomato Sauce,£0.55
Food Cupboard,EVERYDAY ESSENTIALS Baked Beans in Tomato Sauce,£0.27
Food Cupboard,BRAMWELLS Baked Beans in a Rich Tomato Sauce,£0.41
Food Cupboard,BRAMWELLS Macaroni Cheese in a Delicious Cheesy Sauce,£0.75
Food Cupboard,SNACKRITE Teddy Faces 6 Pack,£0.99
Food Cupboard,DAIRYFINE Deeno The Dinosaur Chocolate 10 Pack,£1.99
Food Cupboard,BELMONT Safari Snacks 7 Pack,£1.05
Food Cupboard,BELMONT Mini Iced Rings 6 Pack,£0.95
Food Cupboard,BRAMWELLS Tomato Ketchup,£0.89
Food Cupboard,BELMONT Mega Cookies & Cream,£1.59
Food Cupboard,EVERYDAY ESSENTIALS Chocolate Chip Cookies,£0.65
Food Cupboard,BRAMWELLS Vegetable Stock Cubes 12 Pack,£0.69
Food Cupboard,CUCINA Orzo Pasta,£0.69
Food Cupboard,BRAMWELLS Chicken Stock Pots 4 Pack,£0.99
Food Cupboard,BRAMWELLS Beef Stock Pots 4 Pack,£0.99
Food Cupboard,BRAMWELLS Vegetable Stock Pots 4 Pack,£0.99
Food Cupboard,SPECIALLY SELECTED Strawberry Conserve,£1.85
Food Cupboard,SOLESTA Virgin Olive Oil 10%,£5.69
Food Cupboard,SOLESTA Light in Colour Virgin Olive Oil 2%,£5.69
Food Cupboard,SPECIALLY SELECTED Kalamata Olives,£1.89
Food Cupboard,SPECIALLY SELECTED Pitted Colossal Olives,£1.89
Food Cupboard,THE FISHMONGER Chilli & Garlic Fusions Tuna,£0.89
Food Cupboard,THE FISHMONGER Lemon & Thyme Fusions Tuna,£0.89
Food Cupboard,THE FISHMONGER Soy & Ginger Fusions Tuna,£0.89
Food Cupboard,THE FISHMONGER Jalapeño Fusions Tuna,£0.89
Food Cupboard,THE DELI Grilled Peppers,£1.49
Food Cupboard,THE DELI Sundried Tomatoes,£1.49
Food Cupboard,BRAMWELLS Real Mayonnaise,£0.95
Food Cupboard,BRAMWELLS Squeezy Salad Cream,£0.99
Food Cupboard,BRAMWELLS Light Squeezy Salad Cream,£0.99
Food Cupboard,SPECIALLY SELECTED Tomato & Mascarpone Stir Through Sauce,£1.49
Food Cupboard,SPECIALLY SELECTED Tomato & Olive Stir Through Sauce,£1.49
Food Cupboard,SPECIALLY SELECTED Tomato & Grilled Peppers Stir Through  Sauce,£1.49
Food Cupboard,GRANDESSA Smooth Peanut Butter,£0.99
Food Cupboard,GRANDESSA Crunchy Peanut Butter,£0.99
Food Cupboard,ASIA SPECIALITIES Reduced Fat Coconut Milk,£0.75
Food Cupboard,ASIA SPECIALITIES Coconut Milk,£0.75
Food Cupboard,FOUR SEASONS Fruit Cocktail in Light Syrup,£0.95
Food Cupboard,FOUR SEASONS Fruit Cocktail in Juice,£0.95
Food Cupboard,FOUR SEASONS Mixed Beans in Water,£0.69
Food Cupboard,CHOCEUR White Chocolate Mini Tablets 5 Pack,£3.09
Food Cupboard,CHOCEUR Smooth Praline Milk Chocolate Mini Tablets 5 Pack,£3.09
Food Cupboard,CHOCEUR Milk Chocolate Mini Tablets 5 Pack,£3.09
Food Cupboard,CHOCEUR Dark Chocolate Mini Tablets 5 Pack,£3.09
Food Cupboard,CHOCEUR Spirals Hazelnut 7 Pack,£1.75
Food Cupboard,CHOCEUR Spirals Double Chocolate 7 Pack,£1.75
Food Cupboard,DAIRYFINE Strawberry Yogurt Milk Chocolate Sticks 11 Pack,£1.99
Food Cupboard,DAIRYFINE Cookies &  Milk Chocolate Sticks 11 Pack,£1.99
Food Cupboard,DAIRYFINE Hazelnut Crisp Milk Chocolate Sticks 11 Pack,£1.99
Food Cupboard,DAIRYFINE Milk Chocolate Sticks 11 Pack,£1.99
Food Cupboard,DAIRYFINE Giant White Chocolate Buttons,£0.99
Food Cupboard,DAIRYFINE Giant Milk Chocolate Buttons,£0.99
Food Cupboard,DAIRYFINE Giant Caramel Chocolate Buttons,£0.99
Food Cupboard,MOSER ROTH Dark Hazelnut Chocolate,£2.39
Food Cupboard,MOSER ROTH Dark Sea Salt Chocolate,£2.39
Food Cupboard,MOSER ROTH Dark 70% Cocoa Chocolate,£2.39
Food Cupboard,MOSER ROTH Dark 85% Cocoa Chocolate,£2.39
Food Cupboard,CHOCEUR Dark Hazelnut Chocolate,£2.25
Food Cupboard,CHOCEUR Fruit & Nut Chocolate,£2.25
Food Cupboard,CHOCEUR Milk Almond Chocolate,£2.25
Food Cupboard,CHOCEUR Caramel Chocolate,£2.25
Food Cupboard,CHOCEUR Salted Pretzel Chocolate,£2.25
Food Cupboard,CHOCEUR Milk & White Chocolate,£2.25
Food Cupboard,CHOCEUR White Chocolate,£2.25
Food Cupboard,CHOCEUR Milk Chocolate,£2.25
Food Cupboard,CHOCEUR Dark Chocolate,£2.25
Food Cupboard,HARVEST MORN Strawberry Fruit & Grain Cereal Bars 6 Pack,£1.15
Food Cupboard,HARVEST MORN Apple Fruit & Grain Bars 6 Pack,£1.15
Food Cupboard,HARVEST MORN Blueberry Fruit & Grain Bars 6 Pack,£1.15
Food Cupboard,HARVEST MORN Yogurt & Forest Fruit Bars 6 Pack,£1.39
Food Cupboard,HARVEST MORN Yogurt & Strawberry Bars 6 Pack,£1.39
Food Cupboard,HARVEST MORN Forest Fruit Crispy Fruit Slices 5x3 Pack,£0.99
Food Cupboard,HARVEST MORN Apple & Raisin Crispy Fruit Slices 5x3 Pack,£0.99
Food Cupboard,HARVEST MORN Crunchy Oats & Honey Granola Bars 5 Pack,£1.45
Food Cupboard,HARVEST MORN Crunchy Maple Syrup Granola Bars 5 Pack,£1.45
Food Cupboard,HARVEST MORN Chocolate Crispy Chunks 4 Pack,£1.59
Food Cupboard,HARVEST MORN Caramel Chocolate Crispy Chunks 4 Pack,£1.59
Food Cupboard,HARVEST MORN Marshmallow Crispy Chunks 4 Pack,£1.59
Food Cupboard,HARVEST MORN Cinnamon Chips Cereal,£2.09
Food Cupboard,HARVEST MORN Chocolate Chip Crispy Bites Wheat Bisks Cereal,£2.09
Food Cupboard,HARVEST MORN Honey Cereal Hoops,£0.75
Food Cupboard,HARVEST MORN Choco Cereal Hoops,£0.75
Food Cupboard,HARVEST MORN Frosted Wheaties Cereal,£1.85
Food Cupboard,HARVEST MORN Choco Wheaties Cereal,£1.85
Food Cupboard,THE FISHMONGER Drained & Ready to Eat Tuna Steaks in Brine,£0.99
Food Cupboard,THE FISHMONGER Drained & Ready to Eat Tuna Steaks in Sunflower Oil,£0.99
Food Cupboard,THE FISHMONGER Drained & Ready to Eat Tuna Steaks in Water,£0.99
Food Cupboard,DAIRYFINE Wholenut Chocolate,£1.69
Food Cupboard,DAIRYFINE Fruit & Nut Chocolate,£1.69
Food Cupboard,DAIRYFINE Milk Chocolate,£1.69
Food Cupboard,DAIRYFINE Dark Chocolate,£1.69
Food Cupboard,FOUR SEASONS Peach Slices in Juice,£0.95
Food Cupboard,FOUR SEASONS Peach Slices in Light Syrup,£0.95
Food Cupboard,SNACKRITE Honey Roast Peanuts,£0.99
Food Cupboard,SNACKRITE Hot Chilli Peanuts,£0.99
Food Cupboard,THE DELI Green Pitted Manzanilla Olives,£0.99
Food Cupboard,THE DELI Black Pitted Hojiblanca Olives,£0.99
Food Cupboard,THE FOODIE MARKET Pumpkin Seeds,£1.69
Food Cupboard,THE FOODIE MARKET Pine Nuts,£1.69
Food Cupboard,THE FOODIE MARKET Seed Mix,£1.15
Food Cupboard,THE FOODIE MARKET Sunflower Seeds,£1.15
Food Cupboard,ASIA SPECIALITIES Dark Soy Sauce,£0.59
Food Cupboard,ASIA SPECIALITIES Light Soy Sauce,£0.59
Food Cupboard,BRAMWELLS Mild Chicken Curry,£1.65
Food Cupboard,BRAMWELLS Hot Chicken Curry,£1.65
Food Cupboard,BRAMWELLS Vegetable Soup,£0.63
Food Cupboard,BRAMWELLS Minestrone Soup,£0.63
Food Cupboard,BRAMWELLS Cream Of Chicken Soup,£0.63
Food Cupboard,BRAMWELLS Cream Of Mushroom Soup,£0.63
Food Cupboard,QUIXO Natural Breadcrumbs,£0.99
Food Cupboard,QUIXO Golden Breadcrumbs,£0.99
Food Cupboard,BRAMWELLS Original BBQ Sauce,£1.49
Food Cupboard,BRAMWELLS New York Steakhouse Style BBQ Sauce,£1.49
Food Cupboard,WORLDWIDE FOODS Classic Egg Fried Rice Pouch,£0.49
Food Cupboard,WORLDWIDE FOODS Classic Pilau Rice Pouch,£0.49
Food Cupboard,SPECIALLY SELECTED Really Nutty Granola,£1.99
Food Cupboard,SPECIALLY SELECTED Very Berry Granola,£1.99
Food Cupboard,HARVEST MORN Raisin & Almond Granola,£1.79
Food Cupboard,HARVEST MORN Tropical Fruits Granola,£1.79
Food Cupboard,MAKE IN MINUTES Asia Inspired Noodles Thai Style Sweet Chilli,£0.75
Food Cupboard,MAKE IN MINUTES Asia Inspired Noodles Cantonese Style Hoisin Duck,£0.75
Food Cupboard,MAKE IN MINUTES Asia Inspired Noodles Singapore Curry,£0.75
Food Cupboard,MAKE IN MINUTES Asia Inspired Rice Japanese Katsu Curry,£0.75
Food Cupboard,THE FOODIE MARKET Red Lentil & Beetroot Fusilli,£1.29
Food Cupboard,FREE FROM Green Pea Penne,£1.29
Food Cupboard,FREE FROM Chickpea Fusilli,£1.29
Food Cupboard,FIESTA Classic Fajita Kit,£1.49
Food Cupboard,FIESTA Smoky BBQ Fajita Kit,£1.49
Food Cupboard,HARVEST MORN Golden Syrup Flavour Instant Porridge Pot,£0.37
Food Cupboard,HARVEST MORN Golden Syrup Flavour Instant Porridge Satchets 8 Pack,£0.95
Food Cupboard,HARVEST MORN Original Instant Porridge Sachets 10 Pack,£0.95
Food Cupboard,THE DELI Pickled Gherkins with Chilli,£0.95
Food Cupboard,THE DELI Pickled Silverskin Onions,£0.79
Food Cupboard,THE DELI Pickled Sweet Silverskin Onions,£0.79
Food Cupboard,BRAMWELLS Tartare Sauce,£0.65
Food Cupboard,BRAMWELLS Horseradish Sauce,£0.65
Food Cupboard,BRAMWELLS Wholegrain Mustard,£0.59
Food Cupboard,BRAMWELLS English Mustard,£0.59
Food Cupboard,BRAMWELLS Dijon Mustard,£0.59
Food Cupboard,SPECIALLY SELECTED Caramelised Red Onion Chutney,£1.99
Food Cupboard,SPECIALLY SELECTED Tomato & Chilli Chutney,£1.99
Food Cupboard,SPECIALLY SELECTED Jalapeño Chilli Jam,£1.99
Food Cupboard,FIESTA Hot Chilli Con Carne Cooking Sauce,£0.99
Food Cupboard,BRAMWELLS Mild Chilli Con Carne Cooking Sauce,£0.99
Food Cupboard,SPECIALLY SELECTED 2 Step Madras Curry Sauce,£1.69
Food Cupboard,SPECIALLY SELECTED 2 Step Jalfrezi Curry Sauce,£1.69
Food Cupboard,SPECIALLY SELECTED 2 Step Balti Curry Sauce,£1.69
Food Cupboard,SPECIALLY SELECTED 2 Step Rogan Josh Curry Sauce,£1.69
Food Cupboard,GRANDESSA Clear Honey,£0.99
Food Cupboard,GRANDESSA Set Honey,£0.99
Food Cupboard,CUCINA Cheese & Bacon Pasta Bake,£0.69
Food Cupboard,CUCINA Creamy Tomato Pasta Bake Sauce,£0.69
Food Cupboard,CUCINA Tomato & Bacon Pasta Bake Sauce,£0.69
Food Cupboard,BILASH Tikka Masala Cooking Sauce,£0.99
Food Cupboard,BILASH Korma Cooking Sauce,£0.99
Food Cupboard,GRANDESSA Apricot Jam,£0.89
Food Cupboard,GRANDESSA Seedless Raspberry Jam,£0.89
Food Cupboard,GRANDESSA Blackcurrant Jam,£0.89
Food Cupboard,QUIXO Onion Gravy Granules,£1.09
Food Cupboard,QUIXO Chicken Gravy Granules,£1.09
Food Cupboard,BRAMWELLS Meatballs In A Rich Gravy,£0.85
Food Cupboard,BRAMWELLS Meatballs In Tomato Sauce,£0.85
Food Cupboard,BRAMWELLS Salmon Paste,£0.49
Food Cupboard,BRAMWELLS Beef Paste,£0.49
Food Cupboard,BRAMWELLS Chicken Paste,£0.49
Food Cupboard,BRAMWELLS Spaghetti Bolognese Seasoning Mix,£0.29
Food Cupboard,BRAMWELLS Beef Casserole Seasoning Mix,£0.29
Food Cupboard,BRAMWELLS Chicken Casserole Seasoning Mix,£0.29
Food Cupboard,BRAMWELLS Chilli Con Carne Seasoning Mix,£0.29
Food Cupboard,BRAMWELLS Sausage Casserole Seasoning Mix,£0.29
Food Cupboard,SPECIALLY SELECTED 2 Step Butter Chicken Curry Sauce,£1.69
Food Cupboard,SPECIALLY SELECTED 2 Step Korma Curry Sauce,£1.69
Food Cupboard,SPECIALLY SELECTED 2 Step Saag Masala Curry Sauce,£1.69
Food Cupboard,SPECIALLY SELECTED 2 Step Tikka Masala Curry Sauce,£1.69
Food Cupboard,HARVEST MORN Chocolate Crisp Cereal,£1.69
Food Cupboard,HARVEST MORN Strawberry Crisp Cereal,£1.69
Food Cupboard,SPECIALLY SELECTED Raspberry Conserve,£1.49
Food Cupboard,SPECIALLY SELECTED Apricot Conserve,£1.49
Food Cupboard,SPECIALLY SELECTED Blackcurrent Conserve,£1.49
Food Cupboard,BRAMWELLS Ceaser Salad Dressing,£0.85
Food Cupboard,BRAMWELLS Vinaigrette Salad Dressing,£0.85
Food Cupboard,BRAMWELLS Honey & Mustard Salad Dressing,£0.85
Food Cupboard,BRAMWELLS House Salad Dressing,£0.85
Food Cupboard,BRAMWELLS Mango & Chilli Salad Dressing,£0.85
Food Cupboard,BRAMWELLS Thousand Island Salad Dressing,£0.85
Food Cupboard,FOUR SEASONS Midly Spiced Red Kidney Beans in Chilli Sauce,£0.69
Food Cupboard,FOUR SEASONS Mildly Spiced Taco Mixed Beans in a Tomato Sauce,£0.69
Food Cupboard,BRAMWELLS Malt Vinegar,£0.35
Food Cupboard,BRAMWELLS Distilled Vinegar,£0.35
Food Cupboard,CUCINA Chunky Mushroom Pasta Sauce,£0.69
Food Cupboard,CUCINA Tomato & Basil Sauce For Meatballs,£0.69
Food Cupboard,CUCINA Onion & Garlic Pasta Sauce,£0.69
Food Cupboard,CUCINA Smooth Tomato Pasta Sauce,£0.69
Food Cupboard,CUCINA Creamy Lasagne Sauce,£0.65
Food Cupboard,CUCINA Tomato Lasagne Sauce,£0.65
Food Cupboard,CUCINA Tomato & Bacon Stir-In Pasta Sauce,£0.85
Food Cupboard,CUCINA Sun-Dried Tomato Stir-In Pasta Sauce,£0.85
Food Cupboard,CUCINA Tomato & Basil Stir-In Pasta Sauce,£0.85
Food Cupboard,THE DELI Crinkle Cut Gherkins,£0.99
Food Cupboard,THE DELI Cornichons with Herbs,£0.99
Food Cupboard,MAKE IN MINUTES Spice Infusion Cous Cous,£0.49
Food Cupboard,MAKE IN MINUTES Roasted Vegetable Cous Cous,£0.49
Food Cupboard,MAKE IN MINUTES Moroccan Medley Cous Cous,£0.49
Food Cupboard,"WORLDWIDE FOODS Special Quinoa, Pumpkin & Sunflower Seeds Pouch",£0.79
Food Cupboard,WORLDWIDE FOODS Special Wholegrain Rice & Quinoa Pouch,£0.79
Food Cupboard,"WORLDWIDE FOODS Special Wholegrain, Wild & Red Rice Pouch",£0.79
Food Cupboard,MAKE IN MINUTES Chicken Flavour Savoury Rice,£0.59
Food Cupboard,MAKE IN MINUTES Beef Flavour Savoury Rice,£0.59
Food Cupboard,MAKE IN MINUTES Golden Veg Flavour Savoury Rice,£0.59
Food Cupboard,BRAMWELLS Lentil Soup,£0.63
Food Cupboard,BRAMWELLS Pea & Ham Soup,£0.63
Food Cupboard,HARVEST MORN Chocolate Fudge Brownies Fibre Now Bars 5 Pack,£1.15
Food Cupboard,HARVEST MORN Birthday Cake Fibre Now Bars 5 Pack,£1.15
Food Cupboard,HARVEST MORN Original Swiss Style Muesli,£2.25
Food Cupboard,HARVEST MORN No Added Sugar Swiss Style Muesli,£2.25
Food Cupboard,BRAMWELLS Beef & Tomato Flavour Snack Noodles Pot,£0.69
Food Cupboard,BRAMWELLS Spicy Curry Flavour Snack Noodles Pot,£0.69
Food Cupboard,HARVEST MORN Chocolate Crunchy Clusters Cereal,£1.99
Food Cupboard,HARVEST MORN Honey & Nut Crunchy Clusters Cereal,£1.99
Food Cupboard,QUIXO Reduced Salt Gravy Granules,£1.09
Food Cupboard,QUIXO Standard Gravy Granules,£1.09
Food Cupboard,ASIA SPECIALITIES Sweet & Sour Cooking Sauce,£0.99
Food Cupboard,ASIA SPECIALITIES Chinese Style Curry Cooking Sauce,£0.99
Food Cupboard,SNACKRITE Mild Salsa Dip,£0.89
Food Cupboard,SNACKRITE Sour Cream Dip,£0.89
Food Cupboard,GRANDESSA Fine Cut Orange Marmalade,£0.85
Food Cupboard,GRANDESSA Thick Cut Orange Marmalade,£0.85
Food Cupboard,WORLDWIDE FOODS Red & White Quinoa Pouch,£1.05
Food Cupboard,WORLDWIDE FOODS Cajun Quinoa Pouch,£1.05
Food Cupboard,HARVEST MORN Strawberry Filled Soft Bakes 5 Pack,£1.49
Food Cupboard,HARVEST MORN Chocolate Chip Soft Bakes 5 Pack,£1.49
Food Cupboard,HARVEST MORN Choco Hazelnut Flavour Filled Soft Bakes 5 Pack,£1.49
Food Cupboard,BRAMWELLS Chicken in White Sauce,£1.85
Food Cupboard,BRAMWELLS Chilli Con Carne,£1.85
Food Cupboard,BRAMWELLS Minced Beef & Onion,£1.69
Food Cupboard,BRAMWELLS Classic Irish Stew,£1.69
Food Cupboard,WORLDWIDE FOODS Special Mixed Pepper Rice Pouch,£0.89
Food Cupboard,WORLDWIDE FOODS Special Coconut Rice Pouch,£0.89
Food Cupboard,SPECIALLY SELECTED Orange Blossom Squeezy Honey,£2.39
Food Cupboard,SPECIALLY SELECTED Spanish Forest Squeezy Honey,£2.39
Food Cupboard,SPECIALLY SELECTED Acacia Squeezy Honey,£2.39
Food Cupboard,SPECIALLY SELECTED Pink Himalayan Rock Salt,£1.99
Food Cupboard,SPECIALLY SELECTED Rainbow Peppercorns,£1.99
Food Cupboard,ASIA SPECIALITIES Hoisin Sauce,£1.39
Food Cupboard,ASIA SPECIALITIES Satay Sauce,£1.39
Food Cupboard,ASIA SPECIALITIES Teriyaki Sauce,£1.39
Food Cupboard,DESSERT MENU Strawberry Flavour Jelly,£0.85
Food Cupboard,DESSERT MENU Raspberry Flavour Jelly,£0.85
Food Cupboard,DESSERT MENU Orange Flavour Jelly,£0.85
Food Cupboard,HARVEST MORN Apricot Fruit Wheats Cereal,£1.65
Food Cupboard,HARVEST MORN Blueberry Fruit Wheats,£1.65
Food Cupboard,CUCINA Basil Pesto,£0.99
Food Cupboard,CUCINA Sun-dried Tomato Pesto,£0.99
Food Cupboard,SPECIALLY SELECTED Pesto Alla Genovese,£1.85
Food Cupboard,SPECIALLY SELECTED Pesto Rosso,£1.85
Food Cupboard,SOLESTA Spray Light Sunflower Oil,£1.29
Food Cupboard,SOLESTA Spray Light Olive Oil,£1.29
Food Cupboard,FREE FROM Gluten Free Spaghetti,£0.65
Food Cupboard,FREE FROM Glutenfree Fusilli,£0.65
Food Cupboard,CUCINA Wholewheat Spaghetti,£0.75
Food Cupboard,CUCINA Wholewheat Fusilli,£0.75
Food Cupboard,ASIA SPECIALITIES Sweet Chilli & Garlic Stir Fry Sauce,£0.55
Food Cupboard,ASIA SPECIALITIES Chow Mein Stir Fry Sauce,£0.55
Food Cupboard,ASIA SPECIALITIES Sweet & Sour Stir Fry Sauce,£0.55
Food Cupboard,ASIA SPECIALITIES Teriyaki Stir Fry Sauce,£0.55
Food Cupboard,THE DELI Cider Vinegar,£1.65
Food Cupboard,THE DELI Red Wine Vinegar,£1.65
Food Cupboard,THE DELI White Wine Vinegar,£1.65
Food Cupboard,BRAMWELLS Smoky BBQ Seasoning,£0.55
Food Cupboard,BRAMWELLS Peri Peri Seasoning,£0.55
Food Cupboard,BRAMWELLS Salt & Pepper Seasoning,£0.55
Food Cupboard,BRAMWELLS Medium Peri Peri Sauce & Marinade,£1.25
Food Cupboard,BRAMWELLS Lemon & Herb Peri Peri Sauce & Marinade,£1.25
Food Cupboard,BRAMWELLS Hot Peri Peri Sauce & Marinade,£1.25
Food Cupboard,BRAMWELLS Garlic Peri Peri Sauce & Marinade,£1.25
Food Cupboard,BRAMWELLS Carrot & Coriander Soup,£0.63
Food Cupboard,BRAMWELLS Chicken & Noodle Soup,£0.63
Food Cupboard,SNACKRITE Smokehouse BBQ Snack Mix,£0.99
Food Cupboard,SNACKRITE Thai Style Sriracha Flavour Snack Mix,£0.99
Food Cupboard,SNACKRITE Deltas Cool Tortilla Chips,£0.89
Food Cupboard,SNACKRITE Deltas Chilli Flavour Tortilla Chips,£0.89
Food Cupboard,SNACKRITE Deltas Tangy Cheese Tortilla Chips,£0.89
Food Cupboard,SNACKRITE Deltas Salted Tortilla Chips,£0.89
Food Cupboard,SAVOUR BAKES Cheese & Onion Twists,£0.79
Food Cupboard,SAVOUR BAKES Cheese & Chive Twists,£0.79
Food Cupboard,BELMONT Dark Chocolate Butter Biscuits,£1.29
Food Cupboard,BELMONT Milk Chocolate Butter Biscuits,£1.29
Food Cupboard,SAVOUR BAKES Multigrain Crackers,£0.85
Food Cupboard,SAVOUR BAKES Wheat Multigrain Crackers,£0.85
Food Cupboard,SPECIALLY SELECTED Gourmet Sea Salt Savoury Crackers,£0.89
Food Cupboard,SPECIALLY SELECTED Gourmet Rosemary Savoury Crackers,£0.89
Food Cupboard,SPECIALLY SELECTED Gourmet Black Pepper Savoury Crackers,£0.89
Food Cupboard,THE PANTRY Milk Chocolate Chips,£0.99
Food Cupboard,SPECIALLY SELECTED Quadruple Chocolate Cookies,£1.69
Food Cupboard,SPECIALLY SELECTED Chocolate & Salted Caramel Cookies,£1.69
Food Cupboard,SPECIALLY SELECTED Stem Ginger Cookies,£1.69
Food Cupboard,SNACKRITE Ready Salted Ridged Lights Crisps 6 Pack,£1.29
Food Cupboard,SNACKRITE Cheese Flavour Curlers 10 Pack,£1.39
Food Cupboard,SNACKRITE Cheese Flavour Cheezios 10 Pack,£1.35
Food Cupboard,SNACKRITE Monster Claws Multipack 10 Pack,£1.35
Food Cupboard,SAVOUR BAKES Multi-Seed Flatbread Thins,£1.19
Food Cupboard,SAVOUR BAKES Cheddar & Cracked Black Pepper Flatbread Thins,£1.19
Food Cupboard,SAVOUR BAKES Rosemary & Sea Salt Flatbread Thins,£1.19
Food Cupboard,BELMONT Groovy Biscuit Bars 6 Pack,£1.49
Food Cupboard,THE FOODIE MARKET Banana Chips,£1.39
Food Cupboard,THE FOODIE MARKET Dried Mango,£1.39
Food Cupboard,THE FOODIE MARKET Sweet Chilli Multigrain Waves 6 Pack,£1.19
Food Cupboard,SNACKRITE Sour Cream & Black Pepper Multigrain Waves 6 Pack,£1.19
Food Cupboard,THE PANTRY Aspartame Sweetener Tablets 300 Pack,£0.59
Food Cupboard,THE PANTRY Stevia Sweetener Tablets 100 Pack,£0.59
Food Cupboard,THE PANTRY Sucralose Sweetener Tablets 300 Pack,£0.59
Food Cupboard,SNACKRITE Prawn Crackers,£1.19
Food Cupboard,SNACKRITE Mini Poppadoms,£1.19
Food Cupboard,THE FOODIE MARKET Whole Chia Seeds,£1.49
Food Cupboard,THE FOODIE MARKET Flaxseed,£1.49
Food Cupboard,BELMONT Milk Chocolate Viennese Fingers,£0.99
Food Cupboard,BELMONT Jam & Cream Viennese Fingers,£0.99
Food Cupboard,SNACKRITE Perfections Roast Chicken & Thyme Crisps,£1.19
Food Cupboard,SNACKRITE Perfections Thai Sweet Chilli Crisps,£1.19
Food Cupboard,SPECIALLY SELECTED Lightly Sea Salted Hand Cooked Crisps 6 Pack,£1.49
Food Cupboard,SPECIALLY SELECTED Mature Cheddar & Red Onion Hand Cooked Crisps 6 Pack,£1.49
Food Cupboard,THE FOODIE MARKET Strawberry Fruit Rolls Multipack,£1.75
Food Cupboard,THE FOODIE MARKET Raspberry Fruit Rolls Multipack,£1.75
Food Cupboard,THE FOODIE MARKET Blackcurrant Fruit Rolls Multipack,£1.75
Food Cupboard,SNACKRITE Sweet Popcorn Share Bag,£0.99
Food Cupboard,SNACKRITE Sweet & Salty Popcorn Share Bag,£0.99
Food Cupboard,SNACKRITE Fully Loaded Jalapeño Peanuts,£1.49
Food Cupboard,SNACKRITE Fully Loaded Buffalo Wing Peanuts,£1.49
Food Cupboard,SNACKRITE Fully Loaded Salt & Vinegar Peanuts,£1.49
Food Cupboard,THE PANTRY White Cooking Chocolate,£1.25
Food Cupboard,THE PANTRY Milk Cooking Chocolate,£1.25
Food Cupboard,THE PANTRY Dark Cooking Chocolate,£1.25
Food Cupboard,BELMONT Triple Chocolate Cookies,£1.09
Food Cupboard,BELMONT White Chocolate Cookies,£1.09
Food Cupboard,SNACKRITE BBQ Lentil Chips,£1.19
Food Cupboard,SNACKRITE Salt & Vinegar Lentil Chips,£1.19
Food Cupboard,THE PANTRY Baking Powder,£0.65
Food Cupboard,THE PANTRY Bicarbonate Of Soda,£0.65
Food Cupboard,SAVOUR BAKES Garlic & Herb Cracker Sharing Tub,£1.19
Food Cupboard,SAVOUR BAKES Cheese Cracker Sharing Tub,£1.19
Food Cupboard,BELMONT Chocolate Wacko Biscuit Bars 9 Pack,£1.29
Food Cupboard,BELMONT Caramel Wacko Biscuit Bars 9 Pack,£1.29
Food Cupboard,THE PANTRY Dark Brown Soft Sugar,£1.09
Food Cupboard,THE PANTRY Light Brown Soft Sugar,£1.09
Food Cupboard,THE FOODIE MARKET Yogurt Coated Raisins,£1.75
Food Cupboard,THE FOODIE MARKET Strawberry Yogurt Bites,£1.75
Food Cupboard,SPECIALLY SELECTED Lightly Sea Salted Crinkle Cut Crisps,£1.09
Food Cupboard,SPECIALLY SELECTED Sea Salt & Chardonnay Vinegar Hand Cooked Crisps,£1.09
Food Cupboard,SPECIALLY SELECTED Sea Salt & Cracked Black Pepper Hand Cooked Crisps,£1.09
Food Cupboard,DOMINION Veggie Worms Sweets,£1.09
Food Cupboard,DOMINION Veggie Fizzy Worms Sweets,£1.09
Food Cupboard,DOMINION Vegan Lions Sweets,£1.09
Food Cupboard,DAIRYFINE Mint Crème Chocolate,£1.55
Food Cupboard,DAIRYFINE Turkish Delight Chocolate,£1.55
Food Cupboard,DOMINION Original Jelly Beans,£1.59
Food Cupboard,DOMINION Sour Jelly Beans,£1.59
Food Cupboard,DOMINION Strawberry Lances Sweets,£0.42
Food Cupboard,DOMINION Strawberry Laces Sweets,£0.42
Food Cupboard,DOMINION Strawberry Pencils Sweets,£0.42
Food Cupboard,DOMINION Rainbow Belt Sweets,£0.42
Food Cupboard,DOMINION Cola Lances Sweets,£0.42
Food Cupboard,DOMINION Complimints Sugar Free Peppermint Mints,£0.95
Food Cupboard,DOMINION Complimints Sugar Free Strong Mints,£0.95
Food Cupboard,DOMINION Complimints Sugar Free Spearmint Mints,£0.95
Food Cupboard,DOMINION Complimints Sugar Free Strawberry & Peach Flavour,£0.95
Food Cupboard,DAIRYFINE Giant Twisted Chocolate Buttons,£1.39
Food Cupboard,DAIRYFINE Giant Orange Chocolate Buttons,£1.39
Food Cupboard,DOMINION Sugar Free Creamy Butterscotch Sweets,£0.95
Food Cupboard,DOMINION Sugar Free Rhubarb & Custard Sweets,£0.95
Food Cupboard,DOMINION Sugar Free Creamy Strawberry Sweets,£0.95
Food Cupboard,DOMINION Sugar Free Creamy Cappuccino Sweets,£0.95
Food Cupboard,DOMINION Sugar Free Clear Fruits,£0.95
Food Cupboard,DOMINION Sugar Free Clear Mints,£0.95
Food Cupboard,DAIRYFINE Milk Chocolate Bubbly Bar,£1.15
Food Cupboard,DAIRYFINE Mint Chocolate Bubbly Bar,£1.15
Food Cupboard,DAIRYFINE Orange Chocolate Bubbly Bar,£1.15
Food Cupboard,DAIRYFINE Caramel Chocolate Bubbly Bar,£1.15
Food Cupboard,DOMINION Sugar Free Lemon Sherbets Sweets,£0.99
Food Cupboard,DOMINION Sugar Free Cola Sherbet Sweets,£0.99
Food Cupboard,DOMINION Sugar Free Blackcurrant & Liquorice Sherbet Sweets,£0.99
Food Cupboard,DAIRYFINE Milk Chocolate Buttons,£0.69
Food Cupboard,DAIRYFINE White Chocolate Buttons,£0.69
Food Cupboard,DOMINION Butter Mintoes,£0.99
Food Cupboard,DOMINION Mint Humbugs,£0.99
Food Cupboard,DOMINION Sugar Free Soft Foams,£0.99
Food Cupboard,DOMINION Sugar Free Mini Gums,£0.99
Food Cupboard,DOMINION Sugar Free Sweet Liquorice,£0.99
Food Cupboard,DOMINION Sugar Free Jelly Bears,£0.99
Food Cupboard,DOMINION Dolly Mixtures Sweets,£0.55
Food Cupboard,DOMINION Milk Bottles Sweets,£0.55
Food Cupboard,DOMINION Bubblegum & Raspberry Flavour Mushrooms Sweets,£0.55
Food Cupboard,DOMINION Foam Bananas & Shrimps Sweets,£0.55
Food Cupboard,DOMINION Blackcurrant & Liquorice Boiled Sweets,£1.05
Food Cupboard,DOMINION Fruit Sherbets Boiled Sweets,£1.05
Food Cupboard,DOMINION Lemon Sherberts Boiled Sweets,£1.05
Food Cupboard,DOMINION Rhubarb & Custard Boiled Sweets,£1.05
Food Cupboard,BRAMWELLS Squeezy Light Mayonnaise,£0.95
Food Cupboard,BRAMWELLS Squeezy Lighter Than Light Mayonnaise,£0.95
Food Cupboard,HARVEST MORN Multigrain Dino Shapes Cereal,£1.79
Food Cupboard,SPECIALLY SELECTED Basil & Oregano Passata Rustica,£1.95
Food Cupboard,SPECIALLY SELECTED Garlic Passata Rustica,£1.95
Food Cupboard,SNACKRITE BBQ Coated Peanuts,£1.39
Food Cupboard,SNACKRITE Chilli Coated Peanuts,£1.39
Food Cupboard,DAIRYFINE Chocolate Choc Um's,£1.39
Food Cupboard,DAIRYFINE Peanut Chocolate Choc Um's,£1.39
