category,name,price
Food Cupboard,DAIRYFINE Crispy Chocolate Choc Um's,£1.39
Food Cupboard,SNACKRITE Prawn Cocktail Flavour Crisps 6 Pack,£0.89
Food Cupboard,SNACKRITE Salt & Vinegar Crisps 6 Pack,£0.89
Food Cupboard,SNACKRITE Sea Salt Lentil Chips 6 Pack,£1.49
Food Cupboard,SNACKRITE BBQ Lentil Chips 6 Pack,£1.49
Food Cupboard,SNACKRITE Saucy Nibbley Nobblies,£0.85
Food Cupboard,SNACKRITE Spicy Nibbley Nobblies,£0.85
Food Cupboard,SAVOUR BAKES Salt & Vinegar Caramel Rice Cakes,£0.79
Food Cupboard,SAVOUR BAKES Sweet Chilli Caramel Rice Cakes,£0.79
Food Cupboard,MOSER ROTH Sea Salt Chocolate,£2.39
Food Cupboard,MOSER ROTH Milk Chocolate,£2.39
Food Cupboard,HARVEST MORN Peanut Butter Flavour High Protein Bar 3 Pack,£4.19
Food Cupboard,HARVEST MORN Cookie Dough Flavour High Protein Bar 3 Pack,£4.19
Food Cupboard,CHOCEUR Dark Hazelnut Chocolate,£1.09
Food Cupboard,CHOCEUR Milk Hazelnut Chocolate,£1.09
Food Cupboard,WORLDWIDE FOODS American Style Buffalo Rice Pouch,£0.99
Food Cupboard,WORLDWIDE FOODS Asian Style Bang Bang Rice Pouch,£0.99
Food Cupboard,WORLDWIDE FOODS Steamed Pilau Rice,£0.99
Food Cupboard,WORLDWIDE FOODS Steamed Long Grain Rice,£0.99
Food Cupboard,DAIRYFINE Milk Chocolate Peanuts,£1.25
Food Cupboard,SPECIALLY SELECTED Linguine Pasta,£1.29
Food Cupboard,SPECIALLY SELECTED Fusilli Bucati Corti Pasta,£1.29
Food Cupboard,SNACKRITE Grilled Steak Ridged Crisps Share Bag,£1.09
Food Cupboard,SNACKRITE Thai Chicken Ridged Crisps Share Bag,£1.09
Food Cupboard,HARVEST MORN Chocolate Peanut & Caramel Flavour Vitamin & Protein Bar 3 Pack,£3.19
Food Cupboard,HARVEST MORN Chocolate Salted Caramel Flavour Vitamin & Protein Bar 3 Pack,£3.19
Food Cupboard,HARVEST MORN Cocoa Peanut Butter Balls Cereal,£1.89
Food Cupboard,HARVEST MORN Caramelised Biscuit Cereal,£1.89
Food Cupboard,DAIRYFINE Choc Chips Munchy Cereal Bars 5 Pack,£1.05
Food Cupboard,DAIRYFINE Peanut Munchy Cereal Bars 5 Pack,£1.05
Food Cupboard,DAIRYFINE Raisin Munchy Cereal Bars 5 Pack,£1.05
Food Cupboard,SNACKRITE Honey & Lime Cashews,£1.99
Food Cupboard,SNACKRITE Hot Honey Cashews,£1.99
Food Cupboard,BRAMWELLS Sweet Whiskey Flavoured Sauce,£0.99
Food Cupboard,BRAMWELLS Jerk Flavoured Sauce,£0.99
Food Cupboard,BRAMWELLS Korean BBQ Flavored Sauce,£0.99
Food Cupboard,THE FOODIE MARKET Dried Cranberries,£1.19
Food Cupboard,THE FOODIE MARKET Yogurt Coated Cranberries,£1.19
Food Cupboard,THE FOODIE MARKET Fruit & Nut Mix,£1.35
Food Cupboard,THE FOODIE MARKET Raisins & Cranberries,£1.35
Food Cupboard,GRANDESSA Smooth 100% Peanut Butter,£3.99
Food Cupboard,GRANDESSA Crunchy 100% Peanut Butter,£3.99
Food Cupboard,SPECIALLY SELECTED Chilli Infused Olive Oil,£2.39
Food Cupboard,SPECIALLY SELECTED Basil Infused Olive Oil,£2.39
Food Cupboard,SPECIALLY SELECTED Garlic Infused Olive Oil,£2.39
Food Cupboard,THE FOODIE MARKET Dried Prunes,£2.79
Food Cupboard,THE FOODIE MARKET Pitted Dates,£2.79
Food Cupboard,THE PANTRY Ground Almonds,£0.99
Food Cupboard,THE PANTRY Flaked Almonds,£0.99
Food Cupboard,THE PANTRY Walnut Pieces,£0.99
Food Cupboard,SNACKRITE BBQ Flavour Popouts Crisps 5 Pack,£1.35
Food Cupboard,SNACKRITE Sour Cream & Onion Flavour Popouts Crisps 5 Pack,£1.35
Food Cupboard,SPECIALLY SELECTED Rigatoni Pasta Di Gragnano P.G.I.,£1.39
Food Cupboard,SPECIALLY SELECTED Bucatini Pasta Di Gragnano P.G.I.,£1.39
Food Cupboard,BRAMWELLS Roasted Garlic Mayo,£0.85
Food Cupboard,BRAMWELLS Peri Peri Mayo,£0.85
Food Cupboard,BRAMWELLS Lemon & Black Pepper Mayo,£0.85
Food Cupboard,BRAMWELLS Chunky Salsa Topping,£1.39
Food Cupboard,BRAMWELLS Cool Soured Cream Topping,£1.39
Food Cupboard,BRAMWELLS Chunky Guacamole Topping,£1.39
Food Cupboard,HARVEST MORN Golden Syrup Flavour Protein Porridge Pot,£0.69
Food Cupboard,HARVEST MORN Chocolate Protein Porridge Pot,£0.69
Food Cupboard,HARVEST MORN Honey & Yogurt Breakfast Biscuits 5 Pack,£1.39
Food Cupboard,HARVEST MORN Strawberry & Yogurt Breakfast Biscuits 5 Pack,£1.39
Food Cupboard,THE FOODIE MARKET Dino Gems 5 Pack,£1.09
Food Cupboard,THE FOODIE MARKET Dino Tails 5 Pack,£1.09
Food Cupboard,SNACKRITE Sour Cream & Onion Stackz,£1.35
Food Cupboard,SNACKRITE Salt & Vinager Stackz,£1.35
Food Cupboard,SNACKRITE Original Stackz,£1.35
Food Cupboard,SNACKRITE BBQ Stackz,£1.35
Food Cupboard,SNACKRITE BBQ Popouts Share Bag,£0.99
Food Cupboard,SNACKRITE Salt & Vinegar Popouts Share Bag,£0.99
Food Cupboard,SPECIALLY SELECTED Lightly Salted Handcooked Crisps,£1.09
Food Cupboard,SPECIALLY SELECTED Cheddar & Onion Handcooked Crisps,£1.09
Food Cupboard,THE FOODIE MARKET Chocolate Fruit & Nut Mix,£0.45
Food Cupboard,THE FOODIE MARKET Apricot & Almond Mix,£0.45
Food Cupboard,THE FOODIE MARKET Sticky Toffee Mix,£0.45
Food Cupboard,DAIRYFINE Dreemy Chocolate Bars 16 Pack,£1.59
Food Cupboard,DAIRYFINE Roar Chocolate Bars 13 Pack,£1.59
Food Cupboard,DAIRYFINE Caramel Crunch Chocolate Bars 4 Pack,£1.39
Food Cupboard,DAIRYFINE Romeo Chocolate Bars 4 Pack,£1.39
Food Cupboard,HARVEST MORN Milk & Cereal Breakfast Biscuits 6 Pack,£0.79
Food Cupboard,HARVEST MORN Cocoa Breakfast Biscuits 6 Pack,£0.79
Food Cupboard,SNACKRITE Sour Cream & Chive Starry Night Mix,£1.29
Food Cupboard,SNACKRITE Salt & Vinegar Starry Night Mix,£1.29
Food Cupboard,BRAMWELLS Curry Flavour Noodle Bowl,£0.99
Food Cupboard,BRAMWELLS Chicken Flavour Noodle Bowl,£0.99
Food Cupboard,SNACKRITE Variety Ridged Crisps 6 Pack,£1.15
Food Cupboard,SNACKRITE Meaty Ridged Crisps 6 Pack,£1.15
Food Cupboard,HARVEST MORN Chocolate Protein Granola,£2.35
Food Cupboard,HARVEST MORN Berry Protein Granola,£2.35
Food Cupboard,HARVEST MORN Frosted Wheats Cereal,£1.65
Food Cupboard,DAIRYFINE Milk Chocolate Fingers,£0.99
Food Cupboard,DAIRYFINE White Chocolate Fingers,£0.99
Food Cupboard,THE DELI Pickled Sliced Beetroot,£0.79
Food Cupboard,THE DELI Pickled Baby Beetroot,£0.79
Food Cupboard,GRANDESSA Creamy 100% Peanut Butter,£1.49
Food Cupboard,GRANDESSA Crunchy 100% Peanut Butter,£1.49
Food Cupboard,DESSERT MENU Lo Cal Strawberry Flavour Jelly Pot,£0.55
Food Cupboard,DESSERT MENU Lo Cal Raspberry Flavour Jelly Pot,£0.55
Food Cupboard,THE FOODIE MARKET Strawberry & Raspberry Dino Claws 5 Pack,£1.69
Food Cupboard,THE FOODIE MARKET Apple & Blackcurrant Dino Claws 5 Pack,£1.69
Food Cupboard,SNACKRITE Smoky BBQ Almonds & Cashews,£1.75
Food Cupboard,SNACKRITE Salt & Pepper Almonds & Cashews,£1.75
Food Cupboard,SNACKRITE Mighty Yeast Extract Almonds & Cashews,£1.75
Food Cupboard,SNACKRITE BBQ Beef Flavour Potato Hoops 6 Pack,£1.25
Food Cupboard,SNACKRITE Salt & Vinegar Flavour Potato Hoops 6 Pack,£1.25
Food Cupboard,HARVEST MORN Rocky Rainbow Bars 5 Pack,£1.49
Food Cupboard,HARVEST MORN Cocoa Peanut Butter Ball Cereal Bar 5 Pack,£1.49
Food Cupboard,SNACKRITE Sour Cream & Chive Baked Pretzels 6 Pack,£1.25
Food Cupboard,SNACKRITE Salted Baked Pretzels 6 Pack,£1.25
Food Cupboard,GREAT BAKING Moroccan Almond Extract,£0.59
Food Cupboard,GREAT BAKING Valencian Orange Extract,£0.59
Food Cupboard,GREAT BAKING Sicilian Lemon Extract,£0.59
Food Cupboard,GREAT BAKING Hundreds & Thousands,£0.99
Food Cupboard,GREAT BAKING Coloured Strands,£0.99
Food Cupboard,GREAT BAKING Chocolate Sprinkles,£0.99
Food Cupboard,GREAT BAKING Blue Food Colouring,£0.69
Food Cupboard,GREAT BAKING Green Food Colouring,£0.69
Food Cupboard,GREAT BAKING Pink Food Colouring,£0.69
Food Cupboard,GREAT BAKING Red Food Colouring,£0.69
Food Cupboard,GREAT BAKING Yellow Food Colouring,£0.69
Food Cupboard,DOMINION Cola Bottles,£0.79
Food Cupboard,DOMINION Gummy Mix,£0.79
Food Cupboard,DOMINION Jelly Cherries,£0.79
Food Cupboard,DOMINION Teeth & Lips,£0.79
Food Cupboard,GREAT BAKING Party Candles 24 Pack,£0.79
Food Cupboard,BELMONT Milk Chocolate Chunky Biscuits 6 Pack,£1.85
Food Cupboard,BELMONT Orange Chunky Biscuits 6 Pack,£1.85
Food Cupboard,HARVEST MORN Choco Rice Cereal Bars 6 Pack,£0.99
Food Cupboard,HARVEST MORN Crisp Rice Cereal Bars 6 Pack,£0.99
Food Cupboard,HARVEST MORN Cornflakes Cereal Bars 6 Pack,£0.99
Food Cupboard,HARVEST MORN Salted Chocolate Nut Bars 3 Pack,£1.79
Food Cupboard,HARVEST MORN Peanut Butter Nut Bars 3 Pack,£1.79
Food Cupboard,HARVEST MORN Craze Cookies & Cream Cereal,£1.39
Food Cupboard,HARVEST MORN Craze Nutoka Chocolate Hazelnut Cereal,£1.39
Food Cupboard,HARVEST MORN Mixed Berry Flavour Porridge Pot,£0.37
Food Cupboard,GRANDESSA Smooth Squeezy Peanut Butter,£1.49
Food Cupboard,BRAMWELLS Lemon & Herb Peri Peri Bag n Bake Recipe Mix,£0.69
Food Cupboard,BRAMWELLS Hot Peri Peri Bag n Bake Recipe Mix,£0.69
Food Cupboard,BRAMWELLS Medium Peri Peri Bag n Bake Recipe Mix,£0.69
Food Cupboard,BRAMWELLS Smoky BBQ Peri Peri Bag n Bake Recipe Mix,£0.69
Food Cupboard,SAVOUR BAKES Caramel Rice Cakes,£0.89
Food Cupboard,HARVEST MORN S'mores Flavoured Cereal,£1.79
Food Cupboard,BELMONT Cherry Bakewell Flavour Jaffa Cakes 12 Pack,£0.99
Food Cupboard,HARVEST MORN Yogurt Coated Rice Cakes,£1.85
Food Cupboard,HARVEST MORN Milk Chocolate Coated Rice Cakes,£1.85
Food Cupboard,SAVOUR BAKES Corn Cake Rice Cakes,£0.79
Food Cupboard,SAVOUR BAKES Lightly Salted Rice Cakes,£0.79
Food Cupboard,BELMONT Milk Chocolate Digestives Minis 7 Pack,£1.29
Food Cupboard,THE PANTRY Chocolate Brownie Mix,£1.19
Food Cupboard,THE PANTRY Chocolate Chunk Cookie Mix,£1.19
Food Cupboard,THE PANTRY Vanilla Sponge Mix,£1.19
Food Cupboard,WORLDWIDE FOODS Heat & Eat Pesto Style Pasta Pouch,£0.95
Food Cupboard,WORLDWIDE FOODS Heat & Eat Mac & Cheese Pasta Pouch,£0.95
Food Cupboard,WORLDWIDE FOODS Heat & Eat Tomato & Basil Fusilli Pasta Pouch,£0.95
Food Cupboard,BELMONT Dino Biscuits 6 Pack,£0.69
Food Cupboard,BELMONT Unicorn Biscuits 6 Pack,£0.69
Food Cupboard,BELMONT Mini Jaffa Cakes,£1.09
Food Cupboard,BELMONT Mini Choc Chip Cookies,£1.09
Food Cupboard,BELMONT Mini Milk Chocolate Biscuits,£1.09
Food Cupboard,BELMONT Mini Wild Animals Biscuits,£1.09
Food Cupboard,BRAMWELLS Classic Soba Noodles Pot,£1.19
Food Cupboard,BRAMWELLS Chilli Flavour Soba Noodles Pot,£1.19
Food Cupboard,BRAMWELLS Yakitori Flavour Soba Noodles Pot,£1.19
Food Cupboard,EVERYDAY ESSENTIALS Tomato & Herb Pasta Sauce,£0.49
Food Cupboard,EVERYDAY ESSENTIALS Curry Sauce,£0.49
Food Cupboard,FREE FROM Milk Chocolate Digestives,£1.39
Food Cupboard,FREE FROM Digestives,£1.39
Food Cupboard,SNACKRITE Tangz Tangy Tomato Flavour Snacks,£0.85
Food Cupboard,SNACKRITE Prawn Cocktail Flavour Melts 6 Pack,£0.85
Food Cupboard,SNACKRITE Jalapeño & Cheese Ridged Crisps,£1.09
Food Cupboard,SNACKRITE Lightly Salted Combo Mix 6 Pack,£1.35
Food Cupboard,SNACKRITE Hot & Spicy Combo Mix 6 Pack,£1.35
Food Cupboard,HARVEST MORN Chocolate Protein Porridge Sachet,£1.39
Food Cupboard,HARVEST MORN Golden Syrup Protein Porridge Sachet,£1.39
Food Cupboard,DESSERT MENU Strawberry Flavoured Dessert Sauce,£0.89
Food Cupboard,DESSERT MENU Chocolate Flavour Dessert Sauce,£0.89
Food Cupboard,DESSERT MENU Toffee Flavour Dessert Sauce,£0.89
Food Cupboard,FREE FROM Vanilla Creams,£1.19
Food Cupboard,FREE FROM Cookie & Creams Biscuits,£1.19
Food Cupboard,BRAMWELLS Hot Honey,£1.39
Food Cupboard,BRAMWELLS Honey with Lime & Ginger,£1.39
Food Cupboard,BRAMWELLS Honey with Miso,£1.39
Food Cupboard,HARVEST MORN Raspberry & White Chocolate Crisp Cereal,£1.69
Food Cupboard,HARVEST MORN Maple & Pecan Crisp Cereal,£1.69
Food Cupboard,HARVEST MORN Triple Nut No Added Sugar Granola,£1.99
Food Cupboard,HARVEST MORN Apple & Berry No Added Sugar Granola,£1.99
Food Cupboard,SPECIALLY SELECTED Black Cherry Conserve,£1.89
Food Cupboard,SPECIALLY SELECTED Blueberry Conserve,£1.89
Food Cupboard,SPECIALLY SELECTED Apple & Blackcurrant Conserve,£1.89
Food Cupboard,BRAMWELLS Sweet Onion Metro Sauce,£1.49
Food Cupboard,BRAMWELLS Marinara Metro Sauce,£1.49
Food Cupboard,BRAMWELLS Chipotle Mayo Metro Sauce,£1.49
Food Cupboard,GRANDESSA Smooth Sweet & Salty Smooth Peanut Butter,£1.29
Food Cupboard,GRANDESSA Crunchy Sweet & Salty Crunchy Peanut Butter,£1.29
Food Cupboard,HEINZ Beanz in a Rich Tomato Sauce Snap Pots 4 Pack,£3.15
Food Cupboard,SNACK A JACKS Sour Cream Rice Snacks,£1.49
Food Cupboard,SNACK A JACKS Salt & Vinegar Rice Snacks 5 Pack,£1.49
Food Cupboard,HEINZ No Added Sugar Beanz in a Rich Tomato Sauce Snap Pots 4 Pack,£3.15
Food Cupboard,JAFFA CAKES Jaffa Cake Triple,£2.49
Food Cupboard,KELLOGG'S Smores Pop Tarts,£2.99
Food Cupboard,GREAT BAKING Spotty Cupcake Cases,£0.99
Food Cupboard,WRIGLEY'S Extra White Chewing Gum,£1.99
Food Cupboard,WRIGLEY'S Airwaves Menthol & Eucalyptus Sugarfree Chewing Gum,£1.99
Food Cupboard,FOUR SEASONS Sliced Mushrooms,£0.39
Food Cupboard,FOUR SEASONS Whole Button Mushrooms,£0.39
Food Cupboard,BRAMWELLS Buffalo Hot Sauce,£1.29
Food Cupboard,BRAMWELLS Honey Sriracha Hot Sauce,£1.29
Food Cupboard,BRAMWELLS Jalapeno & Lime Hot Sauce,£1.29
Food Cupboard,"READY, SET…COOK! Parsley",£0.65
Food Cupboard,"READY, SET…COOK! Cumin",£0.59
Food Cupboard,BRAMWELLS EXPRESS Chicken & Mushroom Flavour Snack Noodle,£0.69
Food Cupboard,"READY, SET…COOK! British Table Salt",£0.65
Food Cupboard,"READY, SET…COOK! Basil",£0.69
Food Cupboard,DELICIOUS DESSERTS Ready to Serve Custard,£0.55
Food Cupboard,"READY, SET…COOK! Crushed Chillies",£0.79
Food Cupboard,"READY, SET…COOK! Garlic Granules",£0.69
Food Cupboard,"READY, SET…COOK! Ground Cinnamon",£0.89
Food Cupboard,"READY, SET…COOK! Mixed Herbs",£0.59
Food Cupboard,"READY, SET…COOK! Chilli Powder",£0.79
Food Cupboard,"READY, SET…COOK! Cajun Seasoning",£0.59
Food Cupboard,"READY, SET…COOK! Chicken Seasoning",£0.85
Food Cupboard,NUTELLA Hazelnut Spread,£3.15
Food Cupboard,YE OLDE OAK Hot Dogs in Brine 8 Pack,£0.95
Food Cupboard,TUNNOCK'S Caramel Wafers 8 Pack,£2.25
Food Cupboard,CADBURY Twirl 5 Pack,£1.55
Food Cupboard,KINDER Kinder Snack Bar 6 Pack,£1.59
Food Cupboard,WEETABIX Weetabix Cereal 36 Pack,£3.99
Food Cupboard,"READY, SET…COOK! Italian Mixed Herbs",£0.69
Food Cupboard,MCVITIE'S Iced Gems 5 Pack,£0.99
Food Cupboard,"READY, SET…COOK! Onion Granules",£0.65
Food Cupboard,WALKERS Salted Crinkle Crisps,£1.49
Food Cupboard,WALKERS Cheddar & Onion Crinkle Crisps,£1.49
Food Cupboard,WEETABIX Weetabix Cereal 72 Pack,£6.45
Food Cupboard,"READY, SET…COOK! Ground Coriander",£0.65
Food Cupboard,"READY, SET…COOK! Peri Peri Seasoning",£0.75
Food Cupboard,"READY, SET…COOK! Bay Leaf",£0.49
Food Cupboard,"READY, SET…COOK! Sesame Seeds",£0.85
Food Cupboard,"READY, SET…COOK! All Purpose Seasoning",£0.79
Food Cupboard,WALKERS Variety Crisps Multipack 12 Pack,£3.05
Food Cupboard,"READY, SET…COOK! Chinese 5 Spice",£0.89
Food Cupboard,"READY, SET…COOK! Paprika",£0.69
Food Cupboard,"READY, SET…COOK! Smoked Paprika",£0.69
Food Cupboard,KELLOGG'S Corn Flakes Cereal,£2.29
Food Cupboard,"READY, SET…COOK! Cayenne Pepper",£0.59
Food Cupboard,BRAMWELLS EXPRESS Chicken Flavour Instant Noodles,£0.35
Food Cupboard,"READY, SET…COOK! Ground Ginger",£0.55
Food Cupboard,"READY, SET…COOK! Rosemary",£0.59
Food Cupboard,NUTOKA Hazelnut Spread,£1.65
Food Cupboard,KIT KAT Kitkat Chunky Snacksize Bars 4 Pack,£1.29
Food Cupboard,HARIBO Giant Strawbs,£1.19
Food Cupboard,HARIBO Super Mix,£1.19
Food Cupboard,HARIBO Tangfastics,£1.19
Food Cupboard,HARIBO Starmix,£1.19
Food Cupboard,"READY, SET…COOK! Dried Black Peppercorn Grinder",£1.65
Food Cupboard,"READY, SET…COOK! Salt Grinder",£1.65
Food Cupboard,"READY, SET…COOK! Whole Black Peppercorns",£1.59
Food Cupboard,"READY, SET…COOK! Ground Black Pepper",£1.59
Food Cupboard,"READY, SET…COOK! Ground White Pepper",£1.59
Food Cupboard,Good Grains French Inspired Lentils Pouch,£1.09
Food Cupboard,Good Grains Spanish Style Grains Pouch,£1.09
Food Cupboard,BELMONT BISCUIT CO Crunchy Biscuit Spread,£1.75
Food Cupboard,BELMONT BISCUIT CO Smooth Biscuit Spread,£1.75
Food Cupboard,"READY, SET…COOK! Khao Soi Meal Kit",£2.19
Food Cupboard,"READY, SET…COOK! Thai Green Curry Kit",£2.19
Food Cupboard,"READY, SET…COOK! Thai Red Curry Kit",£2.19
Food Cupboard,"READY, SET…COOK! Pad Thai Meal Kit",£2.19
Food Cupboard,"READY, SET…COOK! Medium Curry Powder",£0.89
Food Cupboard,"READY, SET…COOK! Mild Curry Powder",£0.89
Food Cupboard,"READY, SET…COOK! Garam Malasa Powder",£0.89
Food Cupboard,"READY, SET…COOK! Thyme",£0.65
Food Cupboard,HEINZ Cream of Tomato Soup 4 Pack,£3.69
Food Cupboard,HEINZ Cream of Chicken Soup 4 Pack,£3.69
Food Cupboard,MAOAM Stripes,£1.09
Food Cupboard,MAOAM Pinballs,£1.09
Food Cupboard,MAOAM Joystixx,£1.09
Food Cupboard,CADBURY Cadbury Dairy Milk,£1.45
Food Cupboard,CADBURY Cadbury Fruit & Nut,£1.45
Food Cupboard,CADBURY Crunchie Bars 4 Pack,£1.59
Food Cupboard,CADBURY Double Decker Bars 4 Pack,£1.59
Food Cupboard,MARS Mars 4 Pack,£1.75
Food Cupboard,MARS Snickers 4 Pack,£1.75
Food Cupboard,GOLDENVALE Multigrain Shapes Cereal,£1.79
Food Cupboard,"READY, SET…COOK! Garlic Purée",£0.85
Food Cupboard,"READY, SET…COOK! Chilli Purée",£0.85
Food Cupboard,"READY, SET…COOK! Ginger Purée",£0.85
Food Cupboard,SKITTLES Skittles,£0.95
Food Cupboard,SKITTLES Starburst,£0.95
Food Cupboard,SKINNY WHIP Mint Flavour Bars 5 pack,£0.95
Food Cupboard,SKINNY WHIP Toffee Flavour 5 pack,£0.95
Food Cupboard,"READY, SET…COOK! Mixed Spice",£0.59
Food Cupboard,"READY, SET…COOK! Ground Turmeric",£0.75
Food Cupboard,WRIGLEY'S Airwaves Menthol & Eucalyptus Sugarfree Chewing Gum 3 Pack,£1.39
Food Cupboard,WRIGLEY'S Extra White Bubblemint Chewing Gum 3 Pack,£1.39
Food Cupboard,WRIGLEY'S Extra Cool Breeze Sugarfree Chewing Gum 3 Pack,£1.39
Food Cupboard,WRIGLEY'S Extra Peppermint Sugarfree Chewing Gum 3 Pack,£1.39
Food Cupboard,WRIGLEY'S Extra Spearmint Sugarfree Chewing Gum 3 Pack,£1.39
Food Cupboard,STORCK Werther's Original Butter Candies,£1.19
Food Cupboard,STORCK Werther's Original Creamy Filling,£1.19
Food Cupboard,STORCK Werther's Original Butter Candies Sugar Free,£1.19
Food Cupboard,HEINZ Tomato Ketchup,£2.85
Food Cupboard,HEINZ Less Sugar & Salt Tomato Ketchup,£2.85
Food Cupboard,WALKERS Quavers Cheese Flavour Potato Snacks 12 Pack,£3.05
Food Cupboard,WALKERS Baked Wotsits 12 Pack,£3.05
Food Cupboard,SWIZZELS Original Raspberry & Milk Drumstick Squashies,£0.95
Food Cupboard,SWIZZELS Sour Cherry & Apple Flavour Drumstick Squashies,£0.95
Food Cupboard,KNOPPERS Milk Wafer Bars 4 Pack,£1.49
Food Cupboard,KNOPPERS NutBars 3 Pack,£1.49
Food Cupboard,"READY, SET…COOK! Tikka Masala Curry Paste",£1.55
Food Cupboard,"READY, SET…COOK! Korma Curry Paste",£1.55
Food Cupboard,"READY, SET…COOK! Thai Red Curry Paste",£1.35
Food Cupboard,"READY, SET…COOK! Thai Green Curry Paste",£1.35
Food Cupboard,WRIGLEY'S Extra Spearmint Sugarfree Chewing Gum,£1.99
Food Cupboard,WRIGLEY'S Extra Peppermint Sugarfree Chewing Gum,£1.99
Food Cupboard,WRIGLEY'S Extra White Bubblemint Chewing Gum,£1.99
Food Cupboard,THE BISCUIT COLLECTION American Chocolate Cookies,£0.99
Food Cupboard,THE BISCUIT COLLECTION American Hazelnut Cookies,£0.99
Food Cupboard,GREAT FOOD Garlic & Parsley Bruschetta,£1.09
Food Cupboard,GREAT FOOD Tomato & Oregano Bruschetta,£1.09
Food Cupboard,MCVITIE'S Gold Bars 7 Pack,£1.45
Food Cupboard,MCVITIE'S Milk Chocolate Digestive Biscuits,£2.59
Food Cupboard,MCVITIE'S Hobnobs Milk Chocolate Biscuits,£2.59
Food Cupboard,JACOBS Mini Cheddars Original 14 Pack,£2.89
Food Cupboard,JACOBS Mini Cheddars Red Leicester Flavour 14 Pack,£2.89
Food Cupboard,HEINZ Original Seriously Good Mayonnaise,£2.29
Food Cupboard,HEINZ Light Seriously Good Mayonnaise,£2.29
Food Cupboard,BRAMWELLS EXPRESS Curry Flavour Instant Noodles,£0.35
Food Cupboard,BRAMWELLS EXPRESS BBQ Beef Flavour Instant Noodles,£0.35
Food Cupboard,HEINZ Beanz in a Rich Tomato Sauce 3 Pack,£2.75
Food Cupboard,HEINZ No Added Sugar Beanz in a Rich Tomato Sauce 3 Pack,£2.75
Drinks,VIVE Diet Lemonade 6 Pack,£1.45
Drinks,THE JUICE COMPANY Smooth Orange Juice,£1.15
Drinks,THE JUICE COMPANY Apple Juice,£1.09
Drinks,AQUA VALE Still Spring Water 12 Pack,£1.75
Drinks,EVERYDAY ESSENTIALS Diet Lemonade,£0.39
Drinks,ALCAFÉ Rich Roast Instant Coffee Granules,£2.09
Drinks,ALCAFÉ Decaff Gold Roast Freeze Dried Coffee,£1.25
Drinks,AQUA VALE Sparkling Water 6 Pack,£1.19
Drinks,DIPLOMAT Red Label Tea Bags 160 Pack,£1.85
Drinks,DIPLOMAT Gold Label Tea Bags 80 Pack,£1.39
Drinks,DIPLOMAT Decaf Tea Bags 80 Pack,£1.29
Drinks,VIVE zX Cola,£0.49
Drinks,THE JUICE COMPANY Apple Juice,£1.75
Drinks,THE JUICE COMPANY Tropical Fruit Juice Drink,£1.49
Drinks,THE JUICE COMPANY Smooth Orange Juice From Concentrate,£1.45
Drinks,THE JUICE COMPANY Cranberry Juice Drink,£1.39
Drinks,THE JUICE COMPANY Summer Fruits Flavoured Juice Drink,£1.49
Drinks,THE JUICE COMPANY 100% Pure Pressed Orange Juice with Bits,£2.59
Drinks,THE JUICE COMPANY 100% Pure Pressed Smooth Orange Juice,£2.59
Drinks,THE JUICE COMPANY Smooth Orange Juice From Concentrate,£2.19
Drinks,AQUA VALE Sparkling Water 4 Pack,£1.55
Drinks,AQUA VALE Still Water 6 Pack,£2.25
Drinks,THE JUICE COMPANY Multivitamin Boost Juice,£1.99
Drinks,THE JUICE COMPANY 100% Pure Pressed Orange Juice with Bits,£1.75
Drinks,ALCAFÉ Latte Instant Sachets 8 Pack,£0.99
Drinks,THE JUICE COMPANY 100% Pure Pressed Smooth Orange Juice,£1.75
Drinks,VIVE Lemon Zero Sugar 6 Pack,£1.99
Drinks,VIVE Twisted Fruits Zero Sugar 6 Pack,£1.99
Drinks,VIVE Cola 6 Pack,£1.69
Drinks,VIVE Orange Zero,£1.99
Drinks,VIVE Tropical Blast 6 Pack,£1.99
Drinks,VIVE zX Cola 6 Pack,£1.69
Drinks,VIVE Diet Cola 6 Pack,£1.69
Drinks,EVERYDAY ESSENTIALS Orange Juice,£0.89
Drinks,EVERYDAY ESSENTIALS Apple Juice,£0.89
Drinks,THE JUICE COMPANY Apple Juice From Concentrate 6 Pack,£1.79
Drinks,THE JUICE COMPANY Smooth Orange Juice From Concentrate 6 Pack,£1.79
Drinks,EVERYDAY ESSENTIALS Still Spring Water,£0.39
Drinks,EVERYDAY ESSENTIALS Sparkling Spring Water,£0.39
Drinks,DIPLOMAT Soothing & Refreshing Peppermint Infusion Bags 40 Pack,£1.19
Drinks,DIPLOMAT Zingy & Warming Lemon & Ginger Infusion Bags 40 Pack,£1.19
Drinks,DIPLOMAT Delicate & Calming Camomile Tea Bags 40 Pack,£1.19
Drinks,DIPLOMAT Vibrant & Fruity Berry Fruits Infusion Bags 40 Pack,£1.19
Drinks,DIPLOMAT Delicious & Refreshing Rooibos Infusion Bags 40 Pack,£1.19
Drinks,VIVE Orange Zero Sugar,£0.69
Drinks,VIVE Tropical Blast Zero Sugar,£0.69
Drinks,AQUA VALE Lemon & Lime Flavoured Still Spring Water 4 Pack,£1.45
Drinks,AQUA VALE Strawberry Flavoured Still Spring Water 4 Pack,£1.45
Drinks,VIVE Diet Lemonade,£0.49
Drinks,VIVE Lemonade,£0.49
Drinks,SUN QUENCH Double Strength Apple & Blackcurrant Squash,£0.99
Drinks,SUN QUENCH Double Strength Orange Squash,£0.99
Drinks,SUN QUENCH Double Strength Summer Fruits Squash,£0.99
Drinks,SUN QUENCH FRUITY BLAST 50% Hi Juice Apple Squash,£1.39
Drinks,SUN QUENCH FRUITY BLAST 50% Hi Juice Orange Squash,£1.39
Drinks,SUN QUENCH FRUITY BLAST 50% Hi Juice Summer Fruits Squash,£1.39
Drinks,SUN QUENCH FRUITY BLAST 50% Hi Juice Blackcurrant Squash,£1.39
Drinks,SUN QUENCH Apple & Blackcurrant Super Concentrated Squirty Squash,£1.49
Drinks,SUN QUENCH Orange Super Concentrated Squirty Squash,£1.49
Drinks,SUN QUENCH Summer Fruits Super Concentrated Squirty Squash,£1.49
Drinks,SPECIALLY SELECTED Rich & Fragrant Earl Grey Speciality Tea Bags 50 Pack,£1.25
Drinks,SPECIALLY SELECTED Rich & Smooth English Breakfast Fine Tea 50 Pack,£1.25
Drinks,SPECIALLY SELECTED Strong & Satisfying Assam Fine Tea 50 Pack,£1.25
Drinks,CHOCEUR Instant Hot Chocolate Drink,£1.99
Drinks,VIVE Diet Cola,£0.49
Drinks,VIVE Cola,£0.49
Drinks,SUN QUENCH Strawberry & Watermelon Fruit Fusions Squash,£1.09
Drinks,SUN QUENCH Peach & Raspberry Fruit Fusions Squash,£1.09
Drinks,SUN QUENCH FRUITY BLAST Double Strength Lemon Squash,£0.99
Drinks,SUN QUENCH FRUITY BLAST Double Strength Orange & Pineapple Squash,£0.99
Drinks,SUN QUENCH FRUITY BLAST Double Strength Cherries & Berries Squash,£0.99
Drinks,DIPLOMAT Detox Herbal Tea 20 Pack,£1.59
Drinks,DIPLOMAT Immune Herbal Tea Bags 20 Pack,£1.59
Drinks,DIPLOMAT Sleep Herbal Tea Bags 20 Pack,£1.59
Drinks,DIPLOMAT Glow Tea Bags 20 Pack,£1.59
Drinks,AQUA VALE Strawberry Flavoured Still Water,£0.55
Drinks,AQUA VALE Orange & Peach Flavoured Still Water,£0.55
Drinks,AQUA VALE Lemon & Lime Flavoured Still Water,£0.55
Drinks,SPECIALLY SELECTED Single Origin 100% Arabica Medium Roast Colombian Coffee Capsules 10 Pack,£1.85
Drinks,SPECIALLY SELECTED Single Origin 100% Arabica Dark Roast Costa Rican Coffee Capsules 10 Pack,£1.85
Drinks,ALCAFÉ Cappuccino Instant Sachets 8 Pack,£1.05
Drinks,ALCAFÉ Unsweetened Cappuccino Instant Sachets 8 Pack,£1.05
Drinks,SUN QUENCH Apple & Raspberry Fruity Water Drink 8 Pack,£1.69
Drinks,SUN QUENCH Blackcurrant Fruity Water Drink 8 Pack,£1.69
Drinks,SUN QUENCH Orange & Pineapple Fruity Water Drink 8 Pack,£1.69
Drinks,THE JUICE COMPANY Cranberry Juice Drink,£1.09
Drinks,THE JUICE COMPANY No Added Sugar Cranberry Juice Drink,£1.09
Drinks,"THE JUICE COMPANY Oranges, Mangoes & Pinapples Smoothies 4 Pack",£1.55
Drinks,"THE JUICE COMPANY Strawberries, Raspberries & Apples Kids Smoothies 4 Pack",£1.55
Drinks,THE JUICE COMPANY Apple & Blackcurrant Kids Smoothies 4 Pack,£1.55
Drinks,SPECIALLY SELECTED 100% Freshly Squeezed Smooth Orange Juice,£2.75
Drinks,SPECIALLY SELECTED 100% Freshly Squeezed Orange Juice with Bits,£2.75
Drinks,THE JUICE COMPANY Strawberry & Banana Smoothie,£1.59
Drinks,THE JUICE COMPANY Mango & Passion Fruit Smoothie,£1.59
Drinks,"THE JUICE COMPANY Pineapple, Banana & Coconut Smoothie",£1.59
Drinks,"THE JUICE COMPANY Guavas, Pineapples & Apples Smoothie",£1.59
Drinks,THE JUICE COMPANY 100% Pressed Apple Juice,£0.99
Drinks,THE JUICE COMPANY 100% Pure Pressed Orange Juice with Bits,£0.99
Drinks,THE JUICE COMPANY 100% Pure Pressed Smooth Orange Juice,£0.99
Drinks,THE JUICE COMPANY Multivitamin Boost Juice,£0.99
Drinks,VIVE Indian Tonic Water,£0.49
