Category,Name,Price,Price_Numeric
Food Cupboard,ASDA Organic Organic Wholewheat Spaghetti 500g,£1.14,1.14
Food Cupboard,ASDA Organic Strong White Bread Flour 1kg,£1.58,1.58
Food Cupboard,ASDA Passata with Garlic 500g,£0.81,0.81
Food Cupboard,ASDA Pear Halves in Fruit Juice 410g,£1.10,1.1
Food Cupboard,ASDA Pickled Baby Gherkins 340g,£1.13,1.13
Food Cupboard,ASDA Pickled Red Cabbage 420g,£1.40,1.4
Food Cupboard,ASDA Pink Frosting 300g,£1.48,1.48
Food Cupboard,ASDA Pitted Green Olives 310g,£1.25,1.25
Food Cupboard,ASDA Pork Luncheon Meat 250g,£1.70,1.7
Food Cupboard,ASDA Salt & Pepper Crackers 185g,£1.25,1.25
Food Cupboard,ASDA Salt & Vinegar Rice Cakes 129g,£0.84,0.84
Food Cupboard,ASDA Salted Caramel Flavour Frappe 150g,£2.00,2.0
Food Cupboard,ASDA Salted Chocolate Trail Mix 150g,£1.84,1.84
Food Cupboard,ASDA Savoury Worcester Sauce 150ml,£1.25,1.25
Food Cupboard,ASDA Sesame Seeds 150g,£1.72,1.72
Food Cupboard,ASDA Shortbread Fingers 210g,£1.25,1.25
Food Cupboard,ASDA Sour Cream 280g,£1.65,1.65
Food Cupboard,ASDA Straight to Wok Noodles 300g,£1.00,1.0
Food Cupboard,ASDA Straight to Wok Wholewheat Noodles 300g,£1.15,1.15
Food Cupboard,ASDA Sweet & Salted Popcorn 100g,£0.90,0.9
Food Cupboard,ASDA Sweet & Sour Stir-Fry Sauce 120g,£0.65,0.65
Food Cupboard,ASDA Taco Seasoning,£1.00,1.0
Food Cupboard,ASDA Tangy Lemon Curd 411g,£1.17,1.17
Food Cupboard,ASDA Thai Style Crackers 70g,£1.26,1.26
Food Cupboard,ASDA Tomato & Bacon Pasta Bake 480g,£0.75,0.75
Food Cupboard,ASDA Tomato & Basil Stir-In Sauce 190g,£1.48,1.48
Food Cupboard,ASDA Tuna Chunks in Brine 4 x 145g (580g),£2.49,2.49
Food Cupboard,ASDA Tuna Chunks in Spring Water 145g,£0.65,0.65
Food Cupboard,ASDA Tuna Mayo Paste 75g,£0.60,0.6
Food Cupboard,ASDA Tuna Steak in a Litte Brine 110g,£1.52,1.52
Food Cupboard,ASDA Tuna Steak in a Little Spring Water 110g,£1.52,1.52
Food Cupboard,ASDA Tuna Steak in a Little Spring Water 3 x 110g (330g),£3.15,3.15
Food Cupboard,ASDA Tuna Steak in a Little Sunflower Oil 3 x 110g (330g),£3.15,3.15
Food Cupboard,ASDA Tuna Steaks in a Little Sunflower Oil 110g,£1.52,1.52
Food Cupboard,ASDA Turkish Delight Thins 180g,£2.14,2.14
Food Cupboard,ASDA White Chocolate Buttons 30g,£0.55,0.55
Food Cupboard,ASDA White Mocha Flavour Frappe 150g,£2.00,2.0
Food Cupboard,ASDA Whole Cucumber,£0.99,0.99
Food Cupboard,ASDA Wild Alaskan Pink Salmon 105g,£1.83,1.83
Food Cupboard,Al Fez Harissa Paste 180g,£2.76,2.76
Food Cupboard,Al'Fez Shawarma Spice Mix 25g,£1.35,1.35
Food Cupboard,Allinson Fast Action Yeast 100g,£1.50,1.5
Food Cupboard,Allinson Strong White Bread Flour 3kg,£3.40,3.4
Food Cupboard,Alpen No Added Sugar Muesli Breakfast Cereal 550g,£3.00,3.0
Food Cupboard,Alpen No Added Sugar Muesli Breakfast Cereal 950g,£3.98,3.98
Food Cupboard,Alpro Chocolate Dairy Free Vegan Soya Dessert 4x125g,£1.75,1.75
Food Cupboard,Ambrosia Ready to Eat Porridge Oat Cereal Pot Apple & Blueberry Layer 210g,£1.28,1.28
Food Cupboard,Ambrosia Ready to Eat Porridge Oat Cereal Pot Golden Syrup 210g,£1.28,1.28
Food Cupboard,Argal Argal Chorizo Doux Mild 200g,£2.77,2.77
Food Cupboard,Atora Shredded Vegetable Suet 200g,£2.72,2.72
Food Cupboard,Aunt Bessie's Gluten Free Ready to Bake Crumble Mix 225g,actual price£1.50,1.5
Food Cupboard,Aunt Bessie's Ready to Bake Crumble Mix 400g,£1.08,1.08
Food Cupboard,BAKE by ASDA BAKE by ASDA Bicarbonate of Soda 200g,£0.65,0.65
Food Cupboard,BAKE by ASDA BAKE by ASDA Rainbow Sprinkles 65g,£1.21,1.21
Food Cupboard,BEAR Fruit Gently Baked Strawberries 90g,£2.00,2.0
Food Cupboard,Barilla Pasta Gluten Free Fusilli 400g,£2.50,2.5
Food Cupboard,Barratt Pick 'n' Mix Liquorice Novelties 400g,actual price£2.75,2.75
Food Cupboard,Batchelors Cup a Soup Chicken 4 Instant Soup Sachets 81g,£1.64,1.64
Food Cupboard,Batchelors Pasta 'n' Sauce Microwave Ready Meal Cheesy Pasta 200g,£1.98,1.98
Food Cupboard,Batchelors Super Noodles Chinese Salt & Pepper Chicken  Instant Noodle Pot 75g,actual price£0.90,0.9
Food Cupboard,Batchelors Super Rice Beef Flavour Packet Rice 90g,£0.85,0.85
Food Cupboard,Batchelors Super Rice Chicken Flavour packet rice 90g,£0.85,0.85
Food Cupboard,Baxters Favourites Pea & Ham 400g,£2.15,2.15
Food Cupboard,Baxters Sliced Beetroot 567g,£2.47,2.47
Food Cupboard,Ben's Original Bens Original Special Fried Microwave Rice 220g,£1.32,1.32
Food Cupboard,Ben's Original Bens Original Takeaway Chinese Fried Rice Microwave Rice 450g,£1.95,1.95
Food Cupboard,Ben's Original Bens Original Wholegrain Spicy Mexican Microwave Rice 220g,£1.32,1.32
Food Cupboard,Ben's Original Roasted Garlic Microwave Rice 220g,£1.32,1.32
Food Cupboard,Ben's Original Smokey BBQ Microwave Rice 220g,£1.32,1.32
Food Cupboard,Bertolli Air Fryer Cooking Olive Oil 200ml,£4.58,4.58
Food Cupboard,Betty Crocker Country Carrot Cake Mix 425g,actual price£2.48,2.48
Food Cupboard,Bisto Gluten Free Gravy Granules 175g,£3.78,3.78
Food Cupboard,Blue Dragon Thai Green Curry Paste 170g,£2.17,2.17
Food Cupboard,Blue Dragon Wide Noodles Wok Ready  300g,£1.77,1.77
Food Cupboard,Blue Riband Wafer Biscuit 6 Pack Multipack 108g,£0.97,0.97
Food Cupboard,Bonne Maman Apricot Conserve 370g,£3.58,3.58
Food Cupboard,Border Butterscotch Crunch 135g,£1.43,1.43
Food Cupboard,"Branston Spaghetti Loops in a Rich, Thick, Tomatoey Sauce 390g",£0.98,0.98
Food Cupboard,COOK by ASDA Cook Chinese 5 Spice 30g,£1.00,1.0
Food Cupboard,COOK by ASDA Cook Coarse Ground Black Pepper 45g,£1.43,1.43
Food Cupboard,COOK by ASDA Cook Crushed Chillies 28g,£1.00,1.0
Food Cupboard,COOK by ASDA Cook Garam Masala Spice Blend 92g,£1.00,1.0
Food Cupboard,COOK by ASDA Cook Garlic Granules 115g,£1.30,1.3
Food Cupboard,COOK by ASDA Cook Garlic Salt 85g,£1.00,1.0
Food Cupboard,COOK by ASDA Cook Ground Nutmeg 42g,£1.00,1.0
Food Cupboard,COOK by ASDA Cook Hot Chilli Powder 44g,£1.00,1.0
Food Cupboard,COOK by ASDA Cook Mixed Herbs 12g,£1.00,1.0
Food Cupboard,COOK by ASDA Cook Onion Granules 50g,£1.00,1.0
Food Cupboard,COOK by ASDA Cook Paprika 46g,£1.00,1.0
Food Cupboard,COOK by ASDA Cook Smoked Paprika 45g,£1.00,1.0
Food Cupboard,COOK by ASDA Cook Whole Black Peppercorn Grinder 50g,£2.84,2.84
Food Cupboard,COOK by ASDA CookTurmeric Ground 45g,£1.00,1.0
Food Cupboard,Cadbury Boost Chocolate Bar 48.5g,£0.75,0.75
Food Cupboard,Cadbury Bournville Chopped Hazelnut Dark Chocolate Bar 100g,£1.84,1.84
Food Cupboard,Cadbury Cadbury Dairy Milk Happy Birthday Gifting Bar Large 360 g,£5.00,5.0
Food Cupboard,Cadbury Curly Wurly Chocolate Bar 4 Pack Multipack 86g (4 x 21.5g),£1.37,1.37
Food Cupboard,Cadbury Dairy Milk Chocolate Bar 45g,£0.75,0.75
Food Cupboard,Cadbury Dairy Milk Fruit and Nut Chocolate Bar 180 g,actual price£2.00,2.0
Food Cupboard,Cadbury Dairy Milk Little Bar Chocolate 18g,£0.38,0.38
Food Cupboard,Cadbury Delights Chocolate Salted Caramel 5 Pack Multipack 110g (5 x 22g),actual price£1.50,1.5
Food Cupboard,Cadbury Fudge Chocolate Bar 4 Pack Multipack 88 g (4 x 22g),£1.37,1.37
Food Cupboard,Cadbury Instant Hot Chocolate Drink Jar 300g,£3.49,3.49
Food Cupboard,Cadbury Instant Hot Chocolate Drink Sachet 28g,£0.47,0.47
Food Cupboard,Cadbury Mini Fingers Chocolate Biscuits 5 Pack Multipack 96.5g (5 x 19.3g),£1.48,1.48
Food Cupboard,Cadbury Twirl Milk Chocolate 9 Pack Multipack 193.5 g,£2.98,2.98
Food Cupboard,Cadbury White Oreo Chocolate Bar 120 g,£1.93,1.93
Food Cupboard,Cadbury Wispa Chocolate Bar 4 Pack Multipack 111g (4 x 27.75g),actual price£1.50,1.5
Food Cupboard,Cake Decor Edible Eyes 25g,£1.62,1.62
Food Cupboard,Canderel Sugarly Granulated Sweetener 275g,£2.97,2.97
Food Cupboard,Cape Herb & Spice Rub Texan Steakhouse Seasoning 100g,£3.95,3.95
Food Cupboard,Capsicana Latin Flavour Mexican Style Sweet Mango Salsa 280g,£2.85,2.85
Food Cupboard,Capsicana Latin Flavour Mexican Style Tasty Taco Seasoning Mix 28g,£0.94,0.94
Food Cupboard,Carnation Sweetened Condensed Milk 397g Tin,£1.68,1.68
Food Cupboard,Cheetos Cheese Flavour Corn Snacks 85g,£1.87,1.87
Food Cupboard,Colman's Classic Comforts Beef Casserole Meal Maker 40 g,£1.00,1.0
Food Cupboard,Colman's Midweek Meals Meal Maker Tuna Pasta Bake 44 g,£1.00,1.0
Food Cupboard,Colman's Weekend Wonders Meal Maker Chinese Chicken Curry 47 g,£1.00,1.0
Food Cupboard,Costa Intense Amazonian Blend Coffee Beans 200g,£4.50,4.5
Food Cupboard,Crosse & Blackwell Cream of Roasted Mushroom Soup 400g,£1.00,1.0
Food Cupboard,Dairy Box The Classic Collection Chocolate Box 322g,actual price£6.00,6.0
Food Cupboard,Del Monte Prunes in Juice 410g,£1.20,1.2
Food Cupboard,Dole Peach in Juice 665g,£3.00,3.0
Food Cupboard,Dolmio Bolognese Smooth Tomato Pasta Sauce 450g,£2.47,2.47
Food Cupboard,Domo Mango Flavor Jelly 85g,£0.98,0.98
Food Cupboard,Don Mario Peeled Plum Tomatoes in Tomato Juice 400g,£0.65,0.65
Food Cupboard,Dr. Oetker Old School Cake Mix Vanilla 436g,£2.97,2.97
Food Cupboard,Dr. Oetker Vege-Gel 3 x 6.5g,£1.30,1.3
Food Cupboard,Drink Me Chai Vegan Chai Latte 250g,actual price£2.85,2.85
Food Cupboard,Encona Thai Sriracha Chilli Sauce 142ml,£1.68,1.68
Food Cupboard,Exceptional by  ASDA Roasted Garlic & Herb Passata 430g,actual price£1.25,1.25
Food Cupboard,Exceptional by ASDA All-Butter Pastry Case,£2.42,2.42
Food Cupboard,Exceptional by ASDA Bramley Apple Sauce with Kentish Cider 210g,£1.85,1.85
Food Cupboard,Exceptional by ASDA Exceptional 8 Meringue Nests,£1.62,1.62
Food Cupboard,"Exceptional by ASDA Exceptional by  Brisling Sardines with Lemon, Dill and Black Pepper 105g",£1.20,1.2
Food Cupboard,Exceptional by ASDA Exceptional by  Canadian Amber Maple Syrup 250g,£4.72,4.72
Food Cupboard,Exceptional by ASDA Madagascan Dark Chocolate 100g,£2.28,2.28
Food Cupboard,Exceptional by ASDA Valencian Orange Extract 60ml,£1.47,1.47
Food Cupboard,Exceptional by Asda Colombian Roast Coffee Beans 227g,£3.98,3.98
Food Cupboard,Exceptional by Asda Peruvian Roast Ground Coffee 227g,£3.98,3.98
Food Cupboard,FUEL10K Chocolate Protein Cereal Oat Bars 3x45g,£2.68,2.68
Food Cupboard,FUEL10K FUEL 10K Banana High Protein Milk Breakfast Shake Drink 330ml,£1.28,1.28
Food Cupboard,Ferrero Rocher Milk Chocolate Bar 90g,actual price£2.00,2.0
Food Cupboard,Ferrero Rocher Milk Chocolate Hazelnut Pralines Gift Box of Chocolates 24 Pieces 300g,actual price£6.50,6.5
Food Cupboard,Fibre One 90 Calorie Lemon Drizzle Squares 4 x 24g (96g),£2.08,2.08
Food Cupboard,Filippo Berio Balsamic Vinegar of Modena 250ml,actual price£2.48,2.48
Food Cupboard,Forest Feast Berries & Cherries 170g,£3.33,3.33
Food Cupboard,Fox's Biscuits Ginger Crunch Creams 200g,£1.06,1.06
Food Cupboard,Fox's Chocolatey Biscuits Viennese Milk Chocolate Dipped Fingers 105g,£2.25,2.25
Food Cupboard,Fray Bentos Steak & Gravy 425g,£3.15,3.15
Food Cupboard,Fray Bentos Steak & Kidney 425g,£3.15,3.15
Food Cupboard,Fry's Turkish Delight Chocolate Bar 3 Pack Multipack 153g (3 x 51g),£1.63,1.63
Food Cupboard,Fuel10K FUEL10K Ready to Eat Protein Porridge Oat Cereal Pot Chocolate 210g,£1.28,1.28
Food Cupboard,Galaxy Biscuits Milk Chocolate Digestives 300g,£1.98,1.98
Food Cupboard,Galaxy Caramel Milk Chocolate Bar 135g,actual price£1.65,1.65
Food Cupboard,Galaxy Dairy Free & Vegan Classic Chocolate Bar 100g,£2.85,2.85
Food Cupboard,Galaxy Dairy Free & Vegan Honeycomb Chocolate Bar 40g,£1.00,1.0
Food Cupboard,Galaxy Milk Chocolate Bar 180g,£2.97,2.97
Food Cupboard,Goplana Jezyki Classic Biscuits 140g,actual price£1.57,1.57
Food Cupboard,Graze Cocoa Vanilla Oat Boosts Flapjacks 120g (4 x 30g),£2.12,2.12
Food Cupboard,Graze Sticky Toffee Oat Boosts Flapjacks 120g  (4 x 30g),£2.12,2.12
Food Cupboard,Hartley's 10 Cal Orange Flavour Jelly 175g,£0.84,0.84
Food Cupboard,Hartley's Blackcurrant Flavour Jelly 4 x 115g (460g),£2.50,2.5
Food Cupboard,Hartley's Blackcurrant Flavour Jelly 4 x 125g (500g),£2.50,2.5
Food Cupboard,Hartley's Jelly Strawberry Flavour 125g,£0.78,0.78
Food Cupboard,Hartley's Strawberry Flavour Jelly 460g (4 x 115g),£2.50,2.5
Food Cupboard,Heinz Baked Beans 4 x 415g,£3.88,3.88
Food Cupboard,Heinz Cream of Tomato & Basil Cup Soup 4 x 22g (88g),£1.50,1.5
Food Cupboard,Heinz Cream of Tomato Soup 400g,£1.64,1.64
Food Cupboard,Heinz Lentil Tinned Soup 400g,£1.64,1.64
Food Cupboard,Heinz Light Mayonnaise 490g,actual price£1.98,1.98
Food Cupboard,Heinz Tomato Ketchup Zero Added Sugar & Salt 400ml,£2.98,2.98
Food Cupboard,Heinz Vegetable Soup 4 x 400g,£3.75,3.75
Food Cupboard,Hellmann's Light Mayonnaise 400 g,£2.48,2.48
Food Cupboard,Hellmann's Light Mayonnaise 750 ml,actual price£3.00,3.0
Food Cupboard,Hilltop Blossom Honey 720g,£3.85,3.85
Food Cupboard,Horlicks Chocolate 32g,£0.37,0.37
Food Cupboard,Horlicks Chocolate Hot Malty Goodness 400g,£3.50,3.5
Food Cupboard,Horlicks Instant 32g,£0.34,0.34
Food Cupboard,Hula Hoops Cheese & Onion Multipack Crisps 6 Pack SRP,£1.84,1.84
Food Cupboard,Idahoan Perfect Mash Butter & Herb Flavoured 109g,actual price£1.25,1.25
Food Cupboard,JUST ESSENTIALS by ASDA Chunky Chicken in White Sauce 392g,£1.90,1.9
Food Cupboard,JUST ESSENTIALS by ASDA Just Essentials Chicken & Mushroom Flavour Cup Noodles 70g,£0.54,0.54
Food Cupboard,JUST ESSENTIALS by ASDA Just Essentials Mixed Herbs 18g,£0.66,0.66
Food Cupboard,JUST ESSENTIALS by ASDA Just Essentials Peach Slices in Light Syrup 411g,£0.45,0.45
Food Cupboard,Jacob's Baked Cheddars Cheese Crackers 150g,£1.48,1.48
Food Cupboard,Jacob's Biscuits for Cheese 8 Variety Assortment 300g,£2.98,2.98
Food Cupboard,Jacob's Bites Sweet Chilli & Sour Cream Crackers 125g,actual price£1.25,1.25
Food Cupboard,"Jacob's TUC Original Crackers Twin Pack 2x150g, 300g",£2.50,2.5
Food Cupboard,John West Sardines in Spicy Tomato Sauce 120g,£1.37,1.37
Food Cupboard,John West Specialities Smoked Oysters in Sunflower Oil 85g,£2.64,2.64
Food Cupboard,Jordans No Added Sugar Apple & Berry Granola Breakfast Cereal 425g,actual price£3.00,3.0
Food Cupboard,KP Dry Roasted Peanuts 415g,£4.50,4.5
Food Cupboard,Kallo Lentil & Pea Veggie Cakes Thai Curry 122g,£2.74,2.74
Food Cupboard,Kellogg's Bran Flakes Breakfast Cereal 750g,£3.00,3.0
Food Cupboard,Kellogg's Coco Pops Chocolate Breakfast Cereal 295g,£2.35,2.35
Food Cupboard,Kellogg's Coco Pops Chocolate Breakfast Cereal 420g,actual price£2.85,2.85
Food Cupboard,Kellogg's Frosties Breakfast Cereal 470g,£3.50,3.5
Food Cupboard,Kellogg's Sultana Bran Breakfast Cereal 6 x 500g,£2.50,2.5
Food Cupboard,Kellogg's Variety Breakfast Cereal 8pk 196g,actual price£1.75,1.75
Food Cupboard,Kenco Iced Hot Salted Caramel Latte Instant Coffee Sachets x20,£4.00,4.0
Food Cupboard,Kenco Iced Hot Vanilla Matcha Latte Sachets x8,£2.37,2.37
Food Cupboard,Kenco Latte Instant Coffee Sachets 8x16.3g (130.4g),£1.90,1.9
Food Cupboard,Kenco Millicano Original Instant Coffee 100g,actual price£3.50,3.5
Food Cupboard,Kikkoman Less Salt Soy Sauce 150ml,£3.00,3.0
Food Cupboard,Kinder Milk Chocolate Fun Size Treat Snack Bars Multipack 8 x 12.5g,£1.56,1.56
Food Cupboard,Kingfisher Sardines in Sunflower Oil 120g,£0.75,0.75
Food Cupboard,Kingfisher Sardines in Tomato Sauce 120g,£0.75,0.75
Food Cupboard,Knorr Chicken Stock Cubes 8x 10g,£1.90,1.9
Food Cupboard,L'OR Espresso Lungo Profondo Coffee Pods x40 Intensity 8,£8.57,8.57
Food Cupboard,La Vieja Fábrica Seville Orange Fine Cut Marmalade 365g,£1.70,1.7
Food Cupboard,Lancashire Tea 80 Biodegradable Tea Bags 250g,£2.18,2.18
Food Cupboard,Lavazza Decaf My Easy Day Ground Coffee,£5.50,5.5
Food Cupboard,Lindt Excellence Dark 70% Cocoa Chocolate Bar 100g,actual price£3.00,3.0
Food Cupboard,Lindt Lindor Limited Edition Irish Cream 200g,£5.00,5.0
Food Cupboard,Lindt Lindor Milk Treat Bar Multipack 4x25g,actual price£2.50,2.5
Food Cupboard,Lindt Lindor Raspberry & Cream Chocolate Truffles Box 200g,actual price£5.50,5.5
Food Cupboard,Lotus Biscoff Smooth 720g,actual price£4.50,4.5
Food Cupboard,Loyd Grossman Bolognese Original Pasta Sauce 660g,actual price£3.25,3.25
Food Cupboard,Loyd Grossman Creamy Tomato & Parmigiano Reggiano Tomato Pasta Sauce 290g,£2.45,2.45
Food Cupboard,Loyd Grossman No Added Sugar Red Tomato Lasagne Pasta Sauce 450g,£2.50,2.5
Food Cupboard,Loyd Grossman Pomodoro & Fresh Basil Tomato Pasta Sauce 290g,£3.25,3.25
Food Cupboard,Lyle's Golden Syrup Pouring 700g,£2.40,2.4
Food Cupboard,M&M's Crispy Milk Chocolate Party Mix Bulk Snack Bag 675g,£9.87,9.87
Food Cupboard,M&M's Crispy More to Share Chocolate Bag 187g,actual price£2.65,2.65
Food Cupboard,Maggi Air Fryer Crispy Coating Katsu Style 70g,£0.70,0.7
Food Cupboard,Maggi Juicy Aromatic Garlic Chicken Herbs and Spices Recipe Mix 30g,£0.70,0.7
Food Cupboard,Mallow & Marsh Milk Chocolate Over Vanilla Mallows 100g,£2.50,2.5
Food Cupboard,Maoam MaoMixx Assorted Chewy Sweets Bag 350g,£2.98,2.98
Food Cupboard,Maoam Stripes Fruit & Cola Flavour Chewy Sweets Sharing Bag 140g,£1.07,1.07
Food Cupboard,Maryland Cookies Chocolate Chip Twin Pack 400g,£2.20,2.2
Food Cupboard,Maryland Cookies White Chocolate Chip 200g,actual price£1.00,1.0
Food Cupboard,McVitie's Milk Chocolate Hobnobs Biscuits - The Oaty One 431g,actual price£2.50,2.5
Food Cupboard,McVitie's Rich Tea Classic Biscuits 300g,£1.88,1.88
Food Cupboard,McVitie's Tasties Bourbon Cream Biscuits 300g,£1.14,1.14
Food Cupboard,McVitie's Tasties Custard Cream Biscuits 300g,£1.00,1.0
Food Cupboard,Mieszko Cream Fudge 215g,£1.94,1.94
Food Cupboard,Monin Vanilla from Madagascar Syrup for Speciality Coffee 25cl,£2.95,2.95
Food Cupboard,Mr Freeze Jubbly Cola Ice Lollies 8 x 62ml,£1.60,1.6
Food Cupboard,Mug Shot Italian Inspired Pasta Creamy Carbonara 60g,£0.68,0.68
Food Cupboard,Mug Shot Roast Chicken Flavour Pasta 60g,£0.50,0.5
Food Cupboard,Munchies Fudgey Salted Caramel Flavour 97g,£1.97,1.97
Food Cupboard,NOMO Birthday Cake 127g,£3.90,3.9
Food Cupboard,NYCoffee 3in1 Salted Caramel Flavour (14 x 10) 140g,£1.04,1.04
Food Cupboard,Nairn's Delightfully Intense Stem Ginger Oat Biscuit Breaks 160g,actual price£1.66,1.66
Food Cupboard,Nakd nakd. Bakewell Tart Fruit & Nut Bars 3 x 35g,£2.20,2.2
Food Cupboard,Nakd nakd. Berry Delight Fruit & Nut Bars 3x35g,£2.20,2.2
Food Cupboard,Nakd nakd. Cocoa Orange Fruit & Nut Bars 3 x 35g,£2.20,2.2
Food Cupboard,Naked Noodle Chinese Style Hot & Sour Ramen Noodle Soup 25g,£0.48,0.48
Food Cupboard,Nando's Garlic Peri-Peri Sauce 500g,actual price£3.00,3.0
Food Cupboard,Nando's Garlic Perinaise Peri-Peri Mayo 465g,actual price£3.00,3.0
Food Cupboard,Nando's Hot Perinaise Peri-Peri Mayo 465g,actual price£3.00,3.0
Food Cupboard,Nando's Medium Sweet Chilli Jam 285g,£2.48,2.48
Food Cupboard,Nando's Peri-Honey Coat & Cook Peri-Peri Marinade 120g,£1.25,1.25
Food Cupboard,Napolina Lasagne 375g,£1.23,1.23
Food Cupboard,Napolina Passata Sieved Tomatoes 500g,£1.35,1.35
Food Cupboard,Napolina Penne 500g,£1.50,1.5
Food Cupboard,Napolina Sieved Tomatoes Passata 690g,£1.38,1.38
Food Cupboard,Napolina Spaghetti 1kg,£2.25,2.25
Food Cupboard,Napolina Spaghetti 500g,£1.50,1.5
Food Cupboard,Natco All Purpose Seasoning 100g,actual price£0.94,0.94
Food Cupboard,Natco Coarse Black Pepper 100g,actual price£0.94,0.94
Food Cupboard,Nescafe Alta Rica Instant Coffee 190g,actual price£6.50,6.5
Food Cupboard,Nescafe Nescafe Gold Blend Decaf Instant Coffee 190g,actual price£6.00,6.0
Food Cupboard,Nestle Nesquik Chocolate Breakfast Cereal 375g,£3.00,3.0
Food Cupboard,Nestle Nestlé  Honey Hoop Breakfast Cereal Bars Multipack 6 x 22g 150g,actual price£1.00,1.0
Food Cupboard,Nippers Nippers Sour Candy Crunch 140g,£1.24,1.24
Food Cupboard,Nissin Cup Noodles Spicy Hot Chilli Instant Ramen Style Pot 66g,actual price£1.25,1.25
Food Cupboard,Nissin Soba Big Teriyaki Instant Wok Style Noodles Pot 113g,£2.15,2.15
Food Cupboard,Nutella 132g - 6 Bars x 22g Wafers filled with Nutella,£2.23,2.23
Food Cupboard,Nutella 20 Pieces 276g - Crunchy Biscuits filled with Nutella,£2.99,2.99
Food Cupboard,Old El Paso Original Cheesy Baked Nacho Kit 505g,£3.78,3.78
Food Cupboard,Ovaltine Chocolate Light 300g,£4.29,4.29
Food Cupboard,Ovaltine Original Light 25g,actual price£0.33,0.33
Food Cupboard,Oxo Oxo 24 Reduced Salt Beef Stock Cubes 142g,£3.50,3.5
Food Cupboard,Patak's Plain Pappadums x 8,£1.56,1.56
Food Cupboard,Patak's Rogan Josh Curry Spice Paste 283g,£2.86,2.86
Food Cupboard,Patak's South Indian Style Madras Curry Sauce Kit 270g,£2.68,2.68
Food Cupboard,Patak's Tikka Masala Paste Pots 2 x 70g,£1.43,1.43
Food Cupboard,Perfect Ted 8 Single Serve Matcha Variety Sticks (33g) (6 x 5g) (2 x 1.5g),£6.00,6.0
Food Cupboard,Perfect Ted Vanilla Matcha 75g,£9.50,9.5
Food Cupboard,Pip & Nut Crunchy Peanut Butter 1kg,£7.50,7.5
Food Cupboard,Pizza Express Hot Honey 268g,£3.25,3.25
Food Cupboard,Podravka Food Seasoning 200g,£1.74,1.74
Food Cupboard,Popchips popchips Barbeque Multipack Crisps 5 Pack,£1.68,1.68
Food Cupboard,Pot Noodle Original Curry Instant Noodles 90 g,£1.18,1.18
Food Cupboard,Princes Ham 340g,actual price£2.75,2.75
Food Cupboard,Princes Spicy Tomato Jack Mackerel Fillets 125g,actual price£1.50,1.5
Food Cupboard,Pukka Organic Peace Tea With Chamomile 20 Home Compostable Herbal Tea Bags 30g,£4.74,4.74
Food Cupboard,Quaker British Rolled Porridge Oats 500g,£1.64,1.64
Food Cupboard,Quaker Oat So Simple Big Bowl Original Porridge Sachets 6x38.5g,actual price£1.85,1.85
Food Cupboard,Quaker Oat So Simple Caramelised Biscuit Porridge Sachets 10 x 33.4g,£3.75,3.75
Food Cupboard,Reese's Peanut Butter and Milk Chocolate Flavour Minis Unwrapped Share Bag 90g,actual price£1.50,1.5
Food Cupboard,Rowse Runny Honey 680g,£3.68,3.68
Food Cupboard,Sacla Pesto Sun-Dried Tomato 190g,£3.35,3.35
Food Cupboard,Sarsons Marvellous Mixed Pickle 460g,£2.49,2.49
Food Cupboard,Satonoyuki Tofu 300g,£1.90,1.9
Food Cupboard,Schar Gluten-Free Pizza Base with Sourdough 2 x 150g (300g),£3.25,3.25
Food Cupboard,Schwartz Air Fryer Crispy Potatoes Seasoning,£2.28,2.28
Food Cupboard,Schwartz Air Fryer Spicy Korean BBQ Seasoning Drum 125g,£2.28,2.28
Food Cupboard,Schwartz Allspice Ground 37g,£2.00,2.0
Food Cupboard,Schwartz Cottage Pie 38g,£1.00,1.0
Food Cupboard,Schwartz Fajita Seasoning 46g,£2.00,2.0
Food Cupboard,Schwartz Garlic Granules 50g,£2.00,2.0
Food Cupboard,Schwartz Hollandaise Sauce for Fish 300g,£2.30,2.3
Food Cupboard,Schwartz Minced Garlic 46g,£2.00,2.0
Food Cupboard,Schwartz Mixed Herbs 11g,£2.00,2.0
Food Cupboard,Schwartz Paprika & Lemon Chicken Seasoning 43g,£2.00,2.0
Food Cupboard,Schwartz Rosemary 18g,£2.00,2.0
Food Cupboard,"Schwartz Season All Salt, Paprika & Pepper 70g",£2.00,2.0
Food Cupboard,Schwartz Spaghetti Bolognese Recipe Mix 40g,£1.00,1.0
Food Cupboard,Schwartz Spanish Paella Recipe Mix 30g,£1.00,1.0
Food Cupboard,Sharwood's East Asian Japanese Katsu Curry Cooking Sauce 415g,£2.65,2.65
Food Cupboard,Sharwood's Indian Balti Curry Cooking Sauce 420g,£2.65,2.65
Food Cupboard,Sharwood's Indian Bhuna Curry Cooking Sauce 420g,£2.65,2.65
Food Cupboard,Sharwood's Indian Butter Chicken Curry Sauce Meal Kit 280g,actual price£1.40,1.4
Food Cupboard,Sharwood's Indian Tikka Masala Curry Cooking Sauce 420g,£2.65,2.65
Food Cupboard,Sharwood's Reduced Sugar Sweet & Sour Cooking Sauce 425g,£2.65,2.65
Food Cupboard,Sharwood's Sweet & Sour Cooking Sauce 425g,£2.65,2.65
Food Cupboard,Simply Cook Korean Fried Rice Recipe Kit 70g,£2.50,2.5
Food Cupboard,Skinny Brands Mallo Vanilla Flavour Bars 5 x 18g,£1.10,1.1
Food Cupboard,Skinny Dream Dream Salted Caramel Bars 5 x 25g,£1.50,1.5
Food Cupboard,Skinny Whip Orange & Chocolate Flavour Bars 5 x 20g,£0.98,0.98
Food Cupboard,Skinny Whip Toffee Flavour 5 x 20g,£0.98,0.98
Food Cupboard,Skips Prawn Cocktail Sharing Crisps 90g,£1.50,1.5
Food Cupboard,Slush Puppie The Original Squeezee 10 x 60ml (600ml),£1.24,1.24
Food Cupboard,Smiths Frazzles Bacon Sharing Crisps 120g,£1.25,1.25
Food Cupboard,Snickers Peanut & Caramel Chocolate Bar 40g,£0.75,0.75
Food Cupboard,Sooper The Original Cookies,actual price£0.35,0.35
Food Cupboard,Starbucks Caramel Latte Instant Coffee Sachets 5 x 23g,actual price£1.50,1.5
Food Cupboard,"Starbucks Single-Origin Colombia by NESPRESSO, Medium Roast, 57g box of 10",£3.00,3.0
Food Cupboard,Starbucks Vanilla Latte Instant Coffee Sachets 5 x 21.5g,actual price£1.50,1.5
Food Cupboard,Sun-Pat Crunchy Peanut Butter 570g,£3.75,3.75
Food Cupboard,Sun-Pat Smooth Peanut Butter 570g,£3.75,3.75
Food Cupboard,Sweet Freedom Choc Pot Chocolate Spread 250g,£3.45,3.45
Food Cupboard,Swizzels Squashies Drumstick Squeezee Freezable Pops 12 x 45ml (540ml),£1.59,1.59
Food Cupboard,TUC TUC Sandwich Snack Crackers 150g,actual price£1.35,1.35
Food Cupboard,Tassimo L'OR Caramel Latte Macchiato Coffee Pods x7,£5.30,5.3
Food Cupboard,Taylors of Harrogate 40 Yorkshire Tea Bags 125g,£2.16,2.16
Food Cupboard,Taylors of Harrogate Lazy Sunday Beans Roast Coffee 200g,£4.98,4.98
Food Cupboard,Taylors of Harrogate Yorkshire Tea 480 Tea Bags 1.5kg,£11.92,11.92
Food Cupboard,Terry's Milk Chocolate Mint Bar 90g,actual price£1.00,1.0
Food Cupboard,Tetley 75 Extra Strong Tea Bags 237g,£3.90,3.9
Food Cupboard,Tetley Green Tea Mango & Passionfruit Tea Bags x50,£2.47,2.47
Food Cupboard,The Bakehouse e Chunky Milk Choc Chunk Cookies 220g,£2.48,2.48
Food Cupboard,The Health Menu by ASDA The Health Menu Spicy Piri Piri Style Mixed Grains & Pulses 250g,£1.58,1.58
Food Cupboard,The Skinny Food Co. Golden Syrup Flavour Syrup with Sweetener 425ml,£2.08,2.08
Food Cupboard,The Skinny Food Co. Shots Barista French Vanilla Flavour Syrup Concentrate with Sweetener 60ml,£2.00,2.0
Food Cupboard,Tic Tac Fresh Mint Sweets Multipack 4 x 18g,£1.94,1.94
Food Cupboard,Tic Tac Lime & Orange 4 x 18g (72g),£1.95,1.95
Food Cupboard,Tic Tac Two Lemon Raspberry Flavours 38.5g,£1.68,1.68
Food Cupboard,Tilda Boil in Bag Pure Basmati Rice 250g,£1.24,1.24
Food Cupboard,Toblerone honey & almond nougat white chocolate gift block 340 g,actual price£4.00,4.0
Food Cupboard,Trek Biscoff Protein Flapjack 3 x 40g,£2.75,2.75
