Category,Name,Price,Price_Numeric
Laundry & Household,Stardrops The Miracle Multi-Purpose Cleaner 850ml,£1.08,1.08
Laundry & Household,Stardrops The Pink Stuff The Miracle Cleaning Paste 850g,£1.49,1.49
Laundry & Household,Vanish Gold Crystal White Oxi Action Stain Remover Powder 450g,£3.98,3.98
Laundry & Household,Vanish Oxi Action Carpet Care Vacuum Up Foam 600 ml,actual price£5.50,5.5
Laundry & Household,Vileda Supermocio 3 Action XL,£4.00,4.0
Laundry & Household,Yankee Candle Car Jar Scented Air Freshener,£2.48,2.48
Live Better,ASDA Aromatic Sweet Chilli Pork Stir Fry Strips 400g,£2.97,2.97
Live Better,ASDA Free Range Egg Noodles 600g,£1.64,1.64
Live Better,ASDA Mild & Crunch Baby Corn 145g,£1.17,1.17
Live Better,ASDA Mild & Crunchy Mixed Vegetable Stir-Fry 600g,£1.68,1.68
Live Better,Blue Dragon Medium Egg Noodles 250g,£1.33,1.33
"Meat, Poultry & Fish",ASDA 2 Buttery Garlic & Herb Chicken Kievs 260g,£2.97,2.97
"Meat, Poultry & Fish",ASDA 8 Herby Lincolnshire Pork Sausages 454g,£1.79,1.79
"Meat, Poultry & Fish",ASDA ASDA Succulent Southern Fried Chicken Goujons 600g,£4.81,4.81
"Meat, Poultry & Fish",ASDA ASDA Tender Breaded Chicken Breast Mini Fillets 305g,£3.00,3.0
"Meat, Poultry & Fish",ASDA Beansprouts Stir-Fry 200g,£0.52,0.52
"Meat, Poultry & Fish",ASDA Beef & Pork Mince 750g,£4.88,4.88
"Meat, Poultry & Fish",ASDA Cooked & Peeled King Prawns 150g,£3.75,3.75
"Meat, Poultry & Fish",ASDA Crispy Tempura Battered Haddock Goujons 200g,£2.75,2.75
"Meat, Poultry & Fish",ASDA Delicate 2 Hake Fillets 240g,£4.40,4.4
"Meat, Poultry & Fish",ASDA Delicious 20 Unsmoked Streaky Bacon Rashers 400g,£3.04,3.04
"Meat, Poultry & Fish",ASDA Delicious Lean Unsmoked Diced Bacon 2 x 155g (310g),£2.97,2.97
"Meat, Poultry & Fish",ASDA Delicious Prawn Cocktail 170g,actual price£2.25,2.25
"Meat, Poultry & Fish",ASDA Delicious Unsmoked Gammon Joint 1.3kg,£8.64,8.64
"Meat, Poultry & Fish",ASDA Flaky Smoked Kipper Fillets with Butter 200g,£1.77,1.77
"Meat, Poultry & Fish",ASDA Flavoursome Oak Smoked Salmon 200g,£5.97,5.97
"Meat, Poultry & Fish",ASDA Free Range Egg Noodles Stir-Fry 300g,£1.07,1.07
"Meat, Poultry & Fish",ASDA Golden Breaded Chunky Cod Fish Fingers 300g,£3.10,3.1
"Meat, Poultry & Fish",ASDA Lean Pork Fillet (Typically 0.5kg),£4.00,4.0
"Meat, Poultry & Fish",ASDA Mixed Pepper Stir-Fry 320g,£1.08,1.08
"Meat, Poultry & Fish",ASDA Rainbow Vegetable Stir-Fry 320g,£1.08,1.08
"Meat, Poultry & Fish",ASDA Spicy Rice Noodles Stir-Fry 250g,£1.07,1.07
"Meat, Poultry & Fish",ASDA Stir-Fry Protein Egg Noodles 300g,£1.07,1.07
"Meat, Poultry & Fish",ASDA Succulent Pork Belly Slices 500g,£4.42,4.42
"Meat, Poultry & Fish",ASDA Sweet Honey & Maple Gammon Joint 450g,£4.48,4.48
"Meat, Poultry & Fish",ASDA Tender Medium Beef Roasting Joint (Typically 1.kg),£17.97,17.97
"Meat, Poultry & Fish",ASDA Texan Style Steak Slices 140g,£2.94,2.94
"Meat, Poultry & Fish",Barbie Twinning Looks Doll and Accessories,£24.98,24.98
"Meat, Poultry & Fish",Carrot Paris Market 5 Atlas,£1.97,1.97
"Meat, Poultry & Fish",Exceptional By ASDA Roast Chicken Gravy 450g,£2.52,2.52
"Meat, Poultry & Fish",Exceptional by ASDA 4 Pork & Beef Texan Style Hot Dogs 360g,£3.17,3.17
"Meat, Poultry & Fish",Exceptional by ASDA 6 Chorizo & Chargrilled Pepper Pork Sausages 360g,£3.17,3.17
"Meat, Poultry & Fish",Exceptional by ASDA 6 Traditional Style Cheddar Cheese & Caramelised Red Onion Pork Sausages 450g,£3.98,3.98
"Meat, Poultry & Fish",Exceptional by ASDA British Aberdeen Angus Diced Beef,£6.06,6.06
"Meat, Poultry & Fish",Exceptional by ASDA British Aberdeen Angus Grass & Forage Fed Sirloin Steak 10oz 284g,£12.48,12.48
"Meat, Poultry & Fish",Exceptional by ASDA British Beef Roasting Joint (Typically 1.4kg),£27.96,27.96
"Meat, Poultry & Fish",Exceptional by ASDA Butter Roast Turkey Breast 100g,£3.50,3.5
"Meat, Poultry & Fish",Exceptional by ASDA Exceptional by  Cooked & Peeled Cold Water Prawns 150g,£4.25,4.25
"Meat, Poultry & Fish",Exceptional by ASDA Exceptional by  Cooked & Peeled Jumbo King Prawns 150g,actual price£3.07,3.07
"Meat, Poultry & Fish",Exceptional by ASDA Sweet & Delicate Crab Meat 100g,actual price£3.40,3.4
"Meat, Poultry & Fish",HECK! 97% Pork Gluten Free Sausages 6 pack 400g,£3.18,3.18
"Meat, Poultry & Fish",HECK! HECK! Chicken Italia Gluten Free Burgers 320g,actual price£2.97,2.97
"Meat, Poultry & Fish",Marble & Cleaver Fillet Steak,£8.15,8.15
"Meat, Poultry & Fish",Peperami 200g (10x20g),£4.97,4.97
"Meat, Poultry & Fish",Peperami Chicken Skewers BBQ Flavour 100g,£2.26,2.26
"Meat, Poultry & Fish",Peperami Limited Edition Doritos BBQ Sweet Tang Flavour 100g (5 x 20g),£2.76,2.76
"Meat, Poultry & Fish",Peperami Limited Edition Doritos BBQ Sweet Tang Flavour 10g,£2.86,2.86
"Meat, Poultry & Fish",SUMMER GRILL by ASDA Summer Grill by  4 Middle Eastern Inspired Chicken Koftas 240g,£2.61,2.61
"Meat, Poultry & Fish",Shazans Beef Mince 500g,£5.02,5.02
"Meat, Poultry & Fish",Shazans Mutton Boneless Diced Shoulder 500g,£7.62,7.62
"Meat, Poultry & Fish",Shazans Peri Peri Chicken Portions 1.6kg,£6.48,6.48
"Meat, Poultry & Fish",Shazans Peri Peri Diced Chicken Breast 500g,£4.23,4.23
"Meat, Poultry & Fish",Simple to Cook by ASDA Tomato & Mozzarella Pork Meatballs 399g,£4.73,4.73
"Meat, Poultry & Fish",Summer Grill by ASDA 4 Big Smash Burgers 390g,£4.46,4.46
"Meat, Poultry & Fish",Summer Grill by ASDA 4 Buffalo Chicken Smash Burgers 340g,£2.61,2.61
"Meat, Poultry & Fish",Summer Grill by ASDA 4 Miso & Honey Pork Kebabs 350g,£4.42,4.42
"Meat, Poultry & Fish",Summer Grill by ASDA Summer Grill by  2 Yellowfin Tuna Steaks 255g,£6.00,6.0
"Meat, Poultry & Fish",The Real Seafood Co. Crayfish Tails 100g,£4.50,4.5
"Meat, Poultry & Fish",Travel Essentials travel EA,£2.00,2.0
"Meat, Poultry & Fish",Travel Skincare Pump Jar,£2.00,2.0
Other,Blue Dino Cot Bed Jersey Cotton Sheets - Set of 2,£9.00,9.0
Other,Floral Love Heart Reversible Duvet Set Double,£12.00,12.0
Other,George Home Birthday Card,£2.00,2.0
Other,George Home Birthday Card,£0.28,0.28
Other,George Home Birthday Card,£1.50,1.5
Other,George Home Birthday Card,£0.58,0.58
Other,George Home Black Checkerboard Smiley Face Duvet Set Single,£10.00,10.0
Other,George Home Chenille Bath Mat - Coral,£6.00,6.0
Other,George Home Dinosaur Reversible Toddler Duvet Set,£9.00,9.0
Other,George Home Floral with Pink Flowers Birthday Card,£1.50,1.5
Other,George Home Friend Birthday Card,£1.50,1.5
Other,George Home Green Marvel The Incredible Hulk Fleece Throw,£7.50,7.5
Other,George Home Lightweight Summer Cotbed Duvet - 1 Tog,£10.00,10.0
Other,George Home Marvel Avengers Reversible Single Duvet Set,£14.00,14.0
Other,George Home Red Spider-Man Head Cushion,£10.00,10.0
Other,George Home Simply Grey Dinner Set - 12 Piece,£25.00,25.0
Other,George Home Super-Soft Checkerboard Blanket - 200cm x 220cm,£18.00,18.0
Other,Hapello Hapello Blue Jumbo Racket,£6.00,6.0
Other,Marvel Marvel Spider-Man Single Fitted Sheet Single,£7.00,7.0
Other,Pale Yellow Super-Soft Cotton Bath Mat,£6.00,6.0
Other,Pukka Jerk Chicken Slice 140g,£1.74,1.74
Other,Tanqueray No. TEN Gin 47.3% vol 70cl,£35.46,35.46
Other,Village Quality Products White Vinegar 1000ml,£1.48,1.48
Pet Food & Accessories,Aquarian Tropical Fish Food Flakes 50g,£4.54,4.54
Pet Food & Accessories,"Bakers Allsorts Chicken, Beef and Lamb Dog Treats 98g",£1.24,1.24
Pet Food & Accessories,"Bakers Rewards Chicken, Beef and Lamb Dog Treats 100g",£1.24,1.24
Pet Food & Accessories,Bakers Superfoods Puppy Chicken with Vegetables Dry Dog Food 1.1kg,£4.00,4.0
Pet Food & Accessories,Bakers Superfoods Small Dog Beef Dry Dog Food 1.1kg,£4.47,4.47
Pet Food & Accessories,Bob Martin Clear 3 in 1 Flavoured Wormer 150/144/50 mg 4 Tablets for Dogs,£9.97,9.97
Pet Food & Accessories,Bob Martin Clear Plus 134mg / 120.6mg Spot-On Solution for Medium Dogs Treatment 1 Pipette,£7.47,7.47
Pet Food & Accessories,Cesar ® Country Stew Adult Wet Dog Food Trays Special Selection 8 x 150g,£6.54,6.54
Pet Food & Accessories,Cesar ® Senior Wet Dog Food Pouches Mixed Selection in Jelly 12 x 100g,£6.54,6.54
Pet Food & Accessories,Dentalife Dental Salmon Cat Treats 40g,£1.18,1.18
Pet Food & Accessories,Dentalife Medium Dental Chicken Dog Chews 5 Sticks,£0.98,0.98
Pet Food & Accessories,Encore Chicken Selection in Broth 8 x 70g,£8.00,8.0
Pet Food & Accessories,Encore Natural Wet Cat Food Fish Selection Broth 8 x 70g Tins,£8.00,8.0
Pet Food & Accessories,Felix As Good As it Looks Meaty with Ham Selection in Jelly Wet Cat Food 12x85g,£4.98,4.98
Pet Food & Accessories,Felix As Good As it Looks Senior 7+ Meat in Jelly Wet Cat Food 12x100g,£4.98,4.98
Pet Food & Accessories,Felix As Good As it Looks Senior 7+ Mixed in Jelly Wet Cat Food 12x85g,£4.98,4.98
Pet Food & Accessories,Felix Crispies Salmon and Trout Cat Treats 45g,£1.18,1.18
Pet Food & Accessories,"Felix Doubly Delicious Beef, Chicken & Veg Dry Cat Food 750g",actual price£3.50,3.5
Pet Food & Accessories,Felix Original Mixed Selection in Gravy Wet Cat Food 12x85g,£3.98,3.98
Pet Food & Accessories,Forthglade Duck with Potato & Vegetables Complete Meal Adult 1 Yr+ 395g,£1.63,1.63
Pet Food & Accessories,Forthglade Natural Soft Bite Treats with Lamb 90g,£1.51,1.51
Pet Food & Accessories,Go Cat Chicken and Turkey Dry Cat Food 750g,£2.44,2.44
Pet Food & Accessories,Good Boy Chewy Dog Toy,£2.84,2.84
Pet Food & Accessories,Good Boy Chewy Dog Toy Rope Dumbbell,£3.78,3.78
Pet Food & Accessories,Good Boy Fetch Dog Toy Ball on Rope,£0.97,0.97
Pet Food & Accessories,Good Boy Fetch Dog Toy Flashing Ball,£3.94,3.94
Pet Food & Accessories,Good Boy Meaty Treaty Chewy Chicken Strips 230g,£5.58,5.58
Pet Food & Accessories,Good Boy Meaty Treaty Chewy Duck with Rice Sticks 60g,£2.29,2.29
Pet Food & Accessories,Good Boy Meaty Treaty Crunchy Chicken Calcium Bones 90g,£2.18,2.18
Pet Food & Accessories,Good Boy Meaty Treaty Succulent Chicken Sausages 75g,£2.29,2.29
Pet Food & Accessories,Good Boy Meaty Treaty Tender Beef Strips 280g,£5.58,5.58
Pet Food & Accessories,Good Boy Soft Dog Toy Value Plush,£0.97,0.97
Pet Food & Accessories,Good Boy Tuggy Snake Dog Toy,£6.29,6.29
Pet Food & Accessories,Gourmet GOURMET Nature's Creations Chicken Wet Cat Food 85g,£0.97,0.97
Pet Food & Accessories,Gourmet GOURMET Nature's Creations Poultry Wet Cat Food 8x85g,£4.34,4.34
Pet Food & Accessories,Gourmet GOURMET Revelations Mousse Chicken Wet Cat Food 4x57g,£2.98,2.98
Pet Food & Accessories,Gourmet Gold Chunks in Gravy Salmon and Chicken Wet Cat Food 85g,£0.66,0.66
Pet Food & Accessories,"Harringtons Adult Complete Wet Dog Food – Fresh Poultry Recipes with Potato & Veg, 6x400g Free 6 x 400g",£7.50,7.5
Pet Food & Accessories,Harringtons Rich in Lamb & Rice Dry Adult Dog Food 4kg,£11.48,11.48
Pet Food & Accessories,Harringtons Rich in Turkey with Veg Dry Adult Dog Food 4kg,£11.48,11.48
Pet Food & Accessories,Hero by ASDA Hero 8 Sausages 60g,£1.02,1.02
Pet Food & Accessories,Iams Advanced Nutrition Senior Dry Cat Food Chicken 2kg,£10.47,10.47
Pet Food & Accessories,Lily's Kitchen Smooth Paté Selection Complete Adult Cat Food 8x85g,actual price£8.91,8.91
Pet Food & Accessories,Lily's Kitchen The Best Ever Beef Mini Burgers Dog Treats 70g,£3.67,3.67
Pet Food & Accessories,PEDIGREE Junior Puppy Wet Dog Food Mixed Selection in Jelly 40 x 100g Pouch,£13.74,13.74
Pet Food & Accessories,"PEDIGREE RANCHOS™ Dog Training Treat Cubes, With 100% Natural Chicken, 70g",£1.98,1.98
Pet Food & Accessories,PEDIGREE ® COMPLETE™ Adult Dry Dog Food Poultry and Vegetables 1.4kg,actual price£4.00,4.0
Pet Food & Accessories,PEDIGREE ® TENDER GOODNESS™ Dry Adult Small Dog Poultry 800g,£3.17,3.17
Pet Food & Accessories,Pampered Paws 50 Dog Poo Bags,£1.07,1.07
Pet Food & Accessories,Pampered Paws 80 Pawfect Pet Wipes,£2.97,2.97
Pet Food & Accessories,Park Life Dog Friendly Buttons Chocolate Flavour,£0.97,0.97
Pet Food & Accessories,Park Life Puggy's Tasty Treats Bacon and Raspberry Flavour,£0.97,0.97
Pet Food & Accessories,Pedigree COMPLETE™ Adult Small Dog Dry Food Poultry and Vegetables 3kg,£7.97,7.97
Pet Food & Accessories,Pedigree Junior Puppy Wet Dog Food Mixed Selection In Jelly 12 x 100g Pouch,£4.94,4.94
Pet Food & Accessories,Pedigree MARKIES Biscuits Mini Dog Treats 500g,£1.75,1.75
Pet Food & Accessories,Pedigree PEDIGREE® RANCHOS™ SUPERFOOD Beef Dog Treat Blueberries & Wholegrains 70g,£1.98,1.98
Pet Food & Accessories,Pedigree SCHMACKOS Poultry Dog Treats 20 Strips,£1.28,1.28
Pet Food & Accessories,Purina ONE Chicken Dry Cat Food 3kg,£19.24,19.24
Pet Food & Accessories,Purina ONE Senior 11+ Chicken Dry Cat Food 750g,actual price£5.00,5.0
Pet Food & Accessories,Rosewood Interactive Cat Laser Chaser,£3.97,3.97
Pet Food & Accessories,Sheba Classics Wet Cat Food Tray Salmon in Terrine 85g,£0.83,0.83
Pet Food & Accessories,Sheba SHEBA Soup Adult Wet Cat Food Pouch with Tuna 4 x 40g,£2.42,2.42
Pet Food & Accessories,Sheba ® Fresh & Fine Adult Wet Cat Food Fish In Gravy 15 x 50g Pouches,£4.97,4.97
Pet Food & Accessories,Sheba ® Fresh Cuisine Taste of Tokyo Wet Cat Food Fish in Gravy 6x50g Pouch,£2.23,2.23
Pet Food & Accessories,Simply Nibbles 4 Sun-Ripened Corn Halves 200g,£2.25,2.25
Pet Food & Accessories,TidyZ 50 Doggy Bags Tie Handles,£1.85,1.85
Pet Food & Accessories,Tiger by ASDA Tiger Sticks 6 x 5g (30g),£0.88,0.88
Pet Food & Accessories,Tiny Friends Farm Harry Hamster Yippees with Apple & Sweetcorn 120g,£1.75,1.75
Pet Food & Accessories,Toplife Formula Milk for Puppies 200ml,£0.77,0.77
Pet Food & Accessories,Vamoosh Pet Hair Dissolver 3 Sachets,£3.95,3.95
Pet Food & Accessories,Wagg Meaty Chunks Chicken 2.5kg,£5.74,5.74
Pet Food & Accessories,Webbox 20 Chomping Chews Beef 200g,£1.14,1.14
Pet Food & Accessories,Webbox 5 Tasty Sticks with Chicken 55g (5 x 11g),£1.20,1.2
Pet Food & Accessories,Webbox 6 Tasty Sticks with Beef 30g (6 x 5g),£1.20,1.2
Pet Food & Accessories,Webbox 6 Tasty Sticks with Cheese 30g,£1.20,1.2
Pet Food & Accessories,Webbox Lick-e-Lix with Liver Sausage & Cat Grass 5 x 15g (75g),£1.40,1.4
Pet Food & Accessories,Webbox Tasty Sticks with Chicken & Liver 7 x 5g (35g),£1.38,1.38
Pet Food & Accessories,Whiskas 1+ DUO Surf & Turf Wet Cat Food Pouches in Jelly 12 x 85g,£4.74,4.74
Pet Food & Accessories,Whiskas 1+ POULTRY Feasts Wet Cat Food Pouches in Jelly 12 x 85g,£4.74,4.74
Pet Food & Accessories,Whiskas Kitten 2-12 mnths Dry CHICKEN Cat Food 1.9kg,£5.96,5.96
Pet Food & Accessories,Whiskas Kitten Cat Milk Bottle 200ml,£1.32,1.32
Pet Food & Accessories,Whiskas Senior 7+ Dry CHICKEN Cat Food 800g,actual price£3.00,3.0
Pet Food & Accessories,Whiskas Senior 7+ MIXED Menu&nbsp; Wet Cat Food Pouches in Gravy 12 x 85g,£4.74,4.74
Pet Food & Accessories,Whiskas TEMPTATIONS™ Adult Cat Treats with Chicken & Cheese 60g,£1.08,1.08
Pet Food & Accessories,Wild Bird Fat Feast Triple Pack 3 x 280g,£2.72,2.72
Pet Food & Accessories,Winalot Classics Mixed in Jelly Wet Dog Food 6x400g,£6.94,6.94
Pet Food & Accessories,Winalot Friday Suppers Mixed in Gravy Wet Dog Food 40x100g,actual price£10.00,10.0
Pet Food & Accessories,Winalot Meaty Chunks Mixed in Jelly Wet Dog Food 12x100g,£4.84,4.84
Ramadan,ASDA 3 Crunchy & Fragrant Brown Onions,£0.95,0.95
Ramadan,ASDA Basmati Micro Rice 250g,£0.69,0.69
Ramadan,ASDA British Classic Mash 400g,£0.90,0.9
Ramadan,ASDA Chayote (Typically 0.4KG),£0.92,0.92
Ramadan,ASDA Cool & Crunchy Mini Cucumbers 200g,£1.08,1.08
Ramadan,ASDA Crisp & Fragrant Sweet Peppers 3 Pack,£2.00,2.0
Ramadan,ASDA Dudhi (Typically 0.4KG),£2.21,2.21
Ramadan,ASDA Eddoes (Typically 0.14KG),£0.49,0.49
Ramadan,ASDA Fennel,£0.92,0.92
Ramadan,ASDA Firm & Flavoursome Baby Potatoes 1kg,£1.05,1.05
Ramadan,ASDA Garden Gang 6 Amazing Apples,£1.17,1.17
Ramadan,ASDA Loose Red Pepper,£0.70,0.7
Ramadan,ASDA Sliced Cured Ham on the Bone 120g,£2.24,2.24
Ramadan,JUST ESSENTIALS by ASDA Cheese & Tomato Snack Pizza 114g,£0.58,0.58
Ramadan,Muller Corner Vanilla Yogurt with Chocolate Balls,£0.62,0.62
Ramadan,The BAKERY at ASDA The Bakery 4 Sliced Brioche Burger Buns,£0.97,0.97
Rollback,ASDA Celeriac (Typically 1KG),£1.55,1.55
Rollback,ASDA Fresh & Crunchy Stir Fry Veg Medley 220g,£2.15,2.15
Rollback,ASDA Mild & Sweet Trimmed Leeks 500g,£1.37,1.37
Rollback,ASDA Rice Noodles 225g,£1.07,1.07
Rollback,ASDA Sweet & Earthy Parsnips 500g,£0.74,0.74
Rollback,Artlex Pasta Babuni Jajeczny 225g,£1.13,1.13
Rollback,Ginsters Creamy Garlic Mushroom Slice 170g,£2.24,2.24
Rollback,Lubella Filini Pasta 400g,£1.34,1.34
Rollback,Lucozade Energy Zero Sugar Drink Pink Lemonade 4x380ml,actual price£2.25,2.25
Rollback,Lucozade Sport  Drink Zero Sugar Raspberry & Passion Fruit 4 x 500ml,£3.98,3.98
Rollback,Lucozade Sport Drink Blue Force 4x500ml,actual price£3.00,3.0
Rollback,Lucozade Sport Drink Orange 4 x 500ml,actual price£3.00,3.0
Rollback,Lucozade Sport Drink Raspberry 4 x 500ml,actual price£3.00,3.0
Rollback,Lucozade SportDrink Ice Kick  Jude Special Edition 500ml 4x500ml,actual price£3.00,3.0
Summer,ASDA 3 Sweet & Crunchy Red Onions,£0.95,0.95
Summer,ASDA Blueberries 150g,£1.67,1.67
Summer,ASDA Blueberries 300g,actual price£2.96,2.96
Summer,ASDA Crunchy & Sweet Carrots 1kg,£0.69,0.69
Summer,ASDA Delicate & Peppery Baby Leaf & Rocket Salad 75g,£1.08,1.08
Summer,ASDA Exceptional by  Hand Cooked Roast Chicken & Thyme Crisps 150g,£1.50,1.5
Summer,ASDA Fragrant & Crunchy Spring Onions,£0.69,0.69
Summer,ASDA Sweet & Crunchy Tenderstem Broccoli 160g,£1.28,1.28
Summer,ASDA Vine Ripened Cherry Tomatoes,£1.15,1.15
Summer,The Deli by ASDA Bravas Chicken 140g,£3.24,3.24
Summer,The Deli by ASDA The Deli Caesar Spirali Pasta Salad 200g,£2.75,2.75
Summer,The Deli by ASDA The Deli Chicken Shawarma 140g,£3.24,3.24
Summer,The Deli by ASDA The Deli Chilli Mozzarella Pearls 130g,£2.98,2.98
"Sweets, Treats & Snacks",ASDA Free From Free From by  Plain Flour 1kg,£1.50,1.5
"Sweets, Treats & Snacks",Bahlsen Choco Leibniz Dark 111g,£2.24,2.24
"Sweets, Treats & Snacks",Eat Real Chilli & Lemon Lentil Chips Sharing 95g,£2.25,2.25
"Sweets, Treats & Snacks",Eat Real Tomato & Basil Hummus Chips Sharing 110g,£2.25,2.25
"Sweets, Treats & Snacks",Free From by Asda Digestive Biscuits 188g,£1.98,1.98
"Sweets, Treats & Snacks",KitKat F1 2 Finger Dark Chocolate Biscuit Bar 8 Pack Multipack 165.6g,actual price£1.75,1.75
"Sweets, Treats & Snacks",KitKat F1 2 Finger Milk Chocolate Biscuit Bar 8 Pack Multipack 165.6g,actual price£1.75,1.75
"Sweets, Treats & Snacks",KitKat F1 2 Finger Orange Chocolate Biscuit Bar 8 Pack Multipack 165.6g,actual price£1.75,1.75
"Sweets, Treats & Snacks",Peperami The Original 5 x 20g (100g),£2.76,2.76
"Sweets, Treats & Snacks",Sunbites SUN Bites Sweet Chilli High Fibre Snacks Multipack Crisps 6x25g,£1.50,1.5
"Sweets, Treats & Snacks",Tunnock's Dark Chocolate Coated Caramel Wafer Biscuits 8 x 30g,£2.24,2.24
"Sweets, Treats & Snacks","Wildlife Choobs Kids Strawberry, Raspberry & Apricot Yoghurt Tubes 6 x 37g",£1.08,1.08
Toiletries & Beauty,ASDA 10 Extra Protective Pads,£1.42,1.42
Toiletries & Beauty,ASDA 10 Regular Men's Protective Pads for Sensitive Bladders,£3.14,3.14
Toiletries & Beauty,ASDA 5 Male 3 Blade Refill,£4.50,4.5
Toiletries & Beauty,ASDA 5 Male 3 Blade Shaving System,£4.50,4.5
Toiletries & Beauty,ASDA 6 Interdental Brushes,£2.21,2.21
Toiletries & Beauty,ASDA Battery Powered Toothbrush,£6.73,6.73
Toiletries & Beauty,ASDA Head Lice Spray 6 Months+ 120ml,£5.50,5.5
Toiletries & Beauty,ASDA Interdental Brushes,£2.21,2.21
Toiletries & Beauty,ASDA Little Angels by  Extra Sensitive Newborn Wipes 4 x 56,£3.95,3.95
Toiletries & Beauty,ASDA Protect Sensitive Formula Sun Lotion SPF50 High 200ml,£5.41,5.41
Toiletries & Beauty,ASDA Rechargeable Power USB Toothbrush,£14.84,14.84
Toiletries & Beauty,Always Daily Protect Long Panty Liners 58 Liners,£3.12,3.12
Toiletries & Beauty,Always Discreet Incontinence Pads Women Long Plus 28 Count,£6.74,6.74
Toiletries & Beauty,Always Incontinence Pads Long,actual price£2.50,2.5
Toiletries & Beauty,Ambre Solaire Ambre Solaire After Sun Tinted Tan Maintainer 200ml,£6.00,6.0
Toiletries & Beauty,Ambre Solaire Ambre Solaire Hydra 24H Protect SPF30 Sun Cream Spray 150ml,£6.50,6.5
Toiletries & Beauty,Ambre Solaire Ambre Solaire Soothing After Sun  Aloe Vera Lotion 400ml,£7.00,7.0
Toiletries & Beauty,Aoura Solar Flower Hair & Body Fragrance Mist 100ml,£2.00,2.0
Toiletries & Beauty,Aoura Whipped Cream Hair & Body Fragrance Mist 100ml,£2.00,2.0
Toiletries & Beauty,"Aquafresh Paw Patrol Kids Milk Teeth Toothpaste 0-2 Years, 50ml",£1.18,1.18
Toiletries & Beauty,Asda Body Sponge Duo,£1.00,1.0
Toiletries & Beauty,"Aussie Bonza Colour Conditioner - Vegan - Colour-Protecting - For Vibrant Hair, 170ml",£3.80,3.8
Toiletries & Beauty,"Aussie Bonza Colour Shampoo - Colour-Protecting - For Vibrant Hair, 250ml",£3.75,3.75
Toiletries & Beauty,"Aussie Curls Leave-In Cream 160ml. Curl Definition. Wavy, Coily, Curly Hair",£5.97,5.97
Toiletries & Beauty,Aveeno Clarify and Shine Apple Cider Vinegar Soothing Shampoo 300ml,£5.46,5.46
Toiletries & Beauty,Ayumi Naturals Pure Olive Oil,£5.98,5.98
Toiletries & Beauty,Banana Boat Aloe Vera Gel 400ml,£6.00,6.0
Toiletries & Beauty,Batiste Dry Shampoo Blush Flirty Floral 200ml,£3.35,3.35
Toiletries & Beauty,Batiste Dry Shampoo Blush Flirty Floral 50ml,£2.50,2.5
Toiletries & Beauty,Baylis & Harding Signature Sweet Mandarin & Grapefruit Hand Wash 1 Litre Refill,£3.00,3.0
Toiletries & Beauty,Bic 2 Sensitive Men's 2 Blade Disposable Razors x10,£2.37,2.37
Toiletries & Beauty,Bigen Men's Speedy Colour Brown Black 102,£7.20,7.2
Toiletries & Beauty,Bigen Permanent Powder Hair Colour 59 Oriental Black 6g,£3.75,3.75
Toiletries & Beauty,Bodyform Total Protection Ultra Long Sanitary Towels Wings 36 pack,£2.97,2.97
Toiletries & Beauty,Bodyform Ultimate Ultra Night Sanitary Towels Wings 8 pack,actual price£1.50,1.5
Toiletries & Beauty,Bulldog Skincare For Men Original Beard Balm 75ml,£8.00,8.0
Toiletries & Beauty,Bulldog Skincare Grooming Kit,£10.00,10.0
Toiletries & Beauty,Calypso Sun Glow & Tan Mist SPF 30 100ml,£7.00,7.0
Toiletries & Beauty,Cantu Detangle Brush,£8.98,8.98
Toiletries & Beauty,Cantu Shea Butter Leave-In Conditioning Repair Cream 453g,£6.23,6.23
Toiletries & Beauty,Cantu Shea Butter Moisturizing Curl Activator Cream Style 355ml,£7.34,7.34
Toiletries & Beauty,Caress Spa Exfoliating Gloves,£1.00,1.0
Toiletries & Beauty,Cetaphil Gentle Skin Cleanser 236ml,actual price£8.00,8.0
Toiletries & Beauty,Clairol Nice’n Easy Nice'n Easy Permanent Hair Dye 9A Light Ash Blonde,£7.97,7.97
Toiletries & Beauty,Clairol Root Touch-Up Permanent Hair Dye 8G Medium Golden Blonde,£6.48,6.48
Toiletries & Beauty,Clearasil Ultra Rapid Action Gel Wash 150ml,£5.50,5.5
Toiletries & Beauty,Colgate Max White Medium Toothbrush Single,actual price£1.50,1.5
Toiletries & Beauty,Colgate Plax Cool Mint Mouthwash Alcohol Free 250ml,£1.25,1.25
Toiletries & Beauty,Colgate Plax Cool Mint Mouthwash Alcohol Free 500ml,£4.46,4.46
Toiletries & Beauty,Colgate Sensitive Repair & Prevent + Multi Protection Toothpaste 75ml,£5.98,5.98
Toiletries & Beauty,Colgate Total Active Prevention Original Toothpaste 100ml Pump,£3.32,3.32
Toiletries & Beauty,Colgate Total Active Prevention Original Toothpaste 125ml,£6.98,6.98
Toiletries & Beauty,Colgate Total Active Prevention Original Toothpaste 75ml,£2.33,2.33
Toiletries & Beauty,Colgate Total Active Prevention Teeth Whitening Toothpaste 125ml,£6.98,6.98
Toiletries & Beauty,Colgate Total Active Prevention Teeth Whitening Toothpaste 75ml,£2.38,2.38
Toiletries & Beauty,Colgate Zig Zag Firm Manual Toothbrush Single,£1.99,1.99
Toiletries & Beauty,Collection Faststroke It's a Dual Eyeliner 1 Black,£5.00,5.0
Toiletries & Beauty,Collection Gel Effect Spotlight Shin French Pink 26 10.5ml,£4.00,4.0
Toiletries & Beauty,Collection Gel Effect Spotlight Shine 1 White Out 10.5ml,£4.00,4.0
Toiletries & Beauty,Collection Gel Effect Spotlight Shine 6 Iced Coffee 10.5ml,£4.00,4.0
Toiletries & Beauty,Collection Glaze 1 Cinnamon Swirl High Colour Gloss 5ml,£5.00,5.0
Toiletries & Beauty,Collection Glaze 3 Cherry Pie High Colour Gloss 5ml,£5.00,5.0
Toiletries & Beauty,Collection Hydrating Lipstick Classic Nude 39,£4.00,4.0
Toiletries & Beauty,Collection Hydrating Lipstick Sweet Rose 28,£4.00,4.0
Toiletries & Beauty,Collection Lasting Perfection Concealer Cashew 6,£5.00,5.0
Toiletries & Beauty,Collection Maxxx Volume Mascara 1 Ultra Black 8ml,£6.00,6.0
Toiletries & Beauty,Collection Pressed Powder Translucent,£3.00,3.0
Toiletries & Beauty,Collection Spotlight Shine 1 Gel Effect Top Coat 10.5ml,£4.00,4.0
Toiletries & Beauty,ColourBurst Fingernail Clipper (Orange),£2.44,2.44
Toiletries & Beauty,ColourBurst Full Sized Slant Tweezer Orange,£2.44,2.44
Toiletries & Beauty,ColourBurst Tools with Flare,£2.43,2.43
Toiletries & Beauty,Corsodyl Advanced + Intensive Gum Repair Toothpaste White & Polish 75ml,£5.00,5.0
Toiletries & Beauty,Dabur Amla Hair Oil 200ml,£3.94,3.94
Toiletries & Beauty,Dove Advanced Care Pro-Age Body Wash 400 ml,£4.95,4.95
Toiletries & Beauty,Dove Advanced Care Reviving Body Wash 225 ml,actual price£2.20,2.2
Toiletries & Beauty,Dove Advanced Eucalyptus + Mint Anti-Perspirant Aerosol 200 ml,£4.94,4.94
Toiletries & Beauty,Dove Anti-Perspirant Aerosol Powder Soft 200 ml,£2.76,2.76
Toiletries & Beauty,Dove Care + Visible Glow Light to Medium Self Tan Lotion 400 ml,£4.25,4.25
Toiletries & Beauty,Dove Classic Fresh Anti-Perspirant Cream 50 ml,£1.88,1.88
Toiletries & Beauty,Dove Fresh Care Anti-Perspirant Roll On 50 ml,£1.38,1.38
Toiletries & Beauty,Dove Nourishing Body Wash 225 ml,£1.75,1.75
Toiletries & Beauty,Dove Turmeric Milk & Lemon Drop Beauty Bar 141 g,actual price£1.98,1.98
Toiletries & Beauty,Duo Quick-Set Striplash Adhesive 7g,£6.96,6.96
