Category,Name,Price,Price_Numeric
"Baby, Toddler & Kids",ASDA Yuck Puffy Sticker Activity Book,£3.00,3.0
"Baby, Toddler & Kids","Aptamil 2 Follow On Baby Milk Liquid Formula, Ready to Drink, 6-12 Months, 200ml",actual price£1.00,1.0
"Baby, Toddler & Kids",Aptamil Anti-Reflux From Birth to 12 Months 800g,£18.97,18.97
"Baby, Toddler & Kids","Aptamil Creamed Porridge Baby Cereal, 4-6+ Months, 125 g",£2.38,2.38
"Baby, Toddler & Kids","Aveeno AVEENO Baby Nappy Cream, 100ml",£4.97,4.97
"Baby, Toddler & Kids","Aveeno Baby Daily Care Moisturising Lotion with Colloidal Oatmeal, For Sensitive Skin, 75ml",£2.54,2.54
"Baby, Toddler & Kids",Bonya by Kendamil Follow On Milk 6-12 Months 800g,£7.48,7.48
"Baby, Toddler & Kids",Cantu Care for Kids Curling Cream 227g,£4.40,4.4
"Baby, Toddler & Kids",Cat's Cookbook - Julia Donaldson,£4.97,4.97
"Baby, Toddler & Kids",Cerelac Infant Cereals with Milk Mixed Fruits & Wheat 7+ Months 1kg,£9.06,9.06
"Baby, Toddler & Kids",Cerelac Infant Cereals with Milk Rice 6+ Months 160g,£2.23,2.23
"Baby, Toddler & Kids",Cerelac Infant Cereals with Milk Wheat 6+ Months 1kg,£9.06,9.06
"Baby, Toddler & Kids",Childs Farm Baby All Over Balm 50ml Fragrance-Free Moisturiser for Newborns & Sensitive Skin,actual price£5.00,5.0
"Baby, Toddler & Kids",Childs Farm Baby Moisturiser 200ml Baby Soft Scent for Newborns & Sensitive Skin,actual price£3.00,3.0
"Baby, Toddler & Kids",Childs Farm Baby Tear-free Shampoo & Body Wash 250ml Baby Soft Scent for Newborns & Sensitive Skin,actual price£3.00,3.0
"Baby, Toddler & Kids","Childs Farm OatDerma Bubble Bath 250ml, Fragrance Free, Sensitive Skin, Baby Kids Hydrating Formula",£6.98,6.98
"Baby, Toddler & Kids","Childs Farm SlumberTime Sleep Bath Soak 250ml Lavender & Moon Milk Gentle Bubble Bath for Babies, Kids & Sensitive Skin",£6.48,6.48
"Baby, Toddler & Kids","Childs Farm SlumberTime Sleep Calming Massage Lotion 150ml Lavender & Moon Milk Gentle Moisturiser for Babies, Kids & Sensitive Skin",£7.48,7.48
"Baby, Toddler & Kids",Cow & Gate Baby Rice Cereal 100g,actual price£1.50,1.5
"Baby, Toddler & Kids","Cow & Gate Fruit Pouch Forest Fruit Baby Food Snack, 6+ Months, 100g",£0.88,0.88
"Baby, Toddler & Kids","Cow & Gate Fruit Pouch Pear Carrot Prune & Beetroot Baby Food Snack, 6+ Months, 100g",£0.88,0.88
"Baby, Toddler & Kids","Cow & Gate Tomato Ham & Pasta Baby Food Meal Jar, 10+ Months, 200g",£0.94,0.94
"Baby, Toddler & Kids",Dentinox Cradle Cap Treatment Shampoo from Birth 125ml,£2.34,2.34
"Baby, Toddler & Kids",Ella's Kitchen BBQ Flavour Crunchy Veg Waves 5 x 10g (50g),actual price£2.50,2.5
"Baby, Toddler & Kids",Ella's Kitchen Bananas + Strawberry Rice Pudding with Coconut Milk 7+ Months 80g,£1.26,1.26
"Baby, Toddler & Kids",Ella's Kitchen Mild Chilli Con Carne with a Pinch of Paprika 7+ Months 130g,£1.48,1.48
"Baby, Toddler & Kids",Ella's Kitchen Tomato + Basil Melty Sticks from 7 Months 16g,actual price£0.90,0.9
"Baby, Toddler & Kids",Ella's Kitchen Tomato + Basil Melty Sticks from 7 Months 4 x 6g (24g),actual price£2.00,2.0
"Baby, Toddler & Kids",Ella's Kitchen Veggie Biryani with Mighty Mushrooms 7+ Months 130g,£1.48,1.48
"Baby, Toddler & Kids",Ella's Kitchen Veggie Lasagne with Cheese 7+ Months 130g,£1.48,1.48
"Baby, Toddler & Kids","Heinz Baby Food Apple, Banana & Cereals Immunity Support Pouch 6+ Months 85g",£0.93,0.93
"Baby, Toddler & Kids","Heinz Baby Food Blueberry, Coconut & Oat Immunity Support fruit pouch 7+ Months 85G",£0.93,0.93
"Baby, Toddler & Kids","Heinz Baby Food Pear, Raspberry & Yoghurt Immunity Support Fruit Pouch 7+ Months 85g",£0.93,0.93
"Baby, Toddler & Kids",Heinz Baby Food Strawberry & Yoghurt Immunity Support Fruit Pouch 6+ Months 85g,£0.93,0.93
"Baby, Toddler & Kids",Heinz By Nature Beef & Sweet Potato Mash Baby Food Jar 6+ Months 120g,£0.84,0.84
"Baby, Toddler & Kids",Heinz By Nature Cottage Pie Baby Food Tray 12+ Months 200g,£1.68,1.68
"Baby, Toddler & Kids",Heinz By Nature Pasta Bake with Tuna Baby Food Jar 7+ Months 200g,£1.07,1.07
"Baby, Toddler & Kids",Heinz Fruity Banana Custard Dessert Pots 6+ Months 4 x 100g Baby Food,£2.30,2.3
"Baby, Toddler & Kids",Heinz Sweet Potato & Beef Casserole Baby Food Pouch 7+ Months 130g,£1.14,1.14
"Baby, Toddler & Kids",HiPP Organic Organic 1 First Infant Milk from Birth 800g,£13.48,13.48
"Baby, Toddler & Kids",Huggies DryNites Boys Pyjama Pants for Bedwetting 13+ 48-60kg  MEGA PACK 20 pants,£10.48,10.48
"Baby, Toddler & Kids",Huggies DryNites Girls Pyjama Pants for Bedwetting 13+ Yrs 48-60kg MEGA Pack 20 pants,£10.48,10.48
"Baby, Toddler & Kids",Huggies® Pure Plastic Free Baby wipes - 12 packs of 48 wipes,£8.98,8.98
"Baby, Toddler & Kids",Johnson's JOHNSON'S Baby Classic Shampoo 100ml,£1.50,1.5
"Baby, Toddler & Kids",Johnson's Johnson's No More Tangles Kids Conditioner Spray Easy Combing 200ml,actual price£2.50,2.5
"Baby, Toddler & Kids",Kendamil Follow-on Milk 2 6-12 Months 800g,£11.98,11.98
"Baby, Toddler & Kids",Kiddylicious Apple & Carrot Cookie Squares 18+ Months 6 x 24g (144g),actual price£2.40,2.4
"Baby, Toddler & Kids",Kiddylicious Big Kids Pizza Veggie Straws 4 x 12g,£2.67,2.67
"Baby, Toddler & Kids",Kiddylicious Blueberry Wafers 4 x 4g (16g),£1.04,1.04
"Baby, Toddler & Kids","Kiddylicious Strawberry, Banana & Beetroot Cookie Squares 18+ Months 6 x 24g (144g)",actual price£2.40,2.4
"Baby, Toddler & Kids",Kiddylicious Sweetcorn Melty Tubes 4 x 10g (40g),£2.38,2.38
"Baby, Toddler & Kids",Kids Stuff Crazy Soap Foaming Soap Blue 225ml,£1.98,1.98
"Baby, Toddler & Kids",LITTLE ANGELS by ASDA Baby Lotion 500ml,£0.92,0.92
"Baby, Toddler & Kids",LITTLE ANGELS by ASDA Carrot Flavoured Puffs 7m+ 20g,£0.64,0.64
"Baby, Toddler & Kids",LITTLE ANGELS by ASDA Little Angels Comfort & Protect Size 5 12-17kg 38 Nappy Pants,£3.36,3.36
"Baby, Toddler & Kids",LITTLE ANGELS by ASDA Little Angels by  Newborn Size 2 4-8kg 44 Nappies,£1.25,1.25
"Baby, Toddler & Kids","LITTLE ANGELS by ASDA Organic Mango, Banana & Apple 6m+ 120g",£0.68,0.68
"Baby, Toddler & Kids",LITTLE ANGELS by ASDA by  60 Lightly Fragranced Baby Wipes,£0.56,0.56
"Baby, Toddler & Kids",LITTLE ANGELS by ASDA by  Bedtime Head to Toe Wash 500ml,£0.92,0.92
"Baby, Toddler & Kids","LITTLE ANGELS by ASDA by  Organic Sweet Potato, Red Lentil & Spinach Dhal 7m+ 130g",£0.57,0.57
"Baby, Toddler & Kids",MAM Teat 2 2+ Months,£6.86,6.86
"Baby, Toddler & Kids",Munchkin 6 Soft Tip Infant Spoons 4M+,£2.84,2.84
"Baby, Toddler & Kids",Munchkin Farm 8 Bath Squirts 9 M+,£9.89,9.89
"Baby, Toddler & Kids",My Expert Midwife Spritz for Bits Instant Relief 100ml,£14.94,14.94
"Baby, Toddler & Kids",Nuby 2 Baby Plates 6+m,£4.94,4.94
"Baby, Toddler & Kids",Nuby Lots-a-Loops Teether 3m+,£6.48,6.48
"Baby, Toddler & Kids",Organix Melty Organic Sweetcorn Rings Baby Puffs Snack 20g 6 months+,£0.76,0.76
"Baby, Toddler & Kids","Pampers 99% Water Baby Wipes, 60 Baby Wet Wipes",£2.98,2.98
"Baby, Toddler & Kids","Pampers Baby-Dry Nappy Pants Size 4+, 66 Nappies, 9kg-15kg, Jumbo+ Pack",£12.98,12.98
"Baby, Toddler & Kids","Pampers Baby-Dry Nappy Pants Size 9, 40 Nappies, 19kg+, Jumbo+ Pack",£12.98,12.98
"Baby, Toddler & Kids","Pampers Baby-Dry Size 3, 50 Nappies",£9.98,9.98
"Baby, Toddler & Kids","Pampers Baby-Dry Size 5, 72 Nappies",£12.98,12.98
"Baby, Toddler & Kids","Pampers Baby-Dry Size 6, 33 Nappies",£9.98,9.98
"Baby, Toddler & Kids","Pampers Baby-Dry Size 8, 52 Nappies, 17kg+, Jumbo+ Pack",£12.98,12.98
"Baby, Toddler & Kids","Pampers Pyjama Pants Unisex Hearts, 4 - 7 Years, 10 Pyjama Pants, 17kg-30kg",£4.98,4.98
"Baby, Toddler & Kids","Piccolo Organic Cocomelon Oaty Bars Apple, Banana & Blueberry with Acerola 12+ Months 138g (6 x 23g)",£2.42,2.42
"Baby, Toddler & Kids",Piccolo Organic Cocomelon Oaty Bars Blushing Berries with Acerola 12+ Months 6 x 23g (138g),£2.42,2.42
"Baby, Toddler & Kids",Pyo Sign,£1.00,1.0
"Baby, Toddler & Kids","SMA Anti Reflux Baby Milk Powder Formula, From Birth 800g",£15.74,15.74
"Baby, Toddler & Kids",SMA First Infant Milk from Birth 6 x 200ml,£5.98,5.98
"Baby, Toddler & Kids",SMA ® 1 First Infant Baby Milk Premade Liquid Formula from birth 1 litre,£4.48,4.48
"Baby, Toddler & Kids",SMA ® 1 First Infant Baby Milk Premade Liquid Formula from birth 200ml,£1.04,1.04
"Baby, Toddler & Kids",SMA ® 1 First Infant Milk Liquid Formula Starter Pack from birth 6x70ml,£7.98,7.98
"Baby, Toddler & Kids",SMA ® 3 Toddler Baby Milk Ready to Drink Liquid Formula 1-3 Years 200ml,actual price£0.84,0.84
"Baby, Toddler & Kids",SMA ® Extra Hungry Baby Milk Powder Infant Formula 800g,£11.76,11.76
"Baby, Toddler & Kids",SMA ® Stage 1 First Infant Baby Milk Formula Powder from birth 800g,£13.43,13.43
"Baby, Toddler & Kids",Tommee Tippee 1x Original and Day & Night Perfect Prep Replacement Filter,£12.97,12.97
"Baby, Toddler & Kids","Tommee Tippee 1x Starter Spout Cup, Easy-Grip, 4 Months+, Assorted Colours",actual price£4.32,4.32
"Baby, Toddler & Kids","Tommee Tippee 2x Anytime Soother, 0-6 months, Symmetrical, BPA-Free Soothers",£5.13,5.13
"Baby, Toddler & Kids","Tommee Tippee 2x Newborn Soothers, Extra Small Baglet & Shield for Babies , 0-2m",£5.46,5.46
"Baby, Toddler & Kids",Tool Set,£3.00,3.0
"Baby, Toddler & Kids",Windmills,£1.50,1.5
Bakery,ASDA 6 Sweet & Creamy Bananas,£0.94,0.94
Bakery,ASDA Free From 16 Chocolate Cornflake Clusters 160g,£3.64,3.64
Bakery,ASDA Free From Free From by  Lemon Loaf Cake,£2.58,2.58
Bakery,ASDA Free From Free From by  Penne 500g,£0.74,0.74
Bakery,ASDA Strawberries 227g,£1.86,1.86
Bakery,ASDA Sugar Mini Ring Donuts 9pk,£1.58,1.58
Bakery,ASDA The Bakery 6 Classic Waffles 250g,£1.94,1.94
Bakery,ASDA The Bakery Iced Madeira Cake,£1.74,1.74
Bakery,ASDA White Baguette 230g,£1.36,1.36
Bakery,Birds Eye 2 Breaded Gluten Free Fish Fillets 250g,£3.84,3.84
Bakery,Bonne Maman Crème Brûlée Dessert 2 x 100g,£3.22,3.22
Bakery,Brompton House Coconut Macaroons 4 x 33.5g (134g),actual price£1.00,1.0
Bakery,Cadbury Milk Chocolate Mini Rolls Cakes 10 Pack,actual price£2.47,2.47
Bakery,Exceptional By ASDA 2 Free From Triple Chocolate Muffins,£2.74,2.74
Bakery,Exceptional by ASDA 4 Buttermilk Pancakes,£1.75,1.75
Bakery,Exceptional by ASDA 9 Mini Chocolate Cupcakes,£3.50,3.5
Bakery,Exceptional by ASDA Free From Victoria Sponge Cake,£4.18,4.18
Bakery,Exceptional by ASDA Large Sourdough Seeded Boule 600g,£2.82,2.82
Bakery,Exceptional by ASDA Lemon Drizzle Cake,actual price£2.37,2.37
Bakery,Exceptional by ASDA Multiseed Stonebaked Baguettes 2 x 125g (250g),£1.83,1.83
Bakery,Exceptional by ASDA Stonebaked Pave Rolls 4 x 75g (300g),£1.83,1.83
Bakery,Exceptional by ASDA White Tinned Sourdough Loaf 500g,£2.08,2.08
Bakery,Free From By ASDA 4 Cherry Bakewells 205g,£2.37,2.37
Bakery,Free From by ASDA 4 Hot Dog Rolls 320g,£2.70,2.7
Bakery,Free From by ASDA 6 Assorted Jam Tarts,£2.00,2.0
Bakery,Genius 4 Multiseeded Rolls,£2.28,2.28
Bakery,Genius Tiger Bloomer 400g,£3.24,3.24
Bakery,George Home Number Light 1,£5.00,5.0
Bakery,George Home Rose Gold Happy Birthday Banner,£1.00,1.0
Bakery,JUST ESSENTIALS by ASDA 10 Sultana Scones,£1.32,1.32
Bakery,JUST ESSENTIALS by ASDA Fruit Cake,£1.25,1.25
Bakery,Kingsmill Soft White Bread Thick Sliced Loaf 800g,£1.30,1.3
Bakery,Kingsmill Tiger Bloomer 750g,£1.48,1.48
Bakery,Miracle-Gro Lawn Maintenance Soluble Lawn Food 1kg,£5.97,5.97
Bakery,Mission Wheat & White Mini Tortilla Wraps 6 Pack,£1.00,1.0
Bakery,Mr Kipling Custard Cream Whirls Cakes 4 Pack,£1.00,1.0
Bakery,Mr Kipling Lemon & Raspberry Whirls Cakes 4 Pack,£1.00,1.0
Bakery,Mr Kipling Manor House Cake 390g,£3.48,3.48
Bakery,Nickelodeon Celebration Cake,£14.00,14.0
Bakery,OMV! Deliciously Vegan Plant Based OMV! 4 Choc Brownies 146g,£3.50,3.5
Bakery,Old El Paso 8 Street Vibes Soft Taco Wraps 220g,£1.85,1.85
Bakery,Soreen Lift Bars Blueberry 4 x 42g,£1.90,1.9
Bakery,St Pierre 6 Brioche Buns,actual price£1.98,1.98
Bakery,The BAKERY at ASDA 15 Chocolate Cluster Mini Bites,actual price£2.00,2.0
Bakery,The BAKERY at ASDA 15 Mini Chocolate Cupcakes,£7.00,7.0
Bakery,The BAKERY at ASDA 4 Chocolate & Caramel Cupcakes,£2.22,2.22
Bakery,The BAKERY at ASDA 4 Pink Ring Donuts,£0.93,0.93
Bakery,The BAKERY at ASDA 5 Chocolate Donuts,£1.27,1.27
Bakery,The BAKERY at ASDA Banana Flavour Loaf Cake,£1.86,1.86
Bakery,The BAKERY at ASDA Heavenly Angel Cake,£1.74,1.74
Bakery,The BAKERY at ASDA The Bakery 18 Milk Choc Chip Mini Cookies 171g,actual price£2.00,2.0
Bakery,The BAKERY at ASDA The Bakery 2 Kebab Breads 330g,£1.48,1.48
Bakery,The BAKERY at ASDA The Bakery 4 White Rolls,£1.00,1.0
Bakery,The BAKERY at ASDA The Bakery 5 Plain Bagels,£1.08,1.08
Bakery,The BAKERY at ASDA The Bakery 6 White Pittas 360g,£0.50,0.5
Bakery,The BAKERY at ASDA The Bakery Seeded Thick Sliced 800g,£1.26,1.26
Bakery,The BAKERY at ASDA The Bakery Sliced Brioche Loaf 500g,£1.69,1.69
Bakery,The BAKERY at ASDA The Bakery Sliced Tiger Tin Loaf 800g,£1.48,1.48
Bakery,The BAKERY at ASDA The Bakery Sliced Wholemeal Tin Loaf 400g,£1.32,1.32
Bakery,The BAKERY at ASDA The Bakery Sliced Wholemeal Tin Loaf 800g,£1.52,1.52
Bakery,The BAKERY at ASDA The Bakery at  2 Sweet Treat Custard Slices,£1.85,1.85
Bakery,The BAKERY at ASDA The Bakery at  6 Soft White Rolls,£1.14,1.14
Bakery,The BAKERY at ASDA The Bakery at  Delicious Rhubarb Crumbles 2 x 135g (270g),£2.64,2.64
Bakery,The BAKERY at ASDA The Bakery at  Madeira Gift Cake,£5.00,5.0
Bakery,The BAKERY at ASDA The Bakery at  Unicorn Cake,£15.00,15.0
Bakery,Thorntons Triple Layer Chocolate Celebration Cake,£15.00,15.0
Bakery,Warburtons 4 Soft & Sliced Fruity Thin Bagels with Orange & Raisin,£1.53,1.53
Bakery,Warburtons 6 Original Thin Bagels,£1.53,1.53
Bakery,Warburtons 6 White Rolls,£1.20,1.2
Bakery,Warburtons 6 Wholemeal Rolls,£1.20,1.2
Bakery,Warburtons 9 Original Crumpets,£1.15,1.15
Bakery,Warburtons 9 Seeds & Grain Fibre Fix 500g,actual price£1.50,1.5
Bakery,Warburtons Choc Chip Belgian Waffle 70g,£1.14,1.14
Bakery,Warburtons Pearl Sugar Belgian Waffle 70g,£1.14,1.14
Bakery,Yorkshire Baking Company Mega Loaf Madeira,£2.84,2.84
"Beer, Wine & Spirits",1000 Stories Zinfandel 75cl,actual price£12.50,12.5
"Beer, Wine & Spirits",ASDA Coconut Bay 70cl,£7.25,7.25
"Beer, Wine & Spirits",ASDA Extra Special Barbera D'asti 75cl,£8.00,8.0
"Beer, Wine & Spirits",ASDA Extra Special Carménère,£7.50,7.5
"Beer, Wine & Spirits",ASDA London Dry Gin 35cl,£7.00,7.0
"Beer, Wine & Spirits",ASDA Triple Distilled Vodka 1.5 Litre,£25.70,25.7
"Beer, Wine & Spirits","Aperol Aperitivo, 11% ABV - Italian Spritz Cocktail 70cl",£10.00,10.0
"Beer, Wine & Spirits",Apothic Red Wine 750ml,actual price£10.00,10.0
"Beer, Wine & Spirits",Archers Schnapps 70cl,£11.50,11.5
"Beer, Wine & Spirits",Asquith Gardens Traditional English Sparkling Wine 75cl,£18.25,18.25
"Beer, Wine & Spirits",Australian Red Wine 3L,£19.50,19.5
"Beer, Wine & Spirits",Barefoot Merlot Red Wine 750ml,actual price£7.50,7.5
"Beer, Wine & Spirits",Beavertown Gamma Ray American Pale Ale 440ml,£3.26,3.26
"Beer, Wine & Spirits",Bell's Original Blended Scotch Whisky 40% vol 70cl,£15.97,15.97
"Beer, Wine & Spirits",Birra Moretti Premium Lager Beer Bottle 4x330ml,£6.97,6.97
"Beer, Wine & Spirits",Birrificio Angelo Poretti Premium Italian Lager 12 x 440ml,£13.00,13.0
"Beer, Wine & Spirits","Bombay Sapphire BOMBAY SAPPHIRE London Dry Gin, 70cl",£23.88,23.88
"Beer, Wine & Spirits",Brady's Country Cream 70cl,£6.25,6.25
"Beer, Wine & Spirits",Brancott Estate Sauvignon Blanc White Wine 75cl,actual price£8.00,8.0
"Beer, Wine & Spirits",Brew York Time Travelling Taxi Hazy IPA 4 x 330ml,£5.97,5.97
"Beer, Wine & Spirits",BrewDog Juice Shack Session Neipa 4 x 330ml,£6.04,6.04
"Beer, Wine & Spirits",BrewDog Wingman Session IPA 10 x 330ml,£10.00,10.0
"Beer, Wine & Spirits",Bud Light Lager Beer Cans 18x440ml,£11.50,11.5
"Beer, Wine & Spirits",Bumbu Rum Co. The Original Rum with Natural Flavours 70cl,actual price£29.50,29.5
"Beer, Wine & Spirits",Busby Estate Jammy The Red 1.5 Litres,£12.00,12.0
"Beer, Wine & Spirits",Busby Estate Shiraz 75cl,£5.00,5.0
"Beer, Wine & Spirits",Captain Morgan Original Spiced Gold 35% vol 1L,£23.25,23.25
"Beer, Wine & Spirits",Captain Morgan Original Spiced Gold and Pepsi MAX® Pre-mix 6x250ml 5% vol can,£7.50,7.5
"Beer, Wine & Spirits",Carlsberg Export Export Lager Beer Cans 10 x 440ml,£10.14,10.14
"Beer, Wine & Spirits",Casa Luis Cava Rosé Extra Dry 75cl,£6.00,6.0
"Beer, Wine & Spirits",Casamigos Blanco Tequila 40% vol 70cl,actual price£36.00,36.0
"Beer, Wine & Spirits",Casillero del Diablo Chardonnay 75cl,£8.50,8.5
"Beer, Wine & Spirits",Champagne Jacquart Mosaïque Brut 750ml,actual price£34.00,34.0
"Beer, Wine & Spirits",Corona Extra Beer Cocktail Pack,£6.00,6.0
"Beer, Wine & Spirits",Cruzcampo Sevilla Lager Beer 4.4% ABV Pint Cans 4x568ml,£6.74,6.74
"Beer, Wine & Spirits",Dark Horse Chardonnay White Wine 750ml,actual price£9.00,9.0
"Beer, Wine & Spirits",Disaronno Velvet Liqueur 500ml,£18.00,18.0
"Beer, Wine & Spirits",Echo Falls White Zinfandel Rosé Wine 75cl,£5.75,5.75
"Beer, Wine & Spirits",Exceptional By Asda Exceptional by  Palacio De Vivero Rueda Verdejo 75cl,£7.50,7.5
"Beer, Wine & Spirits",Exceptional by ASDA Bordeaux Supérieur 75cl,£7.75,7.75
"Beer, Wine & Spirits",Exceptional by ASDA Exceptional by  Asti 75cl,£4.70,4.7
"Beer, Wine & Spirits",Exceptional by ASDA Exceptional by  Sicilian Reserve Red 75cl,£9.00,9.0
"Beer, Wine & Spirits",Exceptional by ASDA Exceptional by  Valdobbiadene Prosecco Brut 75cl,actual price£8.25,8.25
"Beer, Wine & Spirits",Famille Perrin Les Cardinaux 750ml,£10.75,10.75
"Beer, Wine & Spirits",Fillipo Sansovino Pinot Grigio Rosé 75cl,£6.25,6.25
"Beer, Wine & Spirits",Foster's Beer Lager Cans 24 x 440ml,actual price£13.00,13.0
"Beer, Wine & Spirits",Foster's Beer Lager Pint Cans 4 x 568ml,£4.75,4.75
"Beer, Wine & Spirits",Freixenet 0% Alcohol Free Sparkling 750ml,£4.97,4.97
"Beer, Wine & Spirits",Freixenet Italian Rosé 750ml,£12.25,12.25
"Beer, Wine & Spirits",Freixenet Italian Rosé 75cl,£9.75,9.75
"Beer, Wine & Spirits",Gallo Family Vineyards White Grenache Rosé Wine 750ml,£5.25,5.25
"Beer, Wine & Spirits",Gallo Family Vineyards White Zinfandel Rosé Wine 750ml,£5.25,5.25
"Beer, Wine & Spirits",Gordon's Premium Pink Alcohol Free Spirit 0.0% vol 70cl,actual price£10.00,10.0
"Beer, Wine & Spirits",Gordon's Premium Pink Flavoured Gin Based Spirit Drink 35% vol 35cl,£11.00,11.0
"Beer, Wine & Spirits",Haig Club Clubman Single Grain Scotch Whisky 40% vol 70cl Bottle,actual price£19.50,19.5
"Beer, Wine & Spirits",Hardys Crest Chardonnay White Wine 75cl,£8.25,8.25
"Beer, Wine & Spirits",Hardys VR Merlot Red Wine 75cl,actual price£6.25,6.25
"Beer, Wine & Spirits",Hardys VR Pinot Grigio White Wine 75cl,actual price£6.25,6.25
"Beer, Wine & Spirits",Inch's Reserve Premium Apple Cider Bottle 7.4% Alc 500ml,£2.75,2.75
"Beer, Wine & Spirits",Jack Daniel's Tennessee Whiskey Blended with Apple Liqueur 35 cL,£12.00,12.0
"Beer, Wine & Spirits",Jam Shed Malbec Red Wine 75cl,actual price£6.75,6.75
"Beer, Wine & Spirits",Jam Shed Shiraz Boxed Red Wine 1.5L,£14.50,14.5
"Beer, Wine & Spirits",Jameson Triple Distilled Blended Irish Whiskey 70cl,actual price£21.00,21.0
"Beer, Wine & Spirits",Jameson Triple Distilled Irish Whiskey 1L,£34.50,34.5
"Beer, Wine & Spirits",Jameson Triple Distilled Irish Whiskey 35cl,£13.25,13.25
"Beer, Wine & Spirits",Jim Beam Kentucky Straight Bourbon Whiskey 1L,actual price£20.50,20.5
"Beer, Wine & Spirits",John Smith's Beer Extra Smooth Pale Ale 15 x 440 ml,£13.00,13.0
"Beer, Wine & Spirits",Kopparberg Premium Cider 18 x 330ml,£13.00,13.0
"Beer, Wine & Spirits",Kopparberg Premium Cider with Mixed Fruit 10 x 330ml,actual price£10.00,10.0
"Beer, Wine & Spirits",La Gioiosa Prosecco Rosé 20cl,£10.00,10.0
"Beer, Wine & Spirits",La Moneda Premium Collection Malbec 75cl,£6.50,6.5
"Beer, Wine & Spirits",La Vieille Rosé Wine,actual price£13.50,13.5
"Beer, Wine & Spirits",Lamb's Pineapple Rum Spirit Drink 100cl,£19.97,19.97
"Beer, Wine & Spirits",Le Manoir Chardonnay 75cl,£5.50,5.5
"Beer, Wine & Spirits",Louis Jadot Mâcon-Villages,actual price£12.00,12.0
"Beer, Wine & Spirits",Malibu Original White Rum with Coconut Flavour 70cl,£16.16,16.16
"Beer, Wine & Spirits",Malibu Pre-Mixed Sparkling Cola Rum Drink 250ml,£1.97,1.97
"Beer, Wine & Spirits","Martini Bianco Vermouth Aperitivo, 75cl",£12.75,12.75
"Beer, Wine & Spirits",McGuigan Black Label Red Australian Wine 75cl,actual price£6.00,6.0
"Beer, Wine & Spirits",McGuigan Classic Pinot Grigio Australian White Wine 75cl,£5.50,5.5
"Beer, Wine & Spirits",Mount Gay Eclipse Barbados Golden Rum 70cl,actual price£19.00,19.0
"Beer, Wine & Spirits",Moët & Chandon Rosé Impérial Champagne 75cl,£55.00,55.0
"Beer, Wine & Spirits",Old Mout Berries & Cherries Can 10x330ml,actual price£8.50,8.5
"Beer, Wine & Spirits",Old Mout Cider Berries & Cherries Bottle 500ml,£2.40,2.4
"Beer, Wine & Spirits",Old Mout Mango & Passionfruit Cans 10 x 330ml,actual price£8.50,8.5
"Beer, Wine & Spirits",Old Speckled Hen English Pale Ale 500ml,£2.27,2.27
"Beer, Wine & Spirits",Peroni Nastro Azzurro 0.0% Italian Non-Alcoholic Beer 4 x 330ml Bottles,£4.97,4.97
"Beer, Wine & Spirits",Pimm's No. 1 Cup & Lemonade Ready to Drink 5.4% vol 250ml Can,£2.32,2.32
"Beer, Wine & Spirits",Pink Gin Spirit Selection 3 x 5cl,£7.57,7.57
"Beer, Wine & Spirits",Red Stripe Jamaican Lager Beer 4 x 568ml,£7.00,7.0
"Beer, Wine & Spirits",Refined & Elegant Merlot 2.25 Litres,£15.50,15.5
"Beer, Wine & Spirits",Refined & Elegant Wine Wine Malbec 2.25 litres,£15.50,15.5
"Beer, Wine & Spirits",Robinsons Old Tom Strong Ale 330ml,£2.56,2.56
"Beer, Wine & Spirits",San Miguel Premium Lager Beer Bottles 18x330ml,actual price£15.00,15.0
"Beer, Wine & Spirits",San Miguel Premium Lager Beer Cans 4x568ml,actual price£6.50,6.5
"Beer, Wine & Spirits",San Miguel Premium Larger Beer Bottle 620ml,£1.97,1.97
"Beer, Wine & Spirits",Schöfferhofer Hefeweizen Premium Wheat Beer 0.5L,£1.85,1.85
"Beer, Wine & Spirits",Shepherd Neame Classic Collection India Pale Ale 500ml,£2.56,2.56
"Beer, Wine & Spirits",Smirnoff Gift Set,£6.50,6.5
"Beer, Wine & Spirits",Smirnoff Ice Raspberry 4% vol Ready To Drink Premix 70cl Bottle,£2.98,2.98
"Beer, Wine & Spirits",Smirnoff No. 21 Vodka and Diet Cola Ready to Drink 5% vol 250ml,£1.97,1.97
"Beer, Wine & Spirits",Southern Comfort Original Liqueur with Whiskey 70cl,£16.00,16.0
"Beer, Wine & Spirits",Spitfire Kentish Amber Ale 500ml,£2.02,2.02
"Beer, Wine & Spirits",St Austell Brewery IPA 500ml,£1.94,1.94
"Beer, Wine & Spirits",Strongbow Dark Fruit Cider 4% ABV Can 15x440ml,£14.94,14.94
"Beer, Wine & Spirits",Studio Zero Alcohol Free Merlot 75cl,£3.18,3.18
"Beer, Wine & Spirits",Studio Zero Alcohol Free Tempranillo Rosé 75cl,£3.18,3.18
"Beer, Wine & Spirits",Symonds Scrumpy Jack Premium British Cider 6.0% Multipack Cans 4x500ml,actual price£5.50,5.5
"Beer, Wine & Spirits",Taittinger Taittinger Brut Réserve Champagne,£44.00,44.0
"Beer, Wine & Spirits",Thatchers Blood Orange Cider 10 x 330ml,£11.47,11.47
"Beer, Wine & Spirits",Thatchers Cloudy Lemon Cider 4 x 440ml,actual price£5.25,5.25
"Beer, Wine & Spirits",Thatchers Zero Somerset Cider 500ml,£1.84,1.84
"Beer, Wine & Spirits",The Ardmore Legacy Single Malt Scotch Whisky 70cl,actual price£20.50,20.5
"Beer, Wine & Spirits",The Famous Grouse Blender's Edition Smoky Black Blended Scotch Whisky 700ml,actual price£17.50,17.5
"Beer, Wine & Spirits",The Wine Atlas Cinsault 75cl,£7.00,7.0
"Beer, Wine & Spirits",Thornbridge Jaipur India Pale Ale 500ml,£2.54,2.54
"Beer, Wine & Spirits",Torre de Lapela Vinho Verde 750ml,£6.00,6.0
"Beer, Wine & Spirits",Tukituki Sauvignon Blanc Marlborough 75cl,£8.00,8.0
"Beer, Wine & Spirits",Vault City Jungle Juice Modern Sour Beer 440ml,£3.97,3.97
"Beer, Wine & Spirits",Vermouth Bianco 100cl,£8.50,8.5
"Beer, Wine & Spirits",Vicelo Pinot Grigio 75cl,£5.00,5.0
"Beer, Wine & Spirits",Villa Maria Private Bin Sauvignon Blanc,actual price£8.75,8.75
"Beer, Wine & Spirits",Vina Sol Torres 75cl,£5.00,5.0
"Beer, Wine & Spirits",Vodka Spirit Selection,£7.57,7.57
"Beer, Wine & Spirits",WKD Mixed Original Vodka Mix 10x 330ml,actual price£10.00,10.0
"Beer, Wine & Spirits",WKD Original Blue Vodka Mix 10 x 330ml,actual price£10.00,10.0
"Beer, Wine & Spirits",WKD Original Blue Vodka Mix 700ml,£3.00,3.0
"Beer, Wine & Spirits",Wolf Blass The Classic Red Label Collection Chardonnay Semillon 750ml,£6.25,6.25
Chilled Food,ASDA 10 British Mature Cheddar Slices 250g,£2.45,2.45
Chilled Food,ASDA 18 Cheese & Onion Rolls 180g,£1.80,1.8
Chilled Food,ASDA 2 Sausage & Cheesy Bean Slices 300g,£1.74,1.74
Chilled Food,ASDA 3 Cheese & Onion 410g,£2.70,2.7
Chilled Food,ASDA 4 Scotch Eggs 452g,£2.38,2.38
Chilled Food,ASDA 6 Pepperoni Pizza Parcels 150g,£2.15,2.15
Chilled Food,ASDA 8 Slices Corned Beef 250g,£2.74,2.74
Chilled Food,ASDA All-Day Breakfast Triple Sandwich,£3.00,3.0
Chilled Food,ASDA Brilliantly Buttery 500g,£0.95,0.95
Chilled Food,ASDA British Half Fat Mature Cheddar 400g,£3.17,3.17
Chilled Food,ASDA British Mild Cheddar 250g,£2.74,2.74
Chilled Food,ASDA Buffalo Chicken Wings with Ranch Dip 525g,£4.68,4.68
Chilled Food,ASDA Cheese & Onion Quiche 170g,£1.74,1.74
Chilled Food,ASDA Chicken & Bacon Caesar 250g,£1.75,1.75
Chilled Food,ASDA Chicken & Bacon Caesar Triple Wrap,£3.15,3.15
Chilled Food,ASDA Chicken & Bacon Club,£3.00,3.0
Chilled Food,ASDA Chicken & Gravy Puff Pastry Pie 500g,£4.38,4.38
Chilled Food,ASDA Chicken & Vegetable Shortcrust Pie 500g,£4.38,4.38
Chilled Food,ASDA Chilli Cypriot Grilling Cheese 225g,£2.48,2.48
Chilled Food,ASDA Chinese Style Chicken Breast Slices 160g,£2.94,2.94
Chilled Food,ASDA Classic Dip Selection 500g,£3.00,3.0
Chilled Food,ASDA Cocktail Pork Sausages 500g,£3.50,3.5
Chilled Food,ASDA Coconut Water 1 Litre,£2.02,2.02
Chilled Food,ASDA Cottage Pie 400g,£3.57,3.57
