Category,Product Name,Price
drinks,Lambrini Lightly Sparkling Original White Wine 125cl,£3.75
drinks,Kylie Minogue Prosecco Rose 75cl,£11.50
drinks,Freixenet Prosecco D.O.C. Sparkling Small Wine Bottle 20cl,£3.85
drinks,Canti Prosecco D.O.C Rose Wine 75cl,£9.50
drinks,PinotPinot Pinot Grigio Pink Fizz Rose Wine Can 20cl,£2.65
drinks,Louis Bouillot Cremant de Bourgogne Rose Wine 75cl,£15.25
drinks,McGuigan Zero 0.0% Alcohol Free Australian Rose Wine Based Drink 75cl,£4.50
drinks,Nicolas Feuillatte Champagne 75cl,£29.50
drinks,"Sainsbury’s Crémant de Limoux Red Wine, Taste the Difference 75cl",£12.00
drinks,Freixenet Cordon Negro Brut Cava Small Wine Bottle 20cl,£3.50
drinks,Chapel Down NV Brut White Wine 75cl,£30.00
drinks,Terra Organica Prosecco 75cl,£12.75
drinks,Sainsbury's Brut Rosé Champagne 75cl,£25.00
drinks,Freixenet Italian Sparkling Rosé Small Wine Bottle 20cl,£3.85
drinks,Yellow Tail Prosecco DOC 75cl,£10.00
drinks,Freixenet Cordon Negro Brut Cava 75cl,£10.75
drinks,Nyetimber Classic Cuvee White Wine 75cl,£43.00
drinks,"Sainsbury's Blanc De Noirs Champagne, Taste the Difference 7...",£26.00
drinks,Maschio Prosecco DOC Extra Dry 75cl,£10.50
drinks,"Sainsbury's Fairtrade Rose Wine Moscato, Taste the Difference 75cl",£5.25
drinks,"Sainsbury's Brut Non Vintage Champagne, Taste the Difference 75cl",£24.00
drinks,Mionetto Orange Label Prosecco 75cl,£11.50
drinks,Della Vite Prosecco D.O.C Treviso Rose Wine 75cl,£22.00
drinks,Louis Bresson & Co Cremant De Bordeaux Brut Sparkling Wine 7...,£10.00
drinks,Martini Asti Italian Sparkling Wine 75cl,£8.75
drinks,Pol Guyot Selection Champagne Brut 75cl,£19.50
drinks,"Sainsbury's Blanc De Noirs Champagne, Taste the Difference 37.5cl",£14.00
drinks,Laurent Perrier Champagne Brut 750ml,£53.00
drinks,Sainsbury's 0.0% Alcohol Free Sparkling White Wine 75cl,£3.50
drinks,Moet & Chandon Nectar Imperial Champagne 75cl,£49.00
drinks,La Vieille Ferme Reserve Rose Wine 75cl,£12.50
drinks,Kylie Minogue Prosecco D.O.C. 75cl,£11.50
drinks,PinotPinot Pinot Grigio Fizz White Wine Can 20cl,£2.60
drinks,Taittinger Brut Prestige Rosé 750ml,£49.00
drinks,"Sainsbury's Demi-sec Champagne, Non Vintage 75cl",£24.00
drinks,Graham Beck Chardonnay Pinot Noir Vintner's Selection Brut White Wine 75cl,£14.50
drinks,Freixenet Cordon Rosado Cava Rose Wine 75cl,£10.75
drinks,Liquid Diamond Prosecco D.O.C. Rose Wine 75cl,£13.50
drinks,Freixenet Celebration Set,£14.00
drinks,"Sainsbury's Ellercombe English Sparkling Wine, Taste the Difference 75cl",£22.00
drinks,Champagne Lanson Le Rosé Création 75cl,£48.00
drinks,Moët & Chandon Brut Imperial 1.5L,£92.00
drinks,"Sainsbury's Peach Spritz, Taste the Difference 75cl",£6.50
drinks,Nicolas Feuillatte Champagne Brut Rosé 75cl,£34.00
drinks,"Sainsbury's Orange Spritz, Taste the Difference 75cl",£6.50
drinks,Veuve Clicquot Brut Rosé Champagne 75cl,£57.00
drinks,Moët & Chandon Brut Imperial Rose Champagne 37.5cl,£31.00
drinks,Chapel Down English NV Rose Wine 75cl,£33.00
drinks,Chandon Brut 75cl,£17.00
drinks,Segura Viudas Brut Vintage Premium Cava 75cl,£12.00
drinks,Lanson Le Black Label Brut 20cl,£13.10
drinks,Piper Heidsieck Brut NV Champagne 75cl,£40.00
drinks,Veuve Clicquot Yellow Label Brut Non Vintage Champagne 1.5L,£99.00
drinks,Freixenet Rose Royal Rose Wine 75cl,£13.00
drinks,Moët & Chandon Brut Imperial Champagne 37.5cl,£27.50
drinks,Pommery Champagne Brut Royal 75cl,£45.00
drinks,Veuve Clicquot Vintage Reserve 75cl,£69.00
drinks,"Moët & Chandon Impérial Brut Champagne, Let's Celebrate 75cl",£45.00
drinks,Moët & Chandon Grand Vintage Champagne 75cl,£66.00
drinks,REAL Sec 0.5% Low Alcohol Sparkling White 75cl,£11.00
drinks,Bolney North Downs Classic Cuvée NV Brut White Wine 75cl,£35.00
drinks,I Heart Bubbly White Wine 75cl,£7.00
drinks,"Sainsbury's Conegliano Prosecco, Taste the Difference 1.5L",£19.50
drinks,Lanson Champagne Le Vintage 750ml,£51.00
drinks,Louis Bouillot Crémant de Bourgogne Brut White Wine 75cl,£14.00
drinks,Lanson Black Label Brut Magnum 1.5L,£80.00
drinks,Dolly Wines Prosecco Wine 75cl,£10.00
drinks,Babycham Refreshing Sparkling Perry 4 x 20cl,£3.50
drinks,Freixenet Asti White Wine 75cl,£12.50
drinks,Freixenet Brut Royal Rose Wine 75cl,£13.00
drinks,Lanson Champagne Le Black Label Brut 37.5cl,£24.00
drinks,Nyetimber Rose Wine 75cl,£45.00
drinks,Baylis & Harding Goodness Natural Pillow Mist Lavender Bergamot 100ml,£7.00
drinks,Laurent Perrier Champagne Brut 75cl,£80.00
drinks,Cloudy Bay Pelorus Brut Non Vintage Sparkling White Wine 75c...,£28.00
drinks,Tempus One Watermelon Wine Spritz 25cl,£2.25
drinks,Tempus One Berry Wine Spritz 25cl,£2.25
drinks,Mumm Marlborough Brut Prestige Red Wine 75cl,£25.00
drinks,Moët & Chandon Ice Impérial 75cl,£50.00
drinks,Asahi Super Dry 0.0% Alcohol Free Cans 4 x 330ml,£5.00
drinks,Heineken 0.0% Alcohol Free Lager Beer Can 6 x 330ml,£5.00
drinks,Captain Morgan Spiced Gold 0.0% Alcohol Free Spirit 70cl,£16.00
drinks,Guinness 0.0% Alcohol Free Stout Beer Cans 4 x 440ml,£5.45
drinks,Guinness Draught 0.0% Alcohol Free Beer 10 x 440ml,£13.25
drinks,Peroni Nastro Azzurro 0.0% Alcohol Free Beer 12 x 330ml,£13.00
drinks,Erdinger Alkoholfrei 0.5% Low Alcohol Wheat Beer 500ml,£2.00
drinks,Lucky Saint 0.5% Low Alcohol Lager 4 x 330ml,£6.00
drinks,Beck's Blue 0.0% Alcohol Free Beer Bottles x6 275ml,£4.50
drinks,Estrella Damm Alcohol Free Beer Barcelona 440ml,£5.00
drinks,"Nozeco 0.5% Low Alcohol Fine Sparkling Wine Based Drink, Special Edition 75cl",£3.50
drinks,Peroni Nastro Azzurro 0% Alcohol Free Beer 4 x 330ml,£5.50
drinks,Birra Moretti Zero 0.0% Alcohol Free Beer Bottle 4 x 330ml,£5.25
drinks,Sainsbury's 0.0% Alcohol Free Red Wine Based Drink 75cl,£3.50
drinks,McGuigan Zero Sauvignon Blanc 0.0% Alcohol Free Australian White Wine Based Drink 75cl,£4.50
drinks,Corona Cero 0.0% Alcohol Free Beer 12 x 330ml,£12.50
drinks,Heineken 0.0% Alcohol Free Premium Lager Beer Bottle 12 x 33...,£11.50
drinks,Infinite Session 0.5% Low Alcohol IPA 4 x 330ml,£4.50
drinks,BrewDog Punk 0.5% Low Alcohol IPA 4 x 330ml,£5.00
drinks,Beavertown Lazer Crush 0.3% Alcohol Free IPA 4 x 330ml,£6.50
drinks,Adnams Southwold Ghost Ship 0.5% Low Alcohol Beyond the Pale Ale 500ml,£1.65
drinks,Sainsbury's 0.0% Alcohol Free Rose Wine Based Drink 75cl,£3.50
drinks,Stella Artois 0.0% Alcohol Free Premium Lager Beer Bottles 4 x 330ml,£4.00
drinks,Inch’s 0.0% Alcohol Free Apple Cider Cans 4 x 440ml,£4.00
drinks,Corona Cero 0.0% Alcohol Free 4 x 330ml,£5.00
drinks,Leffe Blonde 0.0% Alcohol Free Beer Bottles 6 x 250ml,£5.00
drinks,Kopparberg 0.0% Alcohol Free Premium Cider Pear 500ml,£1.60
drinks,Proper Job 0.5% Low Alcohol IPA,£1.90
drinks,Thatchers 0.0% Alcohol Free Cider Cans 4 x 440ml,£4.00
drinks,Thatchers Zero 0.0% Alcohol Free Cider 500ml,£2.00
drinks,BrewDog Wingman 0.5% Low Alcohol Session IPA 4 x 330ml,£5.00
drinks,Sainsbury's Medium Dry Low Alcohol Apple Cider 500ml,£1.75
drinks,San Miguel 0.0% Alcohol Free Lager Beer Bottles 4 x 330ml,£4.75
drinks,Freixenet 0.0% Alcohol Free Sparkling Wine Based Drink 75cl,£5.00
drinks,Brooklyn Special Effects Alcohol Free Lager Beer Cans 4 x 33...,£4.50
drinks,"Nozeco 0.5% Low Alcohol Fine Sparkling Rose Wine Based Drink, Special Edition 75cl",£3.50
drinks,Freixenet 0.0% Alcohol Free Sparkling Rose Wine Based Drink 75cl,£5.00
drinks,Sainsbury's 0.0% Alcohol Free White Wine Based Drink 75cl,£3.50
drinks,BrewDog 0.5% Low Alcohol Mixed Pack 8 x 330ml,£10.00
drinks,Gordon's 0.0% Alcohol Free 70cl,£15.50
drinks,McGuigan Zero 0.0% Alcohol Free Shiraz Wine Based Drink 75cl,£4.50
drinks,Lucky Saint Hazy IPA 0.5% Low Alcohol Can 4 x 330ml,£6.00
drinks,Fever-Tree 0.5% Low Alcohol Italian Spritz 25cl,£1.90
drinks,Adnams Southwold Ghost Ship 0.5% Low Alcohol Pale Ale x4 440...,£5.00
drinks,Kopparberg 0.0% Alcohol Free Mixed Fruit Cider 500ml,£1.75
drinks,McGuigan Zero 0.0% Alcohol Free Australian Rose Wine Based Drink 75cl,£4.50
drinks,Martini Vibrante 0.0% Alcohol Free Aperitivo 75cl,£10.00
drinks,Tanqueray 0.0% Alcohol Free Spirit 70cl,£17.50
drinks,Doom Bar 0.0% Alcohol Free Amber Ale 500ml,£2.15
drinks,Wolf Blass Zero Sauvignon Blanc 0.5% Low Alcohol Wine Based Drink 75cl,£5.75
drinks,Kylie Minogue 0.0% Alcohol Free Sparkling Rose Wine Based Drink 75cl,£6.25
drinks,Kylie Minogue 0.00% Alcohol Free Sparkling Blanc Wine,£6.25
drinks,Tanqueray Flor de Sevilla 0.0% Alcohol Free Spirit 70cl,£17.50
drinks,Kopparberg 0.0% Alcohol Free Premium Cider with Strawberry & Lime 4 x 330ml,£4.00
drinks,BrewDog 0.5% Low Alcohol Hazy Jane New England IPA 4 x 330ml,£5.00
drinks,Whitley Neill Japanese Yuzu & White Strawberry 0.0%  Alcohol Free Spirit 70cl,£15.00
drinks,Old Mout Cider 0.0% Alcohol Free Berries & Cherries Bottle 500ml,£1.50
drinks,Kopparberg 0.0% Alcohol Free Cider Strawberry & Lime 50cl,£1.75
drinks,Madri Excepcional Zero Bottle 4 x 330ml,£4.75
drinks,Lucky Saint 0.5% Low Alcohol Unfiltered Lager 500ml,£2.40
drinks,Kopparberg 0.0% Alcohol Free Premium Cider with Mixed Fruit 4 x 330ml,£4.00
drinks,Sainsbury's 0.0% Alcohol Free Sparkling White Wine 75cl,£3.50
drinks,CleanCo Clean G 0.0% Alcohol Free Spirit 70cl,£16.00
drinks,Shloer Pink Non Alcoholic Bubbly Sparkling Juice Drink 750ml,£4.00
drinks,Crodino Nat 0.00% Alcohol Free x4 175ml,£8.00
drinks,Gordon's Premium Pink 0.0% Alcohol Free Spirit Bottle 70cl,£15.50
drinks,Theakston Nowt Old Peculier 500ml,£1.90
drinks,Wolf Blass Zero Shiraz 0.5% Low Alcohol Wine Based Drink 75c...,£5.75
drinks,Fever-Tree G&T 0.5% Low Alcohol Mediterranean 25cl,£1.90
drinks,Casillero Del Diablo Zero 0.5% Low Alcohol Sparkling Wine Based Drink 75cl,£6.00
drinks,Belvoir Farm Non Alcoholic Lime & Yuzu Mojito 250ml,£1.40
drinks,Kopparberg 0.0% Alcohol Free Variety Pack 10 x 330ml,£8.50
drinks,Thomson & Scott Noughty 0.0% Alcohol Free Sparkling Chardonnay Wine Based Drink 75cl,£9.50
drinks,"Sainsbury's Blanc de Blanc 0.5% Low Alcohol Sparkling Chardonnay, Taste the Difference 75cl",£4.25
drinks,Northern Monk Holy Faith Hazy 0.5% Low Alcohol Pale Ale 4 x 330ml,£5.00
drinks,Savyll Beverage Co. 0.45% Alcohol Free Cocktails 4 x 25cl,£8.00
drinks,REAL Sec 0.5% Low Alcohol Sparkling White 75cl,£11.00
drinks,Whitley Neill 0.0% Alcohol Free Rhubarb & Ginger Spirit 70cl,£15.00
drinks,Sainsbury's Pop! 0.5% Low Alcohol Zero Buck's Fizz 75cl,£3.25
drinks,Schweppes Slimline Tonic Water 12x150ml,£6.10
drinks,San Pellegrino Orange 4 x 330ml,£3.50
drinks,Schweppes Tonic Water 12x150ml,£6.10
drinks,Sainsbury's Pure Apple Juice 1L,£1.60
drinks,Sainsbury's Pure Orange Juice 1L,£1.90
drinks,Tropicana Smooth Orange Fruit Juice 900ml,£3.25
drinks,Sainsbury's Diet Indian Tonic Water 1L,85p
drinks,Sainsbury's Soda Water 1L,85p
drinks,Sainsbury's Indian Tonic Water 1L,85p
drinks,Tropicana Smooth Orange Fruit Juice 1.5L,£4.50
drinks,Appletiser Sparkling Apple Juice 6 x 250ml,£5.00
drinks,Bottlegreen Elderflower Cordial 500ml,£4.50
drinks,Schweppes Slimline Tonic Water 1L,£1.85
drinks,Tropicana Original Orange with Bits Fruit Juice 900ml,£3.25
drinks,Sainsbury's Diet Indian Tonic Water with Lemon 1L,85p
drinks,Sainsbury's Pineapple Juice 1L,£1.50
drinks,Robinsons Crushed Lime & Mint Fruit Cordial 500ml,£3.30
drinks,J2O Orange & Passion Fruit Cans 4x250ml,£3.25
drinks,Rose's Lime Juice Cordial 1L,£2.80
drinks,Ocean Spray Cranberry Classic 1L,£1.90
drinks,Sainsbury's Diet Indian Tonic Water with Lime 1L,85p
drinks,Sainsbury's Tomato Juice 1L,£1.45
drinks,Ocean Spray Cranberry Classic Light 1L,£1.90
drinks,Schweppes Tonic Water 1L,£1.85
drinks,J2O Apple & Raspberry Cans 4x250ml,£3.25
drinks,Fever-Tree Light Tonic Water 8x150ml,£5.20
drinks,San Pellegrino Lemon 4 x 330ml,£3.50
drinks,Lipton Ice Tea Peach Flavoured Still Soft Drink 1.25L,£2.25
drinks,Schweppes Slimline Lemonade 2L,£1.55
drinks,Bottlegreen Pomegranate & Elderflower Cordial 500ml,£4.50
drinks,Coca-Cola Original Taste 12x150ml,£6.75
drinks,Belvoir Farm Elderflower Cordial 500ml,£4.25
drinks,Schweppes Original Lemonade 12x150ml,£6.10
drinks,Diet Coke 12x150ml,£6.10
drinks,"Ocean Spray Juice Drink, Cranberry & Blackcurrant 1L",£1.90
drinks,Hip Pop Apple & Elderflower Kombucha 4x330ml,£5.25
drinks,Sainsbury's Cranberry Juice Drink 1L,£1.60
drinks,"Sainsbury's Dry Ginger Ale, Diet 1L",85p
drinks,Tropicana Tropical Fruit Juice 850ml,£3.25
drinks,Aqua Libra Sparkling Water Infused with Cucumber Mint & Lime 4x330ml,£3.65
drinks,Aqua Libra Sparkling Water Infused with Raspberry & Blackcurrant 4x330ml,£3.65
drinks,Bottlegreen Ginger & Lemongrass Cordial 500ml,£4.50
drinks,Fever-Tree Light Mediterranean Tonic Water 8x150ml,£5.20
drinks,San Pellegrino Blood Orange 4 x 330ml,£3.50
drinks,"Sainsbury's Bitter Lemon, Diet 1L",85p
drinks,"Sainsbury's English Elderflower Cordial, Taste the Difference 500m",£2.95
drinks,Tropicana Pineapple Fruit Juice 850ml,£3.50
drinks,Trip CBD Infused Elderflower Mint 4x250ml,£6.60
drinks,Red Bull Energy Drink 250ml x8,£10.15
drinks,"Sainsbury's Cranberry & Raspberry Juice Drink, No Added Sugar 1L ",£1.60
drinks,Trip CBD Infused Peach Ginger 4x250ml,£6.50
drinks,J2O Orange & Passion Fruit 10x275ml,£10.45
drinks,Sainsbury's Dry Ginger Ale 1L,85p
drinks,Fever-Tree Premium Indian Tonic Water 8x150ml,£5.45
drinks,Lipton Ice Tea Lemon Flavoured Still Soft Drink 1.25L,£2.25
drinks,Belvoir Farm Ginger Cordial 500ml,£4.25
drinks,Appletiser Sparkling Apple Juice 150ml,65p
drinks,Fever-Tree Light Tonic Water 500ml,£2.35
drinks,Red Bull Energy Drink Sugar Free 250ml x8,£9.75
drinks,Schweppes Slimline Elderflower Tonic Water 1L,£1.85
drinks,Fever-Tree Light Elderflower Tonic Water 8x150ml,£5.20
drinks,Fever-Tree Sparkling Ginger Beer 500ml,£2.15
drinks,Tropicana Extra Pulpy Orange with More Juicy Bits Fruit Juice 900ml,£3.25
drinks,Lipton Ice Tea Mango Flavoured Still Soft Drink 1.25L,£2.25
drinks,Tropicana Orange & Mango Fruit Juice 850ml,£3.25
drinks,Coca-Cola Zero Sugar x12 150ml,£6.10
drinks,J2O Spritz Sparkling Apple & Watermelon Cans 4x250ml,£3.25
drinks,Bottlegreen Refreshing Lime & Mint Cordial 500ml,£4.50
drinks,Tropicana Original Orange with Bits Fruit Juice 1.5L,£4.50
drinks,Robinsons Elderflower Fruit Cordial 500ml,£3.30
drinks,Fever-Tree Light Tonic Water 15x150ml,£9.00
drinks,Shloer White Grape Sparkling Juice Drink 750ml,£2.80
drinks,Fanta Orange 18x330ml,£8.50
drinks,Bundaberg Ginger Beer 4x375ml,£6.50
drinks,One Living Ginger Kombucha with Turmeric 4x250ml,£5.25
drinks,Appletiser Sparkling Apple Juice 750ml,£3.65
drinks,Hip Pop CBD Cherry & Blackberry Kombucha 4 x 330ml,£6.00
drinks,Lipton Ice Tea Raspberry Flavoured Still Soft Drink 1.25L,£2.25
drinks,Ocean Spray Cranberry & Raspberry 1L,£1.90
drinks,Belvoir Farm Blueberry & Blackcurrant Cordial 500ml,£4.25
drinks,One Living Raspberry Kombucha with Pomegranate 4x250ml,£5.25
drinks,Dash Raspberry Sparkling Water 4 x 330ml,£4.75
drinks,Tropicana Tropical Fruit Juice 1.5L,£4.50
drinks,Schweppes Soda Water 1L,£1.85
drinks,Schweppes Canada Dry Ginger Ale 1L,£1.85
drinks,Dr Pepper 18x330ml,£8.50
drinks,Nexba Naturally Sugar Free Elderflower & Lemon Kombucha 1L,£3.50
drinks,Tropicana Extra Pulpy Orange with More Juicy Bits Fruit Juice 1.5L,£4.50
drinks,Big Tom Spiced Tomato Juice 75cl,£3.25
drinks,J2O Orange & Passion Fruit 4x275ml,£5.20
drinks,Tropicana Sanguinello Blood Orange Fruit Juice 850ml,£4.00
drinks,Goodrays Natural CBD Mixed Pack Infused Sparkling Drink 4x25...,£7.50
drinks,"Robinsons Raspberry, Rhubarb & Orange Blossom Fruit Cordial 500ml",£3.30
drinks,Red Bull Energy Drink 250ml x4,£5.70
drinks,Fever-Tree Refreshingly Light Ginger Ale 8x150ml,£5.20
drinks,Nexba Kombucha Live Naturally Sugar Free Sparkling Probiotic Strawberry Peach 1L,£3.50
drinks,Bottlegreen Elderflower Light Sparkling Presse Drink 750ml,£3.30
drinks,Fever-Tree Refreshingly Light Ginger Ale 500ml,£2.35
drinks,Fever-Tree Light Rhubarb & Raspberry Tonic Water 500ml,£2.35
drinks,Shloer Light Zero White Grape Sparkling Juice Drink 750ml,£2.80
drinks,Bottlegreen Tropical Mango & Passionfruit Cordial 500ml,£4.50
drinks,The London Essence Co. Original Indian Tonic Water Multipack Can 6x150ml,£4.00
drinks,San Pellegrino Pomegranate & Orange 4 x 330ml,£3.50
drinks,Belvoir Farm Raspberry & Lemon Cordial 500ml,£4.25
drinks,Fever-Tree Indian Tonic Water 500ml (Sugar levy applied),£2.45
drinks,Tropicana Pure Smooth Orange Fruit Juice 500ml,£2.00
drinks,Ribena No Added Sugar Blackcurrant Juice Drink Cartons 6x250...,£2.75
drinks,Fever-Tree Light Mediterranean Tonic Water 500ml,£2.35
drinks,Lipton Lemon Ice Tea 6x330ml,£4.00
drinks,J2O Apple & Raspberry Fruit Blend 10 x 275ml,£10.45
drinks,Fever-Tree Refreshingly Light Elderflower Tonic Water 500ml,£2.35
drinks,Shloer Red Grape Sparkling Juice Drink 750ml,£2.80
drinks,Tropicana Pink Grapefruit Fruit Juice 850ml,£3.50
drinks,Robinsons Ginger & Orange Fruit Cordial 500ml,£3.30
drinks,Fever-Tree Sparkling Sicilian Lemonade 500ml,£2.15
drinks,Belvoir Elderflower Presse 750ml,£3.50
drinks,Fever-Tree Sparkling Raspberry Lemonade 500ml,£2.15
drinks,Shloer Rose Sparkling Grape Juice Drink 750ml,£2.80
drinks,J2O Spritz Sparkling Pear & Raspberry Cans 4x250ml,£3.25
drinks,Fever-Tree Premium Ginger Beer 4x250ml,£4.15
drinks,Trip Mindful Blend Wild Strawberry 330ml,£2.30
drinks,Robinsons Ready to Drink Raspberry & Apple Juice Drink 500ml,£1.60
drinks,Fever-Tree Mexican Lime Soda 500ml,£2.35
drinks,J2O Apple & Mango 4x275ml,£5.20
drinks,Shloer Elderflower & White Grape Sparkling Juice Drink 750ml,£2.80
drinks,Schweppes Soda Water 12x150ml,£6.10
drinks,Old Jamaica Ginger Beer Can 330ml,60p
drinks,San Pellegrino Essenza Sparkling Water Tangerine & Strawberry 4x330ml,£3.60
drinks,"Sainsbury's English Elderflower Presse, Sparkling, Taste the Difference 750ml",£3.00
drinks,Fever-Tree Spanish Clementine Tonic Water 500ml,£2.35
drinks,Fever-Tree Mediterranean Tonic Water 500ml,£2.45
drinks,The London Essence Co. Blood Orange & Elderflower Tonic Water 6x150ml,£4.00
drinks,Lipton Ice Tea Peach Flavoured Still Soft Drink 500ml,£1.85
drinks,Schweppes Slimline Bitter Lemon 1L,£1.75
drinks,Fever-Tree Rhubarb & Raspberry Tonic Water 8x150ml,£5.20
drinks,San Pellegrino Essenza Sparkling Water Cherry & Pomegranate 4x330ml,£3.60
drinks,Fever-Tree Premium Indian Tonic Water 15x150ml,£9.50
drinks,Belvoir Raspberry Lemonade 750ml,£3.50
drinks,J2O Apple & Raspberry 4x275ml,£5.20
drinks,Fever-Tree Refreshingly Light Lemon Tonic Water 500ml,£2.15
drinks,Schweppes Slimline Indian Tonic Water with Lemon 1L,£1.75
drinks,J2O Spritz Apple & Watermelon Sparkling Juice Drink 4x275ml,£5.00
drinks,Twinings Sparkling Tea Refresh Juicy Raspberry Lemonade with Hibiscus 4 x 250ml,£6.00
drinks,Red Bull Energy Drink Sugar Free 250ml x12,£14.55
drinks,Fever-Tree Italian Blood Orange Soda 500ml,£2.35
drinks,Fentimans Rose Lemonade 750ml,£3.60
drinks,Fever-Tree Refreshingly Light Aromatic Tonic Water 8x150ml,£5.20
drinks,Red Bull Energy Drink Sugar Free 250ml x4,£5.40
drinks,J2O Spritz Sparkling Apple & Elderflower 4x275ml,£5.00
drinks,San Pellegrino Essenza Sparkling Water Lemon 4x330ml,£3.60
drinks,Bottlegreen Elderflower Classic 750ml,£3.50
drinks,Schweppes Slimline Canada Dry Ginger Ale 1L,£1.75
drinks,Belvoir Elderflower & Rose Presse 750ml (Sugar levy applied),£3.50
drinks,Belvoir Farm Non-Alcoholic Lime & Yuzu Mojito 750ml,£3.50
drinks,PLJ Lemon Juice Cordial 500ml,£2.50
drinks,Fever-Tree Refreshingly Light Aromatic Tonic Water 500ml,£2.15
drinks,Schweppes Slimline Grapefuit Tonic Water 1L,£1.75
drinks,Fever-Tree Mexican Lime Soda 6x150ml,£4.10
drinks,Fever-Tree Sparkling White Grape 500ml,£2.15
drinks,Belvoir Fruit Farms Lime Cordial 500ml,£4.25
drinks,Fever-Tree Refreshingly Light Ginger Beer 6 x 150ml,£4.10
drinks,Shloer Light Zero Red Grape Sparkling Juice Drink 750ml,£2.80
drinks,Belvoir Farm Non-Alcoholic Peach Bellini 750ml,£3.50
drinks,Belvoir Fresh Root Ginger Beer 750ml,£3.50
drinks,Fever-Tree Premium Soda Water 500ml,£2.15
drinks,The London Essence Co. Pink Grapefruit Crafted Soda Cans 6 x 150ml,£4.00
drinks,The London Essence Co. Crisp Apple Crafted Soda Cans 4 x 250...,£3.50
drinks,Red Bull Energy Drink 473ml,£2.80
drinks,"Sainsbury's Sicilian Lemonade Sparkling, Taste the Difference 75cl",£3.00
drinks,Fever-Tree Refreshingly Light Madagascan Cola 500ml,£2.35
drinks,Sainsbury's Diet Tonic & Elderflower 1L,85p
drinks,Fever-Tree Refreshingly Light Spiced Orange Ginger Ale 500ml,£2.15
drinks,Fever-Tree Light Cucumber Tonic Water 500ml,£2.15
drinks,Schweppes Pink Soda 1L,£1.80
drinks,Fever-Tree Pink Grapefruit Soda 500ml,£2.35
drinks,The London Essence Co. Original Indian Tonic Water 500ml,£2.20
drinks,Red Bull Energy Drink 250ml x12,£15.00
drinks,Tropicana Original Orange Fruit Juice with Bits 500ml,£2.00
drinks,Fever-Tree Premium Sicilian Lemonade 4x250ml,£4.15
drinks,The London Essence Co. Raspberry & Rose Crafted Soda Cans 4 x 250ml,£3.50
drinks,Drink 420 CBD Infused Wild Berries 250ml,£2.00
drinks,Tymbark Apple & Cherry Drink 250ml,75p
drinks,Belvoir Farm No Added Sugar Sicilian Lemon & Lime Cordial 50...,£4.25
drinks,Fever-Tree Light Mediterranean 15x150ml,£9.00
drinks,Huel Cherry & Raspberry Daily A-Z Vitamins 4 x 330ml,£6.50
drinks,Tropicana Smooth Orange with No Bits 850ml,£2.90
drinks,Fever-Tree Sparkling Mexican Lime 4x250ml,£4.15
drinks,The London Essence Co. Pomelo & Pink Pepper Tonic Water 6 x 150ml,£4.00
drinks,Bottlegreen Pomegranate & Elderflower Light Sparkling Presse Drink 750ml,£3.30
drinks,Fever-Tree Refreshingly Light Premium Lemonade 6x150ml,£4.05
drinks,Shloer Pink Non Alcoholic Bubbly Sparkling Juice Drink 750ml,£4.00
drinks,Fever-Tree Classic Mojito Mixer 500ml,£4.70
drinks,Red Bull Energy Drink 250ml,£1.90
drinks,Fever-Tree Italian Blood Orange Soda 6x150ml,£4.10
drinks,G Spot Soothe Scarlet Apple & Sage Sparkling Functional Drink 4 x 250ml,£6.00
drinks,G Spot Lift Red Berries & Sarawak Sparkling Functional Drink 250ml ,£2.00
drinks,Fever-Tree Refreshingly Light Premium Lemonade 500ml,£2.15
drinks,The London Essence Co. Delicate Ginger Ale Cans 6 x 150ml,£4.00
drinks,Bundaberg Root Beer 4x375ml,£6.50
drinks,Schweppes Ginger Beer 12x150ml,£6.10
drinks,Bottlegreen Winter Spiced Berry Cordial 500ml,£4.50
drinks,Belvoir Lemonade 750m,£3.50
drinks,Clamato Tomato Cocktail 946ml,£4.30
drinks,KA Sparkling Fruit Punch Soft Drink 330ml,60p
drinks,Tropicana Original Orange with Juicy Bits 850ml,£2.88
drinks,Huel Pineapple & Mango Daily A-Z Vitamins 4 x 330ml,£6.50
drinks,Fever-Tree Mojito Mixer 4 x 150ml,£4.75
drinks,Fever-Tree Refreshingly Light Madagascan Cola 6x150ml,£4.05
drinks,Tymbark Apple & Mint Drink 250ml,75p
drinks,Fever-Tree Margarita Mixer 500ml,£4.70
drinks,Fix8 Kombucha Ginger Turmeric Live Sparkling Soda 25cl,£1.80
drinks,G Spot Protect Ginger & Peppercorn Sparkling Functional Drink 250ml ,£2.00
drinks,San Pellegrino Lemon 330ml,£1.35
drinks,Trip CBD Infused Elderflower Mint 250ml,£2.00
drinks,Fever-Tree Pink Grapefruit Soda 6 x 150ml,£4.05
drinks,"J2O Glitterberry Grape, Cherry & Spice Flavour Still 10 x 27...",£10.50
drinks,Fever-Tree Passion Fruit Martini Mixer 500ml,£4.70
drinks,Red Bull Energy Drink 355ml,£2.25
drinks,Pepsi Max Lime No Sugar Cola Bottle 500ml,£1.90
drinks,Turner Hardy & Co Feisty Spiced Tomato Juice Mix 750ml,£3.50
drinks,Red Bull Energy Drink Sugar Free 250ml,£1.65
drinks,Tenzing Natural Energy Pineapple & Passionfruit 330ml,£1.95
drinks,Served Mojito 8% ABV,£3.25
drinks,Robinsons Ready To Drink Blackberry & Blueberry Juice Drink 500ml,£1.60
drinks,Goodrays Natural CBD Drink Raspberry & Guava 4 x 250ml,£7.50
drinks,Fever-Tree Raspberry Mojito Mixer 4 x 150ml,£4.75
drinks,Fix8 Kombucha Sicilian Citrus Live Sparkling Soda 25cl,£1.80
drinks,Schweppes Tropical Soda Bottle 1L,£1.75
drinks,The London Essence Co. Sparkling Crafted Lemonade 6 x 150ml,£4.00
drinks,Harry Brompton's London Ice Tea Brewed Black Tea with Peach 500ml,£1.65
drinks,Trip Mindful Blend Raspberry Orange Blossom 330ml,£2.30
drinks,Red Bull Energy Drink Zero 250ml,£1.65
drinks,Aqua Libra Sparkling Water Infused with Raspberry & Blackcurrant Can 500ml,£2.00
drinks,Fibe Lush Limeonade 250ml,£1.65
drinks,GetPro 25g Strawberry High Protein Yoghurt Drink 300g,£2.00
drinks,Muller Frijj Fudge Brownie Big Bottle Milkshake 950ml,£2.50
drinks,Arla Cultura Blueberry Gut Health Milk Drink 500ml,£2.25
drinks,Sainsbury's British Semi Skimmed Milk 2.27L (4 pint),£1.75
drinks,Sainsbury's British Semi Skimmed Milk 1.13L (2 pint),£1.20
drinks,Sainsbury's British Whole Milk 2.27L (4 pint),£1.75
drinks,Sainsbury's British Skimmed Milk 2.27L (4 pint),£1.75
drinks,Cravendale Filtered Fresh Semi Skimmed Milk 2L Fresher for Longer,£2.90
drinks,Sainsbury's British Semi Skimmed Milk 3.4L (6 pint),£2.50
drinks,Sainsbury's British Whole Milk 1.13L (2 pint),£1.20
drinks,Oatly Oat Drink Barista Edition Long Life 1L,£2.20
drinks,Sainsbury's British Skimmed Milk 1.13L (2 pint),£1.20
drinks,Sainsbury's British Semi Skimmed Milk 1 Pint,85p
drinks,Sainsbury's British Filtered Semi Skimmed Milk 2L,£2.10
drinks,Sainsbury's Everyday Lactose Free Semi Skimmed Dairy Drink 1...,£1.35
drinks,Sainsbury's British Whole Milk 3.4L (6 pint),£2.50
drinks,Cravendale Filtered Fresh Semi Skimmed Milk Fresher for Longer 1L,£1.75
drinks,Cravendale Filtered Fresh Whole Milk 2L Fresher for Longer,£2.90
