Category,Product Name,Price
frozen,Sainsbury's Frozen All Butter Croissants x6 300g,£3.30
frozen,Sainsbury's Frozen Pain Au Chocolat x6 360g,£3.30
frozen,Sainsbury's Tempura Prawns x12 156g,£2.50
frozen,Sainsbury's Vanilla Flavoured Danish Crown x2,£1.75
frozen,UpperCrust Bakehouse Chicken & Asparagus Pie 680g,£4.30
frozen,Sainsbury's Apple Strudel x2 600g (Serves 6),£1.55
frozen,Birds Eye Shortcrust Chicken Pies x4 620g,£4.35
frozen,Pret Chocolate Filled Croissants x6 420g,£4.60
frozen,Sainsbury's Danish Pastry Bramley Apple Lattices x2,£1.75
frozen,Sainsbury's Steak Pies x4 568g,£1.99
frozen,Sainsbury's Pub Specials Steak & Ale Pies x2 400g,£4.50
frozen,Sainsbury's Blackforest Gateau 375g,£1.75
frozen,Sainsbury's New York Cheesecake 450g,£1.85
frozen,"Sainsbury's Chicken, Gravy & Vegetable Pie x4 568g",£1.99
frozen,Sainsbury's Woodland Fruit Strudel x2 600g (Serves 6),£1.55
frozen,Sainsbury's Steak Family Pie 700g,£3.35
frozen,Sainsbury's Mandarin Cheesecake 500g,£2.50
frozen,Sainsbury's Roast Chicken & Gravy Family Pie 700g,£3.35
frozen,Sainsbury's Triple Chocolate Gateau Dessert 600g,£3.00
frozen,Nutella Chocolate & Hazelnut Bake at Home Croissants 4 x 85g,£4.50
frozen,Sainsbury's Strawberry Cheesecake 550g,£2.50
frozen,Pukka Steak Microwaveable Shortcrust Pies x2,£3.75
frozen,"Sainsbury's Berry Roulade, Taste the Difference 445g",£5.50
frozen,Halo Top Brownie Gooey Ice Cream 460ml,£5.25
frozen,Sainsbury's Vegetable Pies x4 568g,£1.99
frozen,"Sainsbury's Toffee & Pecan Roulade Dessert, Taste the Difference 420g (serves 6)",£5.50
frozen,Gü Honeycomb Zillionaire Cheesecake Dessert 2 x 86.5g,£3.95
frozen,Ben & Jerry's Cookie Vermont-ster Sundae Chocolate Chip Ice Cream Tub 427ml,£5.75
frozen,Sainsbury's Morello Cherry Bakewell Tart 410g,£2.60
frozen,Pret All Butter Croissants x6 330g,£4.05
frozen,Little Moons Strawberry & Mascarpone Cheesecakes 4x30g,£3.75
frozen,Stamford Street Co. Minced Beef & Onion Pies 4x120g,£1.85
frozen,"Sainsbury's Chicken, Ham Hock & Leek Pies x2 400g",£3.80
frozen,Stamford Street Co. Cheese & Bean Bakes 4x100g,£1.60
frozen,Almondy Almond Tarta With Daim 400g Dessert (Serves 6),£4.00
frozen,Gü Inspirations Red Velvet Dessert 2 x 82g,£2.95
frozen,Hartley's 10 Cal Cherry Bakewell Tart Flavour Jelly 175g,90p
frozen,Jus-Rol Ready Rolled Puff Pastry Sheets 2x320g,£2.75
frozen,Sainsbury's Cinnamon Swirls with Cinnamon Filling 4x92g,£3.30
frozen,Sainsbury's Free From Choc Iced Dessert 330g,£3.00
frozen,Sainsbury's Profiteroles & Chocolate Sauce 260g,£2.35
frozen,"Sainsbury's Passion Fruit, Raspberry & Pistachio Perfect Pavlova, Taste the Difference 460g",£7.50
frozen,Little Moons Caramelised Biscuit & White Chocolate Cheesecakes 4x30g,£3.75
frozen,Sainsbury's Freefrom Iced Vanilla Dessert 330g,£3.00
frozen,Birds Eye Omega 3 Fish Fingers x10 280g,£3.00
frozen,"Sainsbury's Chunky Cod Fish Fingers, Taste the Difference x8 480g",£4.80
frozen,"Sainsbury's Frozen Raw Peeled Jumbo King Prawns ASC, Taste the Difference 225g",£5.25
frozen,Sainsbury's Frozen Large Raw Peeled King Prawns ASC 180g,£2.85
frozen,Sainsbury's Breaded Cod Fillet Fish Fingers x10 300g,£1.79
frozen,Sainsbury's Frozen Large Cooked & Peeled King Prawns ASC 180...,£2.85
frozen,Sainsbury's Skinless & Boneless Cod Fillets 360g,£5.00
frozen,Stamford Street Co. Prawns 250g,£2.72
frozen,"Young's Gastro Basa Fillets, Lemon & Herb Battered 310g",£5.25
frozen,Stamford Street Co. Breaded Cod Fish Fingers x10 250g,80p
frozen,Young's Scampi 220g,£4.50
frozen,Stamford Street Co. White Fish Fillets 520g,£2.35
frozen,Sainsbury's Salmon Fillets 360g,£5.00
frozen,"Sainsbury's Breaded Chunky Cod Loins, Taste the Difference x2 300g",£4.50
frozen,Birds Eye Battered Cod Fillets x4 400g,£6.60
frozen,Birds Eye Jumbo Battered Fish Fillets x2 400g,£4.00
frozen,"Sainsbury's Beer Battered Cod, Taste the Difference 300g",£4.00
frozen,Birds Eye Breaded Omega 3 Fish Fingers x32 896g,£5.00
frozen,Sainsbury's Taste the Difference 8 Chunky Haddock Fillet Fish Fingers 480g,£4.50
frozen,Birds Eye Cod Fish Fingers x10 280g,£4.50
frozen,Birds Eye Cod Fish Fingers x18 504g,£6.00
frozen,Young's Chip Shop Omega 3 Fish Fillets x4 400g,£4.25
frozen,Young's Scampi 400g,£5.50
frozen,Sainsbury's Tempura Prawns x12 156g,£2.50
frozen,Young's Chip Shop Extra Large Beer Batter Fish Fillet x2 300...,£3.00
frozen,Sainsbury's Battered Cod x4 500g,£3.39
frozen,Birds Eye Chicken Dippers x38 697g,£6.00
frozen,Sainsbury's Omega 3 Fish Fingers x30 900g,£3.18
frozen,Young's Gastro Signature Breaded Lemon & Pepper Fish Fillets x2 270g,£5.25
frozen,Sainsbury's Taste the Difference 4 Melting Middle Smoked Haddock Fishcakes 580g,£5.00
frozen,Sainsbury's Breaded Cod x4 500g,£3.39
frozen,Birds Eye Battered Fish Fillets x4 400g,£4.00
frozen,Birds Eye Gluten Free Breaded Fish Fingers x12 360g,£3.35
frozen,Sainsbury's Frozen Cooked & Peeled Cold Water Prawns MSC 250...,£3.90
frozen,Young's Gastro Wholetail Scampi 220g,£7.00
frozen,Young's Fisherman's Pie 300g,£2.50
frozen,Birds Eye Battered Cod Chips & Peas 395g,£3.50
frozen,Birds Eye Cod Fish Cakes x4 198g,£1.75
frozen,"Sainsbury's Frozen Cooked & Peeled Jumbo King Prawns ASC, Taste the Difference 225g",£5.25
frozen,Sainsbury's Haddock Fillet Portion 360g,£5.00
frozen,Young's Gastro Tempura Battered Light & Crispy Fish Fillets x2 270g,£5.25
frozen,Sainsbury's Scottish Wholetail Breaded Scampi 300g,£4.25
frozen,Sainsbury's Skin On & Boneless Smoked Haddock Fillets 360g,£5.00
frozen,Birds Eye Breaded Cod Fish Fingers x32 896g,£8.50
frozen,Birds Eye 6 Chunky Crispy Battered Fish Fingers 360g,£3.75
frozen,Sainsbury's Chunky Breaded Haddock x4 500g,£4.49
frozen,Young's Cod Fish Cakes x4 200g,£1.00
frozen,Sainsbury's Fish Pie Mix 350g,£4.90
frozen,Sainsbury's 10 Breaded Omega 3 Pollock Fillet Fish Fingers 3...,£1.06
frozen,Young's Admirals Pie 300g,£2.50
frozen,Young's Gastro Frozen Wholetail Scampi 230g,£6.00
frozen,Sainsbury's Breaded Plaice Fillets x2 260g,£3.40
frozen,Birds Eye Breaded Cod Fillets x4 400g,£6.60
frozen,"Sainsbury's Free From Melt in the Middle Smoked Haddock Fishcakes, Taste the Difference x2",£3.25
frozen,"Young's Gastro Chilli, Lime & Ginger Breaded Fish Fillets, Limited Edition x2 270g",£5.25
frozen,Young's Chip Shop Large Cod Fillets 440g,£7.00
frozen,Young's Gastro Basa Fillets Dusted With Sea Salt & Black Pepper x2 310g,£5.25
frozen,Sainsbury's Frozen Cooked & Peeled Large King Prawns ASC 400...,£6.33
frozen,Birds Eye 6 Chunky Fish Fingers 360g,£3.75
frozen,Sainsbury's Atlantic Salmon Fishcakes x2 170g,£1.75
frozen,LEON Chunky Fish Fingers Lightly Battered x6 390g,£4.50
frozen,Young's Gastro Lightly Dusted Sicilian Lemon & Black Pepper Sole Fillets x2 280g,£5.25
frozen,Birds Eye Battered Haddock Fillets x4 400g,£6.60
frozen,Sainsbury's Frozen Basa Fillets ASC 500g,£5.00
frozen,Sainsbury's Lemon & Herb Dusted Sole 265g,£3.75
frozen,Birds Eye Haddock Fish Fingers x10 280g,£4.50
frozen,"Sainsbury's Large Canadian Scallops, Taste the Difference MSC 200g",£7.50
frozen,"Sainsbury's Breaded Chunky Haddock, Taste the Difference x2 300g",£4.50
frozen,Whitby Gluten Free Wholetail Scampi 200g,£4.05
frozen,"Young's Gastro Cod, Spinach & Cheese Gratin 360g",£3.30
frozen,Sainsbury's Cod Fish Fingers x30 900g,£5.37
frozen,"Sainsbury's Chunky Battered Cod Fish Fingers, Taste the Difference x8 480g",£4.80
frozen,Young's Popcorn Scampi Bites 190g,£1.85
frozen,Sainsbury's SO Organic Large Raw King Prawns 180g,£4.15
frozen,"Sainsbury's Frozen Raw Shell on Jumbo King Prawns ASC, Taste the Difference 600g",£8.50
frozen,Sainsbury's Frozen Cooked Seafood Selection 300g,£5.30
frozen,Birds Eye Battered Fish Fingers x26 728g,£5.00
frozen,Young's Chip Shop Large Haddock Fillets 440g,£6.50
frozen,"Sainsbury's Canadian Cold Water Prawns, Taste the Difference MSC 250g",£5.00
frozen,Sainsbury's Chunky Breaded Cod x4 500g,£4.49
frozen,Young's Breaded Cod Fillets x4 440g,£6.00
frozen,Young's Simply Breaded 4 Large Haddock Fillets 440g,£6.00
frozen,Sainsbury's Frozen Raw Seafood Selection 300g,£5.10
frozen,Sainsbury's Raw Patagonian Scallops MSC 200g,£6.00
frozen,Birds Eye Lightly Dusted Lemon & Pepper Fish Fillets x2 280g,£4.50
frozen,Sainsbury's Frozen Cooked Mussel Meat ASC 300g,£2.60
frozen,Birds Eye Breaded Haddock Fillets x4 400g,£6.60
frozen,Stamford Street Co. White Fish Steaks x6 520g,£3.50
frozen,Sainsbury's Cod Steaks 520g,£5.50
frozen,Young's Battered Calamari 250g,£4.10
frozen,Sainsbury's Frozen Raw Squid Rings 300g,£4.80
frozen,Young's Gastro Tempura Beer Battered Cod Fillets x2 270g,£5.25
frozen,Birds Eye Captain's Discoveries Focaccia Crumb Mediterranean Fish Fillets x2 220g,£4.00
frozen,Young's Chip Shop Extra Large Fish Cakes x2 210g,£2.25
frozen,"Young's Gastro Lime & Soy Tempura Battered Fish Fillets, Limited Edition x2 270g",£5.25
frozen,"Sainsbury's Salmon Wellington, Taste the Difference 380g",£5.00
frozen,Sainsbury's Frozen Scottish MSC Mussels Cooked in White Wine & Garlic 500g,£2.60
frozen,Birds Eye Fish Nuggets x20 490g,£4.25
frozen,"Sainsbury's Frozen Scottish Langoustines, Taste the Difference 500g",£8.50
frozen,Birds Eye Captain's Discoveries Tortilla Crumb Mexican Inspired Fish Fillets x2 220g,£4.00
frozen,Young's Flipper Dippers x10 250g,£1.25
frozen,Young's Paprika & Pepper Extra Large Fish Fillets x2 300g,£4.00
frozen,Birds Eye Captain's Discoveries Crispy Lemon & Parsley Prawns Battered 220g,£4.00
frozen,Birds Eye Captain's Discoveries Crunchy Classic Prawns Breaded 250g,£4.50
frozen,Young's Garlic & Herb Extra Large Fish Fillets x2 300g,£4.00
frozen,Young's Chip Shop Succulent Jumbo Fish x2 480g,£4.50
frozen,LEON Waffle Fries 550g,£2.85
frozen,Swedish Glace Vanilla Dairy Free Vegan Ice Cream Tub Dessert 750ml,£3.25
frozen,Strong Roots Sweet Potato Hash Brown 350g,£3.30
frozen,Birds Eye Gluten Free Breaded Fish Fingers x12 360g,£3.35
frozen,Wholecreations Dairy & Gluten Free Garlic Bread Baguette 190...,£2.00
frozen,Goodfella's Gluten Free Pepperoni Pizza 317g,£3.75
frozen,Aunt Bessie's Roast Potatoes 1.1kg,£4.00
frozen,Dr. Oetker Ristorante Gluten Free Pizza Mozzarella 370g,£3.60
frozen,Birds Eye Gluten Free Breaded Fish Fillets x2 250g,£3.85
frozen,Smörgåsbord the Original Swedish Meatballs 1kg,£6.00
frozen,Birds Eye Gluten Free Southern Fried Chicken Grills x2 180g,£3.00
frozen,Cornetto Vegan & Gluten Free Ice Cream Cones 4x90ml,£3.50
frozen,Del Monte 100% Orange Lollies 3x75ml,£2.75
frozen,Schar Gluten Free White Rolls 6x58g,£3.00
frozen,Little Moons Vegan Passionfruit & Mango Mochi Ice Cream Frozen Snack 6 x 32g,£5.00
frozen,Sainsbury's Free From Chicken Kyivs x2 260g,£3.25
frozen,Aunt Bessie's Rustically Made Roast Potato Chips 750g,£3.75
frozen,Whitby Gluten Free Wholetail Scampi 200g,£4.05
frozen,Goodfella's Gluten Free Margherita Pizza 328g,£3.75
frozen,Ramona's Original Falafel 500g,£3.75
frozen,Magnum Double Sunlover White Chocolate Mango & Coconut Ice Cream Sticks 3x85ml,£4.25
frozen,Linda McCartney's Vegetarian Tomato & Basil Meatballs 292g,£2.50
frozen,Sainsbury's Free From Cheese & Onion Crispbakes x2 227g,£2.25
frozen,White Rabbit Margherita Gluten Free Pizzetta 175g,£2.50
frozen,Sainsbury's Free From Choc Sticks 4 x 76g,£3.25
frozen,Genius Gluten Free Sausage Rolls x2,£2.70
frozen,Sainsbury's Free From Mozzarella Sticks 180g,£3.00
frozen,Little Moons Honey Roasted Pistachio Soft Mochi & Gelato Ice Cream 6x32g,£5.00
frozen,Sainsbury's Free From Beef Lasagne 300g,£3.00
frozen,Little Moons Strawberry & Mascarpone Cheesecakes 4x30g,£3.75
frozen,Crave Sugared Ring Dodoughs 215g,£2.60
frozen,Sainsbury's Free From Mac & Cheese Balls 200g,£3.00
frozen,Ice Kitchen Thai Massaman Curry Paste 2 x 77g,£3.50
frozen,Sainsbury's Free From Margherita Pizza 301g,£2.50
frozen,Sainsbury's Free From Pepperoni Pizza 305g,£2.50
frozen,Swedish Glace Raspberry Dairy Free Vegan Ice Cream Tub Dessert 750ml,£3.25
frozen,Sainsbury's Free From Spiced Mexican Style Bean Burgers x2 2...,£2.25
frozen,Sainsbury's Free From Macaroni Cheese 300g,£3.00
frozen,Ice Kitchen Thai Green Curry Paste 2 x 77g,£3.50
frozen,Sainsbury's Free From Choc Iced Dessert 330g,£3.00
frozen,Sainsbury's Free From Gluten Tomato & Mozzarella Arancini 20...,£3.00
frozen,Sainsbury's Free From Spaghetti Bolognese 300g,£3.00
frozen,White Rabbit Gluten Free Sourdough Pepperoni Pizzetta 175g,£2.50
frozen,Little Moons Brown Butter Caramel Mochi Ice Cream 6 x 30g,£5.00
frozen,Strong Roots Crispy Crinkle Fries 750g,£3.75
frozen,Dove Advanced Care Pampering Body Wash Shower Gel 225ml,£3.00
frozen,Whole Creations Dairy & Gluten Free Roasted Tomato & Basil Sheesy Pizza 275g,£4.25
frozen,Ice Kitchen Thai Red Curry Paste 2 x 77g,£3.50
frozen,Little Moons Mochi Ice Cream Cinnamon Bun 192g,£5.00
frozen,Sainsbury's Free From BBQ Chicken Pizza 302g,£2.50
frozen,Birds Eye Chicken Shop Hash Brown Potato Bites 500g,£2.50
frozen,Little Moons Caramelised Biscuit & White Chocolate Cheesecakes 4x30g,£3.75
frozen,Ice Kitchen Jamaican Jerk Paste 2 x 80g,£3.50
frozen,Haagen-Dazs Dulce De Leche Ice Cream 460ml,£5.75
frozen,White Rabbit Gluten Free Sourdough Prosciutto Ham & Mushroom Frozen Pizza 332g,£4.00
frozen,LEON Korean Style Chicken Nuggets 300g,£4.00
frozen,Ice Kitchen Indian Jalfrezi Curry Paste 2 x 80g,£3.50
frozen,Sainsbury's Freefrom Iced Vanilla Dessert 330g,£3.00
frozen,Ice Kitchen Mexican Fajita Paste 2 x 80g,£3.50
frozen,LEON Chicken Thigh Burgers 460g,£5.00
frozen,Ice Kitchen Thai Panang Curry Paste 2 x 77g,£3.50
frozen,Birds Eye Chicken Shop Honey Sriracha Chicken Wings 375g,£4.50
frozen,Yutaka Mochi 95g,£1.60
frozen,Carte D'or Madagascan Vanilla Light Ice Cream Dessert Tub 90...,£3.90
frozen,Sainsbury's Frozen Blueberries 400g,£3.00
frozen,Sainsbury's Garden Peas 910g,£1.55
frozen,Sainsbury's Frozen Raspberries 350g,£3.25
frozen,Birds Eye Garden Peas 800g,£2.95
frozen,Sainsbury's Broccoli Florets 900g,£1.07
frozen,Sainsbury's Petits Pois 910g,£1.75
frozen,The Ice Co. Party Ice Cubes 2kg,£1.30
frozen,"Sainsbury's Chunky Cod Fish Fingers, Taste the Difference x8 480g",£4.80
frozen,Goodfella's Stonebaked Thin Pepperoni Pizza 332g,£3.00
frozen,Sainsbury's French Fries 900g,£1.22
frozen,Sainsbury's Hash Browns 700g,£2.20
frozen,"Sainsbury's Sweetcorn, Super Sweet 1kg",£1.80
frozen,Sainsbury's Frozen Strawberries & Blueberries 400g,£3.00
frozen,Birds Eye Garden Peas 375g,£1.75
frozen,McCain Crispy French Fries 1.4kg,£4.30
frozen,Sainsbury's Frozen Dark Sweet Cherries 450g,£3.50
frozen,"Sainsbury's Frozen Raw Peeled Jumbo King Prawns ASC, Taste the Difference 225g",£5.25
frozen,Birds Eye Potato Waffles x10 567g,£2.35
frozen,Sainsbury's Garlic Slices x10 260g,£1.05
frozen,Sainsbury's Mixed Vegetables 1kg,£1.65
frozen,Sainsbury's Crinkle Cut Chips 1.5kg,£1.99
frozen,Birds Eye Chicken Quarter Pounders x2 227g,£3.25
frozen,Birds Eye Petits Pois 960g,£3.85
frozen,Goodfella's Stonebaked Thin Margherita Pizza 345g,£3.00
frozen,Stamford Street Co. Yorkshire Puddings x15 220g,44p
frozen,Sainsbury's Sweet Potato Fries 500g,£2.90
frozen,Sainsbury's Chopped Spinach 900g,£1.60
frozen,Sainsbury's Lightly Spiced Wedges 900g,£2.00
frozen,Carte D'or Madagascan Vanilla Ice Cream Dessert Tub 900ml,£3.90
frozen,Mccain Home Chips Chips Crinkle 1.6kg,£4.30
frozen,Sainsbury's Seasoned Curly Fries 700g,£2.20
frozen,Sainsbury's Yorkshire Puddings x12 220g,£1.40
frozen,Sainsbury's Frozen Large Cooked & Peeled King Prawns ASC 180...,£2.85
frozen,Sainsbury's Frozen Summer Fruits 500g,£3.30
frozen,Sainsbury's Milk Chocolate Ice Creams 4 X 110ml,£2.04
frozen,Sainsbury's Garlic Baguette x2 338g,85p
frozen,Rowntree's Fruit Pastille Ice Lollies 4x65ml,£2.50
frozen,McCain Potato Smiles 454g,£2.50
frozen,Sainsbury's Skinless & Boneless Cod Fillets 360g,£5.00
frozen,Aunt Bessie's Duck Fat Roast Potatoes 700g,£4.50
frozen,Stamford Street Co. Prawns 250g,£2.72
frozen,itsu Chicken Gyoza Dinner Dumplings x12 240g,£4.25
frozen,Sainsbury's Milk Chocolate & Almonds Ice Creams 4 X 110ml,£2.04
frozen,Stamford Street Co. Breaded Cod Fish Fingers x10 250g,80p
frozen,Young's Scampi 220g,£4.50
frozen,McCain Slow Baked Jackets x4 800g,£3.70
frozen,Viennetta Vanilla Ice Cream Dessert 650ml,£2.00
frozen,Sainsbury's Salmon Fillets 360g,£5.00
frozen,Sainsbury's Vegetable Medley 1kg,£1.65
frozen,Wall's Soft Scoop Vanilla Ice Cream Dessert Tub 1.8L,£2.85
frozen,"Sainsbury's Breaded Chunky Cod Loins, Taste the Difference x2 300g",£4.50
frozen,Sainsbury's Battered Chicken Dippers x44 1kg,£3.31
frozen,McCain Home Chips Straight 1.6kg,£4.30
frozen,Sainsbury's Button Sprouts 1kg,£1.30
frozen,Plant Pioneers Meat Free Mince 500g,£1.86
frozen,Sainsbury's Garden Peas 1.81kg,£2.45
frozen,Sainsbury's Steak Cut Chips 1.5kg,£1.99
frozen,McCain Slow Baked Jackets x8 1.6kg,£5.30
frozen,Haagen-Dazs Salted Caramel Ice Cream Frozen Dessert Tub 460m...,£5.75
frozen,Sainsbury's Broccoli & Cauliflower Florets 900g,£1.50
frozen,Sainsbury's Mini Crispy Potatoes 700g,£2.30
frozen,itsu Vegetable Fusion Gyoza Dinner Dumplings x20 270g,£4.25
frozen,Sainsbury's Fruit Juice Ice Cream Splits 6x73ml,£1.50
frozen,Sainsbury's Cauliflower Florets 900g,£1.50
frozen,Birds Eye Cod Fish Fingers x10 280g,£4.50
frozen,Sainsbury's Sliced Green Beans 900g,£1.50
frozen,Sainsbury's Four Berry Medley Frozen Fruit 1kg,£4.75
frozen,"Sainsbury's Indulgence Ice Cream, White Chocolate 4x110ml",£2.04
frozen,McCain Hash Browns 625g,£2.70
frozen,Linda McCartney Vegetarian Sausages x6 270g,£2.50
frozen,Mackie's of Scotland Luxury Traditional Real Dairy Ice Cream...,£3.60
frozen,Magnum Mini Classic Almond & White Chocolate Ice Cream Sticks 6x55ml,£5.00
frozen,Sainsbury's Battered Onion Rings 800g,£2.75
frozen,Aunt Bessie's Toad in the Hole 190g,£1.90
frozen,Snickers Ice Cream 4x53ml,£3.00
frozen,Birds Eye Chicken Dippers x38 697g,£6.00
frozen,"Sainsbury's Chargrilled Mediterranean Vegetables (Aubergine, Courgette, Red & Yellow Peppers) 500g",£2.75
frozen,itsu Sizzling Pork Gyoza Dinner Dumplings x12 240g,£4.25
frozen,Birds Eye Battered Fish Fillets x4 400g,£4.00
frozen,Sainsbury's Frozen Cooked & Peeled Cold Water Prawns MSC 250...,£3.90
frozen,Linda McCartney Mozzarella Burger x2 227g,£2.50
frozen,Richmond Thick Frozen Pork Sausages x20 860g,£3.75
frozen,Sainsbury's Thick Pork Sausages x20 900g,£2.57
frozen,Birds Eye Shortcrust Chicken Pies x4 620g,£4.35
frozen,Sainsbury's Mini Indulgence Sticks 8x50ml,£3.75
frozen,Haagen-Dazs Vanilla Ice Cream Frozen Dessert Tub  460ml,£5.75
frozen,Birds Eye Cod Fish Cakes x4 198g,£1.75
frozen,Sainsbury's Haddock Fillet Portion 360g,£5.00
frozen,Sainsbury's Scottish Wholetail Breaded Scampi 300g,£4.25
frozen,Sainsbury's Potato Croquettes 700g,£2.00
frozen,Sainsbury's Beef Quarter Pounders x4 454g,£3.75
frozen,Birds Eye Breaded Cod Fish Fingers x32 896g,£8.50
frozen,Aunt Bessie's Honey Glazed Parsnips 500g,£3.35
frozen,Cadbury Flake 99 Ice Cream Cones x4 125ml,£5.75
frozen,Sainsbury's New Zealand Lamb Mince 500g,£5.25
frozen,Ben & Jerry's Cookie Dough Vanilla Ice Cream Tub 465ml,£5.55
frozen,Young's Admirals Pie 300g,£2.50
frozen,Sainsbury's Breaded Plaice Fillets x2 260g,£3.40
frozen,Stamford Street Co. Berry Mix 400g,£2.20
frozen,Young's Chip Shop Large Cod Fillets 440g,£7.00
frozen,Sainsbury's Frozen Cooked & Peeled Large King Prawns ASC 400...,£6.33
frozen,Sainsbury's White Rice Microwavable Bags 4 x 200g,£2.75
frozen,Ben & Jerry's Chocolate Fudge Brownie Ice Cream Tub 465ml,£5.55
frozen,Sainsbury's Cod Fish Fingers x30 900g,£5.37
frozen,"Sainsbury's Aberdeen Angus Quarter Pounders, Taste the Difference x4 454g",£4.50
frozen,Birds Eye Classic Beef Quarter Pounders with Onion x4 454g,£5.50
frozen,Ben & Jerry's Phish Food Chocolate Ice Cream Tub 465ml,£5.55
frozen,Young's Breaded Cod Fillets x4 440g,£6.00
frozen,Green Giant Original Sweetcorn 198g,£1.00
frozen,Sainsbury's Frozen Blueberries 400g,£3.00
frozen,Sainsbury's Garden Peas 910g,£1.55
frozen,Sainsbury's Frozen Raspberries 350g,£3.25
frozen,Birds Eye Garden Peas 800g,£2.95
frozen,Sainsbury's Broccoli Florets 900g,£1.07
frozen,Sainsbury's Petits Pois 910g,£1.75
frozen,"Sainsbury's Sweetcorn, Super Sweet 1kg",£1.80
frozen,Sainsbury's Frozen Strawberries & Blueberries 400g,£3.00
frozen,Birds Eye Garden Peas 375g,£1.75
frozen,Sainsbury's Frozen Dark Sweet Cherries 450g,£3.50
frozen,Sainsbury's Whole Green Beans 900g,£1.07
frozen,Sainsbury's Frozen Mango Chunks 500g,£3.00
frozen,Stamford Street Co. Peas 850g,£1.09
frozen,Sainsbury's Mixed Vegetables 1kg,£1.65
frozen,Birds Eye Petits Pois 960g,£3.85
frozen,Sainsbury's Chopped Spinach 900g,£1.60
frozen,Sainsbury's Frozen Summer Fruits 500g,£3.30
frozen,Sainsbury's Classic Vegetable Mix 1kg,£1.65
frozen,Aunt Bessie's Duck Fat Roast Potatoes 700g,£4.50
frozen,Sainsbury's Frozen Whole Strawberries 350g,£3.00
frozen,Stamford Street Co. Berry Mix 1kg,£3.50
frozen,Birds Eye Steamfresh Family Favourites Steam Bags x4 540g,£2.75
frozen,Sainsbury's Vegetable Medley 1kg,£1.65
frozen,Sainsbury's Supersweet Mini Corn Cobs 875g,£1.75
frozen,Sainsbury's Inspired to Cook Chopped Garlic 75g,£1.75
frozen,Sainsbury's Butternut Squash Chunks 500g,99p
frozen,Stamford Street Mixed Vegetables 1kg,99p
frozen,Sainsbury's Button Sprouts 1kg,£1.30
frozen,Sainsbury's Garden Peas 1.81kg,£2.45
frozen,Stamford Street Co. Sweetcorn 950g,£1.42
frozen,Birds Eye Garden Peas 1.2kg,£4.00
frozen,Sainsbury's Broccoli & Cauliflower Florets 900g,£1.50
frozen,Sainsbury's Edamame Beans 500g,£2.80
frozen,Sainsbury's Baby Carrots 900g,£1.50
frozen,Sainsbury's Cauliflower Florets 900g,£1.50
frozen,Sainsbury's Sliced Green Beans 900g,£1.50
frozen,"Sainsbury's Petit Pois, Taste the Difference 750g",£2.50
frozen,Sainsbury's Broad Beans 650g,£1.75
frozen,Sainsbury's Four Berry Medley Frozen Fruit 1kg,£4.75
frozen,Sainsbury's Sliced Red Onions 500g,£1.50
frozen,Sainsbury's Cauliflower Cheese 680g,£2.40
frozen,Sainsbury's Stir Fry Vegetables 500g,£2.50
frozen,Aunt Bessie's Roast Potatoes 600g,£2.50
frozen,"Sainsbury's Chargrilled Mediterranean Vegetables (Aubergine, Courgette, Red & Yellow Peppers) 500g",£2.75
frozen,Sainsbury's Honey Glazed Roast Parsnips 600g,£2.30
frozen,Sainsbury's Classic Vegetable Base Mix 1kg,£2.00
frozen,Birds Eye Country Mixed Vegetables 640g,£3.00
frozen,Birds Eye Petits Pois 545g,£2.85
frozen,Birds Eye Steamfresh Hearty Farmhouse Mix Steam Bags x4 540g,£2.75
frozen,Sainsbury's Frozen Black Forest Fruits 500g,£3.30
frozen,Sainsbury's Frozen Berry Banana Smoothie Mix Strawberry & Banana 450g,£3.00
frozen,Sainsbury's Frozen Peach & Nectarine Slices 450g,£3.00
frozen,"Sainsbury's Mango, Papaya & Pineapple Smoothie Mix 450g",£3.00
frozen,Sainsbury's Frozen Pineapple Chunks 450g,£3.00
frozen,Taj Crushed Garlic 400g,£1.40
frozen,"Sainsbury's Sliced Mushrooms, Inspired to Cook 500g",99p
frozen,Aunt Bessie's Honey Glazed Parsnips 500g,£3.35
frozen,Sainsbury's Sliced Carrots 900g,£1.00
frozen,Sainsbury's Sliced Savoy Cabbage 500g,£2.00
frozen,"Sainsbury's Rice, Broccoli, Sweetcorn & Peas Microwaveable Steam Bags x4 540g",£1.00
frozen,Sainsbury's Petits Pois 1.81kg,£3.05
frozen,Sainsbury's So Organic Garden Peas 500g,£2.00
frozen,Sainsbury's Chopped Ginger 75g,£1.75
frozen,Sainsbury's Frozen Very Berry Smoothie Mix 450g,£3.00
frozen,Stamford Street Co. Berry Mix 400g,£2.20
frozen,Cofresh Bhindi Chopped Okra 300g,£1.00
frozen,Birds Eye Garden Peas & Sweetcorn 640g,£3.00
frozen,Sainsbury's Vegetable Stewpack 1kg,£1.50
frozen,Birds Eye Steamfresh Green Medley Steam Bags x2 300g,£2.75
frozen,Sainsbury's White Rice Microwavable Bags 4 x 200g,£2.75
frozen,Birds Eye Supersweet Sweetcorn 640g,£3.00
frozen,Taj Crushed Ginger 400g,£1.40
frozen,Sainsbury's Sliced Leeks 700g,£1.50
frozen,Sainsbury's SO Organic Broccoli 500g,£1.25
frozen,Birds Eye Steamfresh Creamy Cheese Vegetable Penne Pasta Meal For 1 400g,£3.50
frozen,Birds Eye Steamfresh Mushroom Tagliatelle with a Creamy Sauce Meal for 1 400g,£3.50
frozen,Birds Eye Steamfresh Garden Mix Steam Bags x4 540g,£2.75
frozen,Sainsbury's Golden Vegetable Rice 380g,£2.50
frozen,Merchant Gourmet Herby Mediterranean Style Vegetables & Giant Couscous 400g,£2.50
frozen,Strong Roots Stir Fry Greens 425g,£3.65
frozen,Birds Eye Steamfresh Golden Rice Steam Bags x2 380g,£2.75
frozen,Sainsbury's Chopped Coriander 50g,£1.75
frozen,Sainsbury's Mushy Peas Twinpack 300g,£1.50
frozen,Merchant Gourmet Aromatic Korean Style Vegetables & Mixed Grains 400g,£2.50
frozen,Aunt Bessie's Carrot & Swede Mash 500g,£3.15
frozen,Birds Eye Select Mixed Vegetables 640g,£3.00
frozen,PACK'D Ripe & Chopped Avocado 300g (Serves 6),£3.50
frozen,Cofresh Bhindi Whole Baby Okra 300g,£1.00
frozen,Jamie Oliver Chargrilled Pesto Veg 400g,£3.00
frozen,Jamie Oliver Lemon Dressed Green Veg 400g,£3.00
frozen,Yutaka Edamame Soybeans in Pods 500g,£2.75
frozen,Pret Sweet Greens Smoothie Mix 400g,£3.75
frozen,Aunt Bessie's Maple & Thyme Glazed Carrots 500g,£3.25
frozen,Sambazon Scoopable Acai 380g,£4.70
frozen,PACK'D Organic Cauliflower Rice 450g,£2.85
frozen,Birds Eye Steamfresh Mediterranean Vegetable and Tomato Pasta Meal For 1 400g,£3.50
frozen,Sainsbury's Chopped Basil 50g,£1.75
frozen,Sainsbury's Chopped Parsley 50g,£1.75
frozen,Pret Berries & Cherries Smoothie Mix 400g,£3.75
frozen,Sambazon Pure Unsweetened Acai Packs 4 x 100g,£4.50
