Category,Product Name,Price,Price with Nectar
cooked-meats-olives-and-dips,Sainsbury's Smoked Mackerel Pate 100g,"£1.30with Nectar
£1.50£1.50 / 100g",
cooked-meats-olives-and-dips,"Sainsbury's Moroccan Cous Cous, Taste the Difference 200g",£3.25£1.63 / 100g,
cooked-meats-olives-and-dips,Fridge Raiders Southern Style Chicken Snack Bites 5x 22.5g,"£1.50with Nectar
£2.25£2.00 / 100g",
cooked-meats-olives-and-dips,"Sainsbury's Extra Smooth Houmous, Taste the Difference 170g",£3.00£1.76 / 100g,
cooked-meats-olives-and-dips,Sainsbury's Pitted Black Olives 120g,£1.60£1.33 / 100g,
cooked-meats-olives-and-dips,Sainsbury's Sweet Chilli Houmous 200g,95p48p / 100g,
cooked-meats-olives-and-dips,Sainsbury's British Liver Sausage Slices x10 125g,£1.0080p / 100g,
cooked-meats-olives-and-dips,Sainsbury's Beetroot Salad 300g,£1.8562p / 100g,
cooked-meats-olives-and-dips,Sainsbury's Brussels Spreadable Pate 175g,£1.0057p / 100g,
cooked-meats-olives-and-dips,Sabra Houmous Extra 200g,"£2.00with Nectar
£2.50£1.25 / 100g",
cooked-meats-olives-and-dips,Fridge Raiders Slow Roasted Chicken Snack Bites 3x 22.5g,£1.70£2.52 / 100g,
cooked-meats-olives-and-dips,Sainsbury's Coronation Chicken Deli Filler 220g,£1.4566p / 100g,
cooked-meats-olives-and-dips,Moorish Smoked Humous 150g,"£1.45with Nectar
£1.95£1.30 / 100g",
cooked-meats-olives-and-dips,Sainsbury's Aromatic Moroccan Style Houmous 200g,95p48p / 100g,
cooked-meats-olives-and-dips,Sainsbury's Trio Of Spanish Olives 280g,"£3.25with Nectar
£4.50£1.61 / 100g",
cooked-meats-olives-and-dips,Finnebrogue Naked Deli Ham Slices x5 100g,£2.00£2.00 / 100g,
cooked-meats-olives-and-dips,"Sainsbury's Pesto & Parmesan Pasta, Taste The Difference 185...",£3.25£1.76 / 100g,
cooked-meats-olives-and-dips,Sainsbury's Ardennes Pate 170g,"£1.00with Nectar
£1.3076p / 100g",
cooked-meats-olives-and-dips,Sainsbury's Tuna & Sweetcorn Deli Filler 220g,£1.4566p / 100g,
cooked-meats-olives-and-dips,Sainsbury's Selection Tex-Mex Dips 400g,£3.2080p / 100g,
cooked-meats-olives-and-dips,Sainsbury's Rich Taramasalata 200g,£1.4070p / 100g,
cooked-meats-olives-and-dips,"Sainsbury's Houmous, Be Good To Yourself 200g",£1.4573p / 100g,
cooked-meats-olives-and-dips,Sainsbury's Cheddar Cheese & Chive Dip 200g,£1.4070p / 100g,
cooked-meats-olives-and-dips,Sainsbury's Cheese & Onion Deli Filler 220g,£1.2858p / 100g,
cooked-meats-olives-and-dips,Sainsbury's Onion & Garlic Dip 200g,£1.4070p / 100g,
cooked-meats-olives-and-dips,"Sainsbury's Feta Dip with Mint Oil, Taste the Difference 170...",£3.00£1.76 / 100g,
cooked-meats-olives-and-dips,Sainsbury's Irish Corned Beef 175g,£2.90£1.66 / 100g,
dairy-and-chilled-essentials,Actimel Strawberry Cultured Yogurt Drink 12x100g,£4.5038p / 100g,
dairy-and-chilled-essentials,GetPro 18g Chocolate & Hazelnut High Protein Pudding 180g,£1.85£1.03 / 100g,
dairy-and-chilled-essentials,Actimel Multifruit Cultured Yogurt Drink 12x100g,£4.5038p / 100g,
dairy-and-chilled-essentials,Sainsbury's Grated Mozzarella Cheese 250g,£2.55£10.20 / kg,
dairy-and-chilled-essentials,Sainsbury's British Mature Grated Cheddar Cheese 250g,£2.55£10.20 / kg,
dairy-and-chilled-essentials,Sainsbury's British Semi Skimmed Milk 2.27L (4 pint),£1.6573p / ltr,
dairy-and-chilled-essentials,Sainsbury's British Free Range Eggs Large x12,£3.2527p / ea,
dairy-and-chilled-essentials,Sainsbury's British Semi Skimmed Milk 1.13L (2 pint),£1.20£1.06 / ltr,
dairy-and-chilled-essentials,"Sainsbury's British Butter, Salted 250g",£1.99£7.96 / kg,
dairy-and-chilled-essentials,Sainsbury's British Free Range Eggs Medium x12,£2.8023p / ea,
dairy-and-chilled-essentials,Sainsbury's British Whole Milk 2.27L (4 pint),£1.6573p / ltr,
dairy-and-chilled-essentials,Sainsbury's British Free Range Eggs Large x6,£2.0033p / ea,
dairy-and-chilled-essentials,Sainsbury's British Free Range Eggs Medium x6,£1.7529p / ea,
dairy-and-chilled-essentials,"Sainsbury's British Butter, Unsalted 250g",£1.99£7.96 / kg,
dairy-and-chilled-essentials,Sainsbury's British Mature Cheddar Cheese 400g,£3.25£8.13 / kg,
dairy-and-chilled-essentials,Sainsbury's Greek Style Natural Yogurt 500g,£1.1022p / 100g,
dairy-and-chilled-essentials,Sainsbury's Greek Feta Cheese 200g,£2.10£10.50 / kg,
dairy-and-chilled-essentials,Sainsbury's British Skimmed Milk 2.27L (4 pint),£1.6573p / ltr,
dairy-and-chilled-essentials,Sainsbury's Houmous 200g,95p48p / 100g,
dairy-and-chilled-essentials,Cravendale Filtered Fresh Semi Skimmed Milk 2L Fresher for L...,£2.90£1.45 / ltr,
dairy-and-chilled-essentials,Sainsbury's Free Range British Eggs Medium x15,"£2.95with Nectar
£3.3522p / ea",
dairy-and-chilled-essentials,Sainsbury's British Semi Skimmed Milk 3.4L (6 pint),£2.4070p / ltr,
dairy-and-chilled-essentials,Sainsbury's Cypriot Halloumi Cheese 225g,£2.09£9.29 / kg,
dairy-and-chilled-essentials,Sainsbury's British Whole Milk 1.13L (2 pint),£1.20£1.06 / ltr,
dairy-and-chilled-essentials,Cathedral City Mature Cheddar Cheese 350g,"£3.35with Nectar
£3.75£10.71 / kg",
dairy-and-chilled-essentials,Sainsbury's Double Cream 300ml,£1.4950p / 100ml,
dairy-and-chilled-essentials,Sainsbury's British Skimmed Milk 1.13L (2 pint),£1.20£1.06 / ltr,
dairy-and-chilled-essentials,Sainsbury's British Extra Mature Cheddar Cheese 400g,£3.25£8.13 / kg,
dairy-and-chilled-essentials,"Sainsbury's British Semi Skimmed Milk, SO Organic 2.27L (4 p...",£2.2599p / ltr,
dairy-and-chilled-essentials,Stamford Street Co. Mature Cheddar Cheese 600g,£3.85£6.42 / kg,
dairy-and-chilled-essentials,Sainsbury's Parmigiano Reggiano Cheese 200g,£3.90£19.50 / kg,
dairy-and-chilled-essentials,Sainsbury's British Filtered Semi Skimmed Milk 2L,£2.10£1.05 / ltr,
dairy-and-chilled-essentials,Sainsbury's Garlic Baguette x2 390g,£1.8046p / 100g,
dairy-and-chilled-essentials,"Frubes Kids Strawberry, Red Berry & Peach Yoghurt Tubes 9x37...","£1.50with Nectar
£2.2568p / 100g",
dairy-and-chilled-essentials,Sainsbury's Mozzarella Cheese 150g,£1.50£10.00 / kg,
dairy-and-chilled-essentials,Sainsbury's Everyday Lactose Free Semi Skimmed Dairy Drink 1...,£1.35£1.35 / ltr,
dairy-and-chilled-essentials,Stamford Street Co. Mature Cheddar Cheese 900g,£4.99£5.54 / kg,
dairy-and-chilled-essentials,Philadelphia Original Soft Cream Cheese 165g,£2.25£13.64 / kg,
dairy-and-chilled-essentials,Pizza Express Margherita Pizza 245g,"£2.75with Nectar
£5.50£22.45 / kg",
dairy-and-chilled-essentials,Sainsbury's Roasted Red Pepper Houmous 200g,95p48p / 100g,
dairy-and-chilled-essentials,Cravendale Filtered Fresh Semi Skimmed Milk Fresher for Long...,"£1.40with Nectar
£1.75£1.75 / ltr",
dairy-and-chilled-essentials,Sainsbury's British Crème Fraîche 300ml,99p33p / 100ml,
dairy-and-chilled-essentials,Sainsbury's Free Range Fresh Egg Noodles 410g,£1.50£3.66 / kg,
dairy-and-chilled-essentials,Stamford Street Co. Grated Cheddar 500g,£2.99£5.98 / kg,
dairy-and-chilled-essentials,Sainsbury's British Lighter Crème Fraîche 300ml,85p28p / 100ml,
dairy-and-chilled-essentials,Sainsbury's Spinach & Ricotta Tortelloni 300g,"£1.50with Nectar
£2.00£6.67 / kg",
dairy-and-chilled-essentials,Sainsbury's British Mature Cheddar Cheese Slices 240g,£2.80£11.67 / kg,
dairy-and-chilled-essentials,Sainsbury's Double Cream 600ml,£2.9048p / 100ml,
dairy-and-chilled-essentials,Sainsbury's British Mild Cheddar Cheese 400g,£3.25£8.13 / kg,
dairy-and-chilled-essentials,Sainsbury's Quiche Lorraine 400g,£1.9950p / 100g,
dairy-and-chilled-essentials,FAGE Total 0% Natural Fat Free Greek Recipe Strained Yogurt ...,"£3.00with Nectar
£3.5078p / 100g",
dairy-and-chilled-essentials,Sainsbury's Buttersoft Spreadable 500g,£2.18£4.36 / kg,
dairy-and-chilled-essentials,Sainsbury's Soured Cream & Chive Dip 200g,£1.4070p / 100g,
dairy-and-chilled-essentials,Cathedral City Mature Cheddar Cheese 550g,£5.40£9.82 / kg,
dairy-and-chilled-essentials,Sainsbury's Stonebaked Margherita Pizza 265g,£3.75£14.15 / kg,
dairy-and-chilled-essentials,Sainsbury's British Free Range Eggs Extra Large x6,£2.3539p / ea,
dairy-and-chilled-essentials,Activia Rhubarb Yogurt 4x115g,£2.5054p / 100g,
dairy-and-chilled-essentials,"Sainsbury's Garlic Flatbread, Taste the Difference 195g","£2.00with Nectar
£3.00£1.54 / 100g",
dairy-and-chilled-essentials,"Innocent Kids Strawberries, Raspberries & Apples Smoothies 4...","£2.00with Nectar
£3.6060p / 100ml",
dairy-and-chilled-essentials,Sainsbury's Stonebaked Pepperoni Pizza 270g,£3.75£13.89 / kg,
dairy-and-eggs,Flora Buttery Spread Alternative To Butter 450g,"£1.75with Nectar
£2.65£5.89 / kg",
dairy-and-eggs,Muller Corner Originals Apple Crumble Yogurt 4x124g,"£2.00with Nectar
£3.0060p / 100g",
dairy-and-eggs,Danone Strawberry Skyr Icelandic Style Yoghurt 270g,"£1.00with Nectar
£1.5056p / 100ml",
dairy-and-eggs,Sainsbury's British Semi Skimmed Milk 2.27L (4 pint),£1.6573p / ltr,
dairy-and-eggs,Sainsbury's British Free Range Eggs Large x12,£3.2527p / ea,
dairy-and-eggs,Sainsbury's British Semi Skimmed Milk 1.13L (2 pint),£1.20£1.06 / ltr,
dairy-and-eggs,"Sainsbury's British Butter, Salted 250g",£1.99£7.96 / kg,
dairy-and-eggs,Sainsbury's British Free Range Eggs Medium x12,£2.8023p / ea,
dairy-and-eggs,Sainsbury's British Whole Milk 2.27L (4 pint),£1.6573p / ltr,
dairy-and-eggs,Stamford Street Co. Mixed Size British Eggs Free Range x10 4...,£1.6416p / ea,
dairy-and-eggs,Sainsbury's British Free Range Eggs Large x6,£2.0033p / ea,
dairy-and-eggs,Sainsbury's British Free Range Eggs Medium x6,£1.7529p / ea,
dairy-and-eggs,"Sainsbury's British Butter, Unsalted 250g",£1.99£7.96 / kg,
dairy-and-eggs,Sainsbury's British Mature Cheddar Cheese 400g,£3.25£8.13 / kg,
dairy-and-eggs,Sainsbury's Greek Style Natural Yogurt 500g,£1.1022p / 100g,
dairy-and-eggs,Lurpak Slightly Salted Spreadable Blend of Butter & Rapeseed...,"£3.50with Nectar
£4.75£11.88 / kg",
dairy-and-eggs,Sainsbury's Greek Feta Cheese 200g,£2.10£10.50 / kg,
dairy-and-eggs,Sainsbury's Greek Style Natural Yogurt 1kg,£1.9520p / 100g,
dairy-and-eggs,Sainsbury's British Skimmed Milk 2.27L (4 pint),£1.6573p / ltr,
dairy-and-eggs,Cravendale Filtered Fresh Semi Skimmed Milk 2L Fresher for L...,£2.90£1.45 / ltr,
dairy-and-eggs,Sainsbury's Free Range British Eggs Medium x15,"£2.95with Nectar
£3.3522p / ea",
dairy-and-eggs,Sainsbury's British Semi Skimmed Milk 3.4L (6 pint),£2.4070p / ltr,
dairy-and-eggs,Sainsbury's Cypriot Halloumi Cheese 225g,£2.09£9.29 / kg,
dairy-and-eggs,Sainsbury's British Whole Milk 1.13L (2 pint),£1.20£1.06 / ltr,
dairy-and-eggs,Cathedral City Mature Cheddar Cheese 350g,"£3.35with Nectar
£3.75£10.71 / kg",
dairy-and-eggs,Sainsbury's Double Cream 300ml,£1.4950p / 100ml,
dairy-and-eggs,Sainsbury's British Skimmed Milk 1.13L (2 pint),£1.20£1.06 / ltr,
dairy-and-eggs,Sainsbury's British Extra Mature Cheddar Cheese 400g,£3.25£8.13 / kg,
dairy-and-eggs,"Sainsbury's British Semi Skimmed Milk, SO Organic 2.27L (4 p...",£2.2599p / ltr,
dairy-and-eggs,"Sainsbury's Authentic Greek Yogurt, Taste the Difference 500...",£2.3046p / 100g,
dairy-and-eggs,Stamford Street Co. Mature Cheddar Cheese 600g,£3.85£6.42 / kg,
dairy-and-eggs,Sainsbury's British Mature Grated Cheddar Cheese 250g,£2.55£10.20 / kg,
dairy-and-eggs,Stamford Street Co. Mozzarella Cheese Ball 125g,69p£5.52 / kg,
dairy-and-eggs,Sainsbury's British Semi Skimmed Milk 1 Pint,85p£1.50 / ltr,
dairy-and-eggs,Sainsbury's British Medium Cheddar Cheese 400g,£3.25£8.13 / kg,
dairy-and-eggs,Sainsbury's Grated Mozzarella Cheese 250g,£2.55£10.20 / kg,
dairy-and-eggs,Sainsbury's Parmigiano Reggiano Cheese 200g,£3.90£19.50 / kg,
dairy-and-eggs,Sainsbury's British Filtered Semi Skimmed Milk 2L,£2.10£1.05 / ltr,
dairy-and-eggs,"Frubes Kids Strawberry, Red Berry & Peach Yoghurt Tubes 9x37...","£1.50with Nectar
£2.2568p / 100g",
dairy-and-eggs,Sainsbury's Soured Cream 300ml,99p33p / 100ml,
dairy-and-eggs,Sainsbury's Greek Style Fat Free Natural Yogurt 500g,£1.1022p / 100g,
dairy-and-eggs,"Wildlife Choobs Kids Strawberry, Raspberry & Apricot Yoghurt...",£1.2054p / 100g,
dairy-and-eggs,FAGE Total 0% Fat Natural Fat Free Greek Recipe Strained Yog...,£5.5558p / 100g,
dairy-and-eggs,Sainsbury's Mozzarella Cheese 150g,£1.50£10.00 / kg,
dairy-and-eggs,Sainsbury's Everyday Lactose Free Semi Skimmed Dairy Drink 1...,£1.35£1.35 / ltr,
dairy-and-eggs,"Sainsbury's Cottage Cheese, Fat Free 300g",£1.60£5.33 / kg,
dairy-and-eggs,FAGE Total 5% Fat Natural Greek Recipe Strained Yoghurt 950g,£5.5558p / 100g,
dairy-and-eggs,Stamford Street Co. Mature Cheddar Cheese 900g,£4.99£5.54 / kg,
dairy-and-eggs,Oatly Oat Drink Barista Edition Long Life 1L,£2.20£2.20 / ltr,
dairy-and-eggs,Sainsbury's British Whole Milk 3.4L (6 pint),£2.4070p / ltr,
dairy-and-eggs,Philadelphia Original Soft Cream Cheese 165g,£2.25£13.64 / kg,
dairy-and-eggs,Stamford Street Co. Soft Cheese 200g,95p£4.75 / kg,
dairy-and-eggs,Sainsbury's Cottage Cheese 300g,£1.60£5.33 / kg,
dairy-and-eggs,Cravendale Filtered Fresh Semi Skimmed Milk Fresher for Long...,"£1.40with Nectar
£1.75£1.75 / ltr",
dairy-and-eggs,Sainsbury's British Crème Fraîche 300ml,99p33p / 100ml,
dairy-and-eggs,Lurpak Lighter Spreadable Blend of Slightly Salted Butter & ...,"£3.50with Nectar
£4.75£11.88 / kg",
dairy-and-eggs,Sainsbury's Sheet Puff Pastry x1 320g,£1.30£4.06 / kg,
dairy-and-eggs,Anchor Salted Butter 200g,"£1.85with Nectar
£2.60£13.00 / kg",
dairy-and-eggs,Strings & Things Cheestrings Cheese Snack x8 160g,£2.49£15.56 / kg,
dairy-and-eggs,Stamford Street Co. Grated Cheddar 500g,£2.99£5.98 / kg,
desserts,Muller Corner Originals Apple Crumble Yogurt 4x124g,"£2.00with Nectar
£3.0060p / 100g",
desserts,Cadbury Dairy Milk Buttons Dessert 75g,"80pwith Nectar
£1.25£1.67 / 100g",
desserts,Muller Myprotein Chocolate High Protein Pudding 200g,"£1.25with Nectar
£1.7588p / 100g",
desserts,Sainsbury's Fresh Soured Cream 150ml,85p57p / 100ml,
desserts,Sainsbury's Egg Custard Tarts 4 x 81g,£1.5046p / 100g,
desserts,Sainsbury's Chocolate Mousse 6 x 60g,95p26p / 100g,
desserts,Sainsbury's Raspberry Trifles 2 x 125g,£1.5060p / 100g,
desserts,Sainsbury's Strawberry Trifles 2 x 125g,£1.5060p / 100g,
desserts,Sainsbury's Egg Custard Tarts 2x81g,£1.0062p / 100g,
desserts,Sainsbury's Tiramisù Desserts x2 85g,"£1.50with Nectar
£2.10£1.24 / 100g",
desserts,Rachel's Organic Divine Rice Puddings 2x150g,"£1.50with Nectar
£2.2575p / 100g",
desserts,Cadbury Flake Chocolate Dessert 75g,"80pwith Nectar
£1.25£1.67 / 100g",
desserts,Müller Rice Vanilla Custard Low Fat Pudding Dessert 170g,90p53p / 100g,
desserts,Sainsbury's Belgian Chocolate Eclairs 2 x 55g,£2.00£1.82 / 100g,
desserts,Rolo Delicious Milk Chocolate & Toffee Dessert 2 x 65g,"£1.00with Nectar
£2.00£1.54 / 100g",
desserts,Müller Rice Strawberry Low Fat Pudding Dessert 170g,90p53p / 100g,
desserts,Aero Milk Chocolate Mousse 4 x 59g,"£1.50with Nectar
£2.0085p / 100g",
desserts,Crème Caramel Milk Desserts with Caramel Sauce 4x100g,£1.2531p / 100g,
desserts,Sainsbury's Sweet Pancakes x6 375g,£2.4064p / 100g,
desserts,Muller Rice Original Low Fat Pudding Dessert 170g,90p53p / 100g,
desserts,Bonne Maman Chocolate Mousse Dessert 2x70g,"£1.50with Nectar
£2.20£1.57 / 100g",
desserts,Sainsbury's Raspberry Trifle Dessert 600g,"£3.00with Nectar
£3.3055p / 100g",
desserts,Sainsbury's Strawberry Jam & Cream Doughnuts 2x63g,£2.00£1.59 / 100g,
desserts,Sainsbury's Belgian Chocolate Eclairs 4x34g,£2.25£1.65 / 100g,
desserts,Sainsbury's Caramel Panna Cotta 2x120g,"£1.50with Nectar
£2.2594p / 100g",
desserts,Sainsbury's British Extra Thick Double Fresh Cream 300ml,£1.9063p / 100ml,
desserts,Elmlea Single Alternative To Cream 270ml,£1.4052p / 100ml,
desserts,Sainsbury's Strawberry Trifle Dessert 600g,£3.3055p / 100g,
desserts,Sainsbury's Apple Turnovers 2x77g,£2.00£1.35 / 100g,
desserts,Elmlea Double Light Alternative to Cream 270ml,£1.4052p / 100ml,
desserts,Bonne Maman Creme Caramel Dessert 4x100g,£3.2080p / 100g,
desserts,Sainsbury's Buttermilk Pancakes x6 240g,£2.40£1.00 / 100g,
desserts,Muller Rice Apple & Raspberry Low Fat Pudding Dessert 6x170g,£4.0039p / 100g,
desserts,Milkybar Smooth & Creamy White Chocolate Dessert 2 x 65g,"£1.00with Nectar
£2.00£1.43 / 100g",
desserts,Cadbury Dairy Milk Layers of Joy Chocolate Trifle 2x90,£2.00£1.11 / 100g,
desserts,Arla Lactofree Cream 250ml,£1.4558p / 100ml,
desserts,Sainsbury's Triple Chocolate Sundae 125,"£1.15with Nectar
£1.35£1.08 / 100g",
desserts,Muller Myprotein Chocolate High Protein Mousse Dessert 200g,"£1.50with Nectar
£1.9598p / 100g",
desserts,Cadbury Crunchie Chocolate Dessert 75g,"80pwith Nectar
£1.25£1.67 / 100g",
desserts,Bonne Maman Strawberry Mousse Dessert 2x70g,"£1.50with Nectar
£2.20£1.57 / 100g",
desserts,Bonne Maman Salted Caramel Creme Dessert 2x90g,"£1.50with Nectar
£2.20£1.22 / 100g",
desserts,Sainsbury's Tiramisu Italian Dessert 500g,£3.3066p / 100g,
desserts,Sainsbury's Summer Peach & Raspberry Trifle 600g,"£3.00with Nectar
£3.3055p / 100g",
desserts,Sainsbury's Belgian Chocolate Choux Buns 2x68g,£2.00£1.47 / 100g,
desserts,Yeo Valley Organic Half Fat Crème Fraiche 200g,£1.6080p / 100g,
desserts,Cadbury Dairy Milk Buttons & Chunks Chocolate Desserts 4x75g,£3.75£1.25 / 100g,
desserts,"Sainsbury's Lemon, Passion Fruit & Yuzu Possets, Taste the D...",£4.35£2.36 / 100g,
desserts,"Sainsbury's Lemon & Raspberry Cheesecake Slices, Taste the D...",£3.50£1.94 / 100g,
desserts,Sainsbury's Strawberry Jam & Cream Horns 98g,£2.00£2.04 / 100g,
desserts,"Sainsbury's Sticky Toffee Pudding, Taste the Difference 200g",£3.50£1.75 / 100g,
desserts,Bonne Maman Clementine & Lemon Mousse Dessert 2x70g,"£1.50with Nectar
£2.20£1.57 / 100g",
desserts,Sainsbury's Fresh Custard Slices x2 180g,£1.85£1.03 / 100g,
desserts,Muller Corner Originals Mississippi Mud Pie Yogurt 4x124g,"£2.00with Nectar
£3.0060p / 100g",
desserts,Sainsbury's British Whipping Fresh Cream 300ml,£1.6555p / 100ml,
desserts,Sainsbury's Cream Slices 2x58g,£1.85£1.59 / 100g,
desserts,"Sainsbury's Chocolate Melting Puddings, Taste the Difference...",£3.50£1.13 / 100g,
desserts,Stamford Street Co. Apple Pie 550g,£1.9035p / 100g,
desserts,Sainsbury's Syrup Sponge Puddings 2 x 105g,£2.75£1.31 / 100g,
desserts,Carnation Sweetened Condensed Milk Tin 397g,£1.7544p / 100g,
desserts,Sainsbury's Strawberry Cheesecake 3x100g,£2.5083p / 100g,
fruit-juice-and-drinks,Unrooted Good Energy Mighty Ginger & Chilli Shot 60ml,£2.00£3.33 / 100ml,
fruit-juice-and-drinks,Rubicon Sparkling Mango Juice Soft Drink 6x330ml,"£2.75with Nectar
£3.8519p / 100ml",
fruit-juice-and-drinks,Ufc Refresh Coconut Water 1L,"£2.20with Nectar
£2.8028p / 100ml",
fruit-juice-and-drinks,Sainsbury's Smooth Pure Orange Juice 1L,£1.4515p / 100ml,
fruit-juice-and-drinks,Sainsbury's Pure Apple Juice 1L,99p10p / 100ml,
fruit-juice-and-drinks,"Sainsbury's 100% Pure Squeezed Smooth Orange Juice, Not From...",£2.2523p / 100ml,
fruit-juice-and-drinks,"Sainsbury's 100% Pressed Apple Juice, Not From Concentrate 1...",£2.2523p / 100ml,
fruit-juice-and-drinks,"Innocent Kids Strawberries, Raspberries & Apples Smoothies 4...","£2.00with Nectar
£3.6060p / 100ml",
fruit-juice-and-drinks,Tropicana Pure Smooth Orange Fruit Juice 1.5L,"£3.50with Nectar
£4.5030p / 100ml",
fruit-juice-and-drinks,"Sainsbury's 100% Apple Juice, Not From Concentrate 1.75L",£3.4019p / 100ml,
fruit-juice-and-drinks,"Innocent Kids Oranges, Mangoes & Pineapples Smoothies 4x150m...","£2.00with Nectar
£3.6060p / 100ml",
fruit-juice-and-drinks,"Sainsbury's 100% Pure Squeezed Orange Juice with Bits, Not F...",£2.2523p / 100ml,
fruit-juice-and-drinks,Biotiful Gut Health Kefir Milk Drink Original 1L,£3.5035p / 100ml,
fruit-juice-and-drinks,Tropicana Pure Smooth Orange Fruit Juice 900ml,£3.2536p / 100ml,
fruit-juice-and-drinks,"Sainsbury's Freshly Squeezed Orange Juice with Bits, Taste t...",£3.4034p / 100ml,
fruit-juice-and-drinks,"Sainsbury's 100% Pure Squeezed Pineapple Juice, Not From Con...",£2.2523p / 100ml,
fruit-juice-and-drinks,"Sainsbury's Freshly Squeezed Smooth Orange Juice, Taste the ...",£3.4034p / 100ml,
fruit-juice-and-drinks,Happy Monkey Strawberry & Banana Kids Smoothie 4x180ml,£2.4033p / 100ml,
fruit-juice-and-drinks,Innocent Pure Orange Juice Smooth 900ml,"£2.50with Nectar
£3.2036p / 100ml",
fruit-juice-and-drinks,"Innocent Kids Peaches, Passion Fruits & Oranges Smoothies 4 ...","£2.00with Nectar
£3.6060p / 100ml",
fruit-juice-and-drinks,"Sainsbury's Apple & Mango Juice, Not From Concentrate 1L",£2.2523p / 100ml,
fruit-juice-and-drinks,Innocent Pure Orange Juice Smooth 1.35L,£4.4033p / 100ml,
fruit-juice-and-drinks,Sainsbury's Mango & Passionfruit Smoothie 750ml,£1.9526p / 100ml,
fruit-juice-and-drinks,Innocent Pure Orange Juice Smooth 1.75L,"£3.50with Nectar
£4.9028p / 100ml",
fruit-juice-and-drinks,"Sainsbury's 100% Pure Squeezed Pink Grapefruit Juice, Not Fr...",£2.2523p / 100ml,
fruit-juice-and-drinks,Happy Monkey Chocolate Milkshakes 3x200ml,"£1.00with Nectar
£1.2020p / 100ml",
fruit-juice-and-drinks,Innocent Kids Apples & Blackcurrants Smoothies 4 x 150ml,"£2.00with Nectar
£3.6060p / 100ml",
fruit-juice-and-drinks,"Innocent Kids Cherries, Strawberries & Apples Smoothies 4 x ...","£2.00with Nectar
£3.6060p / 100ml",
fruit-juice-and-drinks,"Sainsbury's Apple & Pear Juice, Not From Concentrate 1L",£2.2523p / 100ml,
fruit-juice-and-drinks,Biotiful Gut Health Kefir Milk Drink Original 500ml,£2.6052p / 100ml,
fruit-juice-and-drinks,Copella Cloudy Apple Fruit Juice 1.35L,£3.7528p / 100ml,
fruit-juice-and-drinks,MOJU Ginger Vitality Dosing Bottle Shots x7 420ml,£5.95£1.42 / 100ml,
fruit-juice-and-drinks,"Sainsbury's Apple & Mango Juice, Not From Concentrate 1.75L",£3.4019p / 100ml,
fruit-juice-and-drinks,Sainsbury's Pure Orange Juice with Juicy Bits 1L,£1.5916p / 100ml,
fruit-juice-and-drinks,Sainsbury's Strawberry & Banana Smoothie 750ml,£1.9526p / 100ml,
fruit-juice-and-drinks,Copella Cloudy Apple Fruit Juice 900ml,"£2.25with Nectar
£2.7531p / 100ml",
fruit-juice-and-drinks,"Sainsbury's Tropical Juice, Not From Concentrate 1L",£2.2523p / 100ml,
fruit-juice-and-drinks,Vita Coco The Original Coconut Water 1L,£4.0040p / 100ml,
fruit-juice-and-drinks,Happy Monkey Orange & Mango Kids Smoothie 4x180ml,£2.4033p / 100ml,
fruit-juice-and-drinks,Tropicana Pure Orange Fruit Juice with Extra Juicy Bits 1.5L,"£3.50with Nectar
£4.5030p / 100ml",
fruit-juice-and-drinks,"innocent Kids Strawberries, Kiwis & Apples Super Smoothies w...",£4.1068p / 100ml,
fruit-juice-and-drinks,"Sainsbury's Orange & Mango Juice, Not From Concentrate 1L",£2.2523p / 100ml,
fruit-juice-and-drinks,innocent Pure Apple Juice 1.35L,£4.4033p / 100ml,
fruit-juice-and-drinks,Biotiful Gut Health Kefir Milk Drink Strawberry 1L,£3.5035p / 100ml,
fruit-juice-and-drinks,Happy Monkey Strawberry Milkshake 3x200ml,"£1.00with Nectar
£1.2020p / 100ml",
fruit-juice-and-drinks,"Sainsbury's Pineapple, Banana & Coconut Smoothie 750ml",£1.9526p / 100ml,
fruit-juice-and-drinks,Tropicana Original Orange with Juicy Bits 1.5L,"£3.50with Nectar
£4.5030p / 100ml",
fruit-juice-and-drinks,"Innocent Kids Strawberries, Raspberries & Apples Smoothies 1...",£6.0040p / 100ml,
fruit-juice-and-drinks,Tropicana Pure Smooth Orange Fruit Juice 500ml,"£1.50with Nectar
£2.0040p / 100ml",
fruit-juice-and-drinks,Copella Apple & Elderflower Fruit Juice 1.35L,£3.7528p / 100ml,
fruit-juice-and-drinks,Biotiful Gut Health Kefir Milk Drink Cherry 500ml,£2.6052p / 100ml,
fruit-juice-and-drinks,"Innocent Berry Energise, Strawberry, Cherry, Apple & Guarana...","£2.50with Nectar
£4.5060p / 100ml",
fruit-juice-and-drinks,Tropicana Tropical Fruits 1.5L,"£3.50with Nectar
£4.5030p / 100ml",
fruit-juice-and-drinks,innocent Pure Apple Juice 900ml,"£2.50with Nectar
£3.2036p / 100ml",
fruit-juice-and-drinks,Vita Coco Extra Coconut Water 1L,"£2.50with Nectar
£4.0040p / 100ml",
fruit-juice-and-drinks,"Innocent Strawberries, Bananas & Apples Smoothie 750ml",£3.5047p / 100ml,
fruit-juice-and-drinks,Tropicana Original Orange Juice with Bits 900ml,£3.2536p / 100ml,
pies-pasties-and-quiche,Mr Kipling Delicious & Light Bramley Apple Pies x6,"£1.75with Nectar
£3.0050p / ea",
pies-pasties-and-quiche,Sainsbury's Quiche Lorraine 400g,£1.9950p / 100g,
pies-pasties-and-quiche,Sainsbury's Mini Melton Mowbray Pork Pies x6 300g,£1.9966p / 100g,
pies-pasties-and-quiche,Sainsbury's Sausage Rolls x6 360g,£1.6947p / 100g,
pies-pasties-and-quiche,Sainsbury's Sausage Rolls x9 270g,£1.2948p / 100g,
pies-pasties-and-quiche,Sainsbury's Pork Cocktail Sausages 200g,£1.5075p / 100g,
pies-pasties-and-quiche,Sainsbury's Egg Bites x12 216g,£1.4969p / 100g,
pies-pasties-and-quiche,Stamford Street Co. Pork Sausage Rolls x8 480g,99p21p / 100g,
pies-pasties-and-quiche,Sainsbury's Snack Pork Pies x4 260g,£1.1845p / 100g,
pies-pasties-and-quiche,"Sainsbury's Mini Melton Mowbray Pork Pies, Taste the Differe...",£3.00£1.50 / 100g,
pies-pasties-and-quiche,"Ginsters Cornish Pasty, 227g",£2.2599p / 100g,
pies-pasties-and-quiche,Sainsbury's Extra Mature Cheddar & Cherrywood Smoked Bacon Q...,£4.25£1.06 / 100g,
pies-pasties-and-quiche,Sainsbury's Scotch Eggs x2 226g,£1.2555p / 100g,
pies-pasties-and-quiche,Sainsbury's Mini Sausage Rolls x20 200g,£2.40£1.20 / 100g,
pies-pasties-and-quiche,Pukka Pies All Steak Pie 209g,£2.25£1.08 / 100g,
pies-pasties-and-quiche,Sainsbury's Cheese & Onion Quiche 400g,£1.9950p / 100g,
pies-pasties-and-quiche,"Sainsbury's Broccoli, Tomato & Cheese Quiche 400g",£1.9950p / 100g,
