Category,Name,Price
fresh-food,Tesco Smoked Pancetta 2 X 65G,£1.95
fresh-food,Creamfields Mild White Cheddar 400G,£2.49
fresh-food,Tesco Large Melton Mowbray Pork Pie 440G,£3.80
fresh-food,Tesco Greek Style Yogurt 4 X 100G,£1.45
fresh-food,Alpro Almond No Sugar Chilled Dairy Free Drink 1L,£2.20
fresh-food,Petits Filous Strawberry & Apricot Kids Yoghurt Big Pots 4x85g,£1.95
fresh-food,Tesco Finest 2 Cornfed Free Range Chicken Breast Fillets 270G-470G,£4.25
fresh-food,Tesco Shallots Onions 400G,£1.35
fresh-food,Tesco Flat Leaf Parsley 100G,£1.25
fresh-food,Eastman's Sliced Cooked Chicken Tikka 240G,£1.99
fresh-food,Tesco 16 Spicy Chorizo Slices 80G,£1.25
fresh-food,Tesco Finest Aberdeen Angus Steak Mince 500G,£6.00
fresh-food,Fresh & Naked Just Lambs Lettuce 60G,£1.20
fresh-food,Rustlers All Day Breakfast Sausage Muffin 155G,£1.90
fresh-food,Tesco Beef Tomatoes Each,£0.87
fresh-food,Creamfields Mild Cheddar Slices 10 Pack 200g,£1.39
fresh-food,Tesco Cantaloupe Melon Each,£2.00
fresh-food,Tesco Fresh Mashed Potato 800G,£1.75
fresh-food,Tesco Sage 20G,£0.50
fresh-food,Tesco 2 Beef Medallion Steaks 340G,£4.90
fresh-food,Tesco Finest Cooked Jumbo King Prawns 150G,£4.25
fresh-food,Jus-Rol Pains Au Chocolat Dough 6 pk 275g,£3.00
fresh-food,Tesco Wensleydale With Apricots Cheese 200g,£2.85
fresh-food,Tesco Chicken & Bacon Pasta Bake 400G,£3.75
fresh-food,Tesco Beef Meatballs 12 Pack 336g,£3.95
fresh-food,Tesco British Brie 160G,£2.30
fresh-food,Tesco Finest Free Range Bluebell Araucana Eggs 6 Pack,£2.90
fresh-food,Tesco 50% Less Fat Soft Cheese 200G,£1.55
fresh-food,Oykos Peach Luxury Greek Style Yoghurt Dessert 4x110g,£2.20
fresh-food,"Tesco British Mild Cheddar Cheese 10 Slices, 250 G",£2.85
fresh-food,Aero Chocolate Mousse 4 X59g,£2.00
fresh-food,Oykos Blueberry Luxury Greek Style Yoghurt Dessert 4x110g,£2.20
fresh-food,Primula Original Cheese Tube 140G,£2.00
fresh-food,Tesco Finest Sirloin Steak 227G,£7.80
fresh-food,Tesco Finest Unsmoked Wiltshire Cured Back Bacon 8 Pack 240G,£4.15
fresh-food,Tesco Finest All Rounder Potatoes 2Kg,£2.40
fresh-food,Tesco Paneer Cheese 200G,£1.80
fresh-food,Tesco Sliced Edam 250g,£2.85
fresh-food,Tesco Finest Echalion Shallots 400G,£1.55
fresh-food,Tesco 10 Mild Slices 200G,£1.45
fresh-food,Tesco Filtered Whole Milk 2 Litre,£2.20
fresh-food,Tesco Reduced Fat Sour Cream & Chive Dip 200G,£1.30
fresh-food,Tesco Clementine Juice Not From Concentrate 1L,£2.00
fresh-food,Tesco Beansprouts 300G,£0.85
fresh-food,Creamfields Single Cream 300Ml,£1.09
fresh-food,Tesco Beetroot Salad 160G,£1.45
fresh-food,Love Beets No Vinegar Beetroot Pouch 280g,£1.30
fresh-food,Tesco 100% Squeezed & Pressed Orange & Mango Juice 1 Litre,£2.00
fresh-food,Stockwell & Co. Soft Spread 500G,£0.95
fresh-food,Tesco 12 Pork Sausages 681G,£2.65
fresh-food,Tesco 100% Pure Pineapple Juice 1 Litre,£2.00
fresh-food,Tesco Thin Cut Beef Steaks 395G,£4.50
fresh-food,Lurpak Slightly Salted Spreadable Blend of Butter and Rapeseed Oil 250g,£3.15
fresh-food,Tesco Finest West Country Butter & Sea Salt 250G,£2.90
fresh-food,Pilgrims Choice Mature Cheddar Cheese 550 G,£5.40
fresh-food,Activia Peach No Added Sugar Fat Free Gut Health Yoghurt Multipack 4x115g,£2.75
fresh-food,Tesco 2 Boneless Sea Bass Fillets 180G,£5.95
fresh-food,Flora Buttery Spread with Natural Ingredients 1KG,£4.75
fresh-food,Tesco Fresh Lasagne Sheets 250G,£2.00
fresh-food,Tesco Red Leicester Cheese 220G,£2.50
fresh-food,Muller Light Red Fruit Assorted Fat Free Yogurt 6X140g,£4.00
fresh-food,Pizza Express American Pizza 250G,£5.60
fresh-food,Richmond Thin Pork Sausages 12 Pack 340g,£2.30
fresh-food,Tesco Finest Cottage Pie 400G,£4.75
fresh-food,Tesco Finest Chicken & Mushroom Soup 600G,£3.20
fresh-food,Tesco Finest Wiltshire Cured Smoked Back Bacon 8 Rashers 240g,£4.15
fresh-food,Tesco Ginger 100g,£1.25
fresh-food,Tesco 100% Pressed Apple & Mango Juice 1 Litre,£2.00
fresh-food,Tesco Olive Spread 500G,£1.50
fresh-food,Alpro Oat No Sugar Chilled Dairy Free Drink 1L,£2.10
fresh-food,Muller Light Greek Style Lemon Yogurt 4X115g,£2.50
fresh-food,Tesco Organic Unwaxed Lemons Minimum 3 Pack,£1.90
fresh-food,Tesco Finest Raspberries 150G,£2.95
fresh-food,Lindahls Kvarg - Raspberry 150g,£1.25
fresh-food,Tesco Ready to Eat Conference Pears 4 Pack,£2.35
fresh-food,Cheestrings Original Cheese Snacks 4 Pack 80G,£1.75
fresh-food,"Tesco British Skimmed Milk 568Ml, 1 Pint",£0.90
fresh-food,Tesco Finest Topside of Beef - Charred 90g,£3.75
fresh-food,Tesco Beef Casserole & Dumplings 400G,£3.75
fresh-food,Tesco Butterhead Lettuce,£0.85
fresh-food,Creamfields Low Fat Cottage Cheese 300g,£0.99
fresh-food,Tesco Growing Salad Cress Each,£0.45
fresh-food,Tesco Cherries Punnet 200G,£2.80
fresh-food,Tesco Dill 20G,£0.48
fresh-food,Tesco British Chicken Legs 1Kg,£2.25
fresh-food,Creamfields Low Fat Sunshine Fruit Yogurt 6X125g,£0.95
fresh-food,Tesco Stewing Steak 400G,£4.45
fresh-food,Rymer Farm Large Free Range Eggs 6 Pack,£3.00
fresh-food,Tesco Finest 14 Month Genuine Parma Ham 78G,£3.10
fresh-food,Tesco 30% Reduced Fat Mature Cheese 400G,£3.25
fresh-food,Tesco Finest 12 Beef & Herb Meatballs 336G,£4.95
fresh-food,Cathedral City 6 Slices Mature Cheddar Cheese 150 G,£2.60
fresh-food,Tesco Finest 12 Cumberland Chipolatas 375G,£3.30
fresh-food,Tesco Yorkshire Puddings 6 Pack 180G,£2.10
fresh-food,Ms Mollys Toffee Layered Dessert 100G,£1.00
fresh-food,Tesco Blackberries 150G,£2.85
fresh-food,Cravendale Filtered Fresh Whole Milk 1L Fresher for Longer,£1.75
fresh-food,Tesco British Lamb Mince 20% Fat 500G,£7.00
fresh-food,Tesco Pomegranate Seeds 80G,£1.50
fresh-food,Pukka Chicken & Mushroom Pie,£2.25
fresh-food,Ski Variety Fruit Yogurt 4X120g,£1.40
fresh-food,Lindahls Kvarg Vanilla 150G Pot,£1.25
fresh-food,Arla Skyr Natural Icelandic Style Yogurt 450g,£2.50
fresh-food,Tesco Organic Brown Onions 750G,£1.65
fresh-food,Yeo Valley Natural Yogurt 150G,£0.80
fresh-food,Tesco Mixed Vegetables 225G,£1.75
fresh-food,Heck 6 97% Pork Sausages 400G,£3.25
fresh-food,Tesco Natural Yogurt 500G,£1.15
fresh-food,Tesco Galia Melon Each,£2.00
fresh-food,Tesco British Honey Roast Ham Slices 400g,£5.00
fresh-food,Growers Harvest Orange Juice Drink No Added Sugar 1Litre,£0.90
fresh-food,Tesco Organic Broccoli 335G,£1.55
fresh-food,Tesco Cheddar & Onion Quiche 400G,£2.50
fresh-food,Tesco Egg Custard Tarts 2 Pack,£0.85
fresh-food,Tesco Cut Chives 20G,£0.50
fresh-food,Tesco Corn On The Cob Twinpack,£1.29
fresh-food,Tesco Finest 5% Aberdeen Angus Steak Mince 500G,£6.50
fresh-food,Alpro Oat Original Long Life Dairy Free Drink 1L,£2.30
fresh-food,Tesco Finest Vintage English Cheddar 300g,£4.10
fresh-food,Tesco Lamb Half Leg Joint,£8.50
fresh-food,Activia Strawberry & Mixed Fruit Gut Health Yoghurt Multipack 8x115g,£4.25
fresh-food,Muller Corner Red Fruits & Blackberry Yogurts 6 X 136G,£4.00
fresh-food,Alpro Soya No Sugar Long Life Dairy Free Drink 1L,£1.80
fresh-food,Heck Chicken 10 Italia Sausages 340G,£3.25
fresh-food,Tesco Finest 20 Mini Meatballs 336G,£4.95
fresh-food,Tesco Spaghetti Carbonara 400G,£3.75
fresh-food,Tesco 2 Breaded Chunky Cod Fillets 350G,£5.50
fresh-food,Tesco Finest Lemon Curd Yogurt 150G,£1.00
fresh-food,Cheestrings Twisted Cheese Snacks 8Pk 160G,£2.45
fresh-food,Frubes Strawberry Kids Yoghurt Tubes Multipack 9x37g,£2.25
fresh-food,Tesco Italian Unsmoked Pancetta 2 X65g,£1.95
fresh-food,Arla LactoFREE Mature Cheddar Cheese 200g,£2.50
fresh-food,Jus-Rol Puff Block 500G,£1.60
fresh-food,Tesco Fresh Tagliatelle Nests 300g,£1.50
fresh-food,Elmlea Plant Double Alternative To Cream 250Ml,£1.75
fresh-food,Tesco Boneless Salmon Fillet 130G,£3.00
fresh-food,Tesco Cottage Pie 400G,£3.75
fresh-food,Tesco Finest Mature Blue Stilton 180G,£4.00
fresh-food,Tesco Mini Watermelon,£2.40
fresh-food,Tesco Tomato Juice 1 Litre,£1.60
fresh-food,Tesco Buttery Spread 500G,£1.30
fresh-food,Arla Protein Yogurt - Passionfruit & Papaya 200g,£1.45
fresh-food,Tesco 0% Fat Greek Style Yogurt 1Kg,£1.95
fresh-food,Tesco Finest Sweet Mini Peppers 220G,£1.70
fresh-food,Mash Direct Mashed Potato For One 200G,£0.95
fresh-food,Tesco Chocolate Flavoured Milk 1L,£1.10
fresh-food,Tesco Spanish Chorizo Sausage Slices 150G,£1.25
fresh-food,Hearty Food Co Cheese & Ham Pizza 124G,£0.65
fresh-food,Tesco British Pastrami Slices 100g,£2.30
fresh-food,Tesco Large Pork Shoulder Joint,£9.00
fresh-food,Anchor Spreadable Blend of Butter and Rapeseed Oil 750g,£7.50
fresh-food,Clover Spread 1Kg,£4.30
fresh-food,Tesco Finest Gruyere AOP Reserve Cheese 195g,£4.65
fresh-food,Activia Vanilla No Added Sugar Fat Free Gut Health Yoghurt Multipack 4x115g,£2.75
fresh-food,Tesco 30% Reduced Fat Extra Mature Cheese 400G,£3.25
fresh-food,Tesco British Goats Cheese 125G,£2.55
fresh-food,CASTELLO PINEAPPLE HALO Soft CHSE 125g,£2.30
fresh-food,Almond Breeze Unsweetened Longlife Drink Alternative 1 Litre,£1.90
fresh-food,Tesco 30% Reduced Fat Mature Cheese Slices 250G,£2.85
fresh-food,Ocean Spray Cranberry Classic Light Juice Drink 1 Litre,£1.90
fresh-food,Tesco Finest Chicken & Pancetta Bake 400G,£4.75
fresh-food,New Covent Garden Soup Co Classic Chicken Soup 560G,£2.45
fresh-food,Tesco Ripen At Home Avocados 3Pack,£2.00
fresh-food,Lindahls Kvarg White Chocolate 150G,£1.25
fresh-food,Tesco Ripe & Ready Avocado,£0.69
fresh-food,Tesco 100% Pure Breakfast Juice 1L,£2.00
fresh-food,Joseph Heler White Cheshire Cheese 200 G,£2.00
fresh-food,Tesco Aioli Dip 200G,£1.30
fresh-food,Tesco 12 Pork Chipolatas Chipolatas 375G,£1.97
fresh-food,Seriously Spreadable Original Cheese Spread 125g,£1.35
fresh-food,Seachill Cooked & Peeled Coldwater Prawns 150g,£1.99
fresh-food,Tesco Beef Ribeye Steak 227G,£6.50
fresh-food,Tesco Beef Fillet Steak 170G,£7.50
fresh-food,Arla Lactofree Semi Skimmed Long Life Milk Drink 1L,£2.10
fresh-food,Arla LactoFREE Skimmed Milk Drink 1L,£1.95
fresh-food,Alpro Soya Original Long Life Dairy Free Drink 1L,£1.80
fresh-food,Muller Light Toffee Yogurt 160G,£0.95
fresh-food,Tesco 4 Roast Cooked Chicken Breast Fillets 485G,£6.80
fresh-food,"innocent Kids Smoothies Strawberries, Raspberries & Apples 4 x 150ml",£3.60
fresh-food,Tesco Finest Sweet Potato Coconut & Chilli Soup 600G,£3.20
fresh-food,Pure Dairy Free Buttery Spread 500G,£2.15
fresh-food,Tesco Finest Medjool Dates 200G,£2.60
fresh-food,Tesco 2 Sweet Chill Hot Smoked Salmon Fillets 180G,£5.95
fresh-food,Tesco Finest British 12 Pork & Honey Chipolatas 375G,£3.30
fresh-food,Onken Cherry Yogurt 450G,£1.95
fresh-food,Yeo Valley Organic Kefir Natural Yogurt 350g,£2.00
fresh-food,Tesco Melton Mowbray Pork Pie 145g,£1.95
fresh-food,"Tesco Organic Free Range Whole Milk 1.136L, 2 Pint",£2.00
fresh-food,Alpro Soya Chilled Drink 1 Litre,£1.80
fresh-food,Tesco Tomato & Basil Sauce 350G,£2.25
fresh-food,Tesco Watermelon,£3.75
fresh-food,Tesco Greek Style Yogurt with Honey 450g,£1.70
fresh-food,Dairylea Cheese Spread Triangles 8 pack 8x15.6G,£1.75
fresh-food,Tesco Oat Drink 1L,£1.50
fresh-food,Tesco Sliced Emmental 250g,£2.85
fresh-food,Wildlife Choobs Strawberry Kids Yoghurt Tubes 6x37g,£1.20
fresh-food,Philadelphia Protein Low Fat Soft Cream Cheese 165g,£2.25
fresh-food,Tesco Sausage & Ham Fresh Tortelloni 300g,£2.25
fresh-food,Tesco Cheese Sauce 350G,£2.25
fresh-food,Creamfields Grated Grana Padano 100G,£1.65
fresh-food,Tesco 0% Fat Natural Yogurt 500G,£1.15
fresh-food,Eastmans Cheese & Bacon Quiche 400G,£2.00
fresh-food,Suntrail Farms Nectarines Minimum 4,£1.79
fresh-food,Tesco Pomegranates Each,£1.55
fresh-food,Tesco Finest Beef Roasting Joint,£15.75
fresh-food,Tesco Organic Unsalted Butter 250G,£3.20
fresh-food,Petits Filous Strawberry Raspberry & Apricot Kids Yoghurt Pots Multipack 18x47g,£3.50
fresh-food,Tesco Unsmoked Lardons 200G,£2.80
fresh-food,Tesco Finest Diced Beef 400G,£7.40
fresh-food,Philadelphia Light Low Fat Soft Cream Cheese 280G,£3.25
fresh-food,Big & Free Large White Free Range Eggs 10 Pack,£3.35
fresh-food,Large Braeburn Apples Loose Class 1,£0.56
fresh-food,Tesco Pork & Pickle Pies 6 Pack 300g,£2.50
fresh-food,"Boursin Garlic & Herb Cheese 6 Pack, 96 G",£2.50
fresh-food,Tesco Finest Garlic & Parsley Ciabatta 255G,£3.20
fresh-food,Tesco Bangers & Mash 400G,£3.75
fresh-food,Actimel Strawberry Immunity Live Yoghurt Drink Multipack 8X100g,£3.75
fresh-food,Tesco British Mild Grated Cheddar Cheese 250g,£2.55
fresh-food,Tesco Spanish Inspired Selection 120G,£3.00
fresh-food,Cathedral City Grated Mature Cheddar Cheese 180 G,£2.55
fresh-food,"T, Sweet & Sour Chicken & Egg Fried Rice 400G",£3.75
fresh-food,Alpro Soya No Sugar Chilled Dairy Free Drink 1L,£1.80
fresh-food,Tesco Grated Red Leicester 250 G,£2.55
fresh-food,Dairylea Cheese Spread 145G,£2.00
fresh-food,Tesco Smoked Beechwood Cheese 150G,£2.40
fresh-food,Tesco Penne 300G,£1.50
fresh-food,Tesco Baking Block 250G,£1.05
fresh-food,Tesco Wafer Thin Brunswick Ham 125G,£2.20
fresh-food,Stork Original Baking Spread 500G,£2.50
fresh-food,Growers Harvest No Added Sugar Apple Juice Drink 1 Litre,£0.90
fresh-food,Fridge Raiders Southern Style Chicken Bites 3X22.5G,£1.70
fresh-food,Tesco Buttery Spread 1Kg,£1.80
fresh-food,Tesco Curled Leaf Parsley 30g,£0.50
fresh-food,Tesco Wafer Thin Roast Chicken Slices 400g,£2.19
fresh-food,Tesco Finest Extra Mature English Cheddar Cheese 350G,£4.10
fresh-food,Tesco Potato Gnocchi 400g,£2.00
fresh-food,Rymer Farm Medium Free Range Eggs 6 Pack,£2.45
fresh-food,Yeo Valley Honey Greek Style Yogurt 4 X100g,£2.60
fresh-food,Tesco Spaghetti Bolognese 400G,£3.75
fresh-food,Tesco Finest British 6 Lincolnshire Sausages 400G,£3.30
fresh-food,Tesco Finest Belgian Chocolate Mousse 100G,£1.15
fresh-food,Theos Ready Rolled Filo Pastry 250 G,£1.80
fresh-food,Tesco Cranberry Juice Drink 1 Litre,£2.00
fresh-food,Dairylea Cheese Spread 270G,£2.35
fresh-food,Broad Oak Farm 8 Premium Pork Sausages 454G,£2.65
fresh-food,The Tofoo Co Naked Tofu 280G,£2.30
fresh-food,Muller Corner Strawberry Yogurt 136G,£0.95
fresh-food,Stork Original Baking Spread 1Kg,£3.50
fresh-food,Yeo Valley Organic Natural Yogurt 450G,£2.00
fresh-food,Tesco Organic Cherry Tomatoes On The Vine 200g,£2.00
fresh-food,Yazoo Chocolate Milk Drink 400ml,£1.60
fresh-food,Lindahls Kvarg Stracciatella Pot 150G,£1.25
fresh-food,Tesco Peeled Potatoes 750G,£1.80
fresh-food,Tesco Smoked Salmon Canapes 12 Pack 100g,£3.00
fresh-food,Creamfields Grana Padano Wedge 175G,£2.49
fresh-food,Yollies Strawberry Yogurt 4 X25g,£1.75
fresh-food,Tesco Wafer Thin Roast Chicken Slices 125g,£1.30
fresh-food,Love Beets Cooked Beetroot 250G,£0.90
fresh-food,Tesco Tendersweet Carrots 150G,£1.45
fresh-food,Don Simon Mango & Passionfruit Juice Drink 1.5L,£1.00
fresh-food,Albert Bartlett Cheese Croquettes 250G,£1.65
fresh-food,Tesco 8 Reduced Fat Pork Sausages 454G,£1.79
fresh-food,Tesco Lamb Leg Steaks 300G,£6.00
fresh-food,Tesco Unsmoked Boneless Gammon Joint,£10.50
fresh-food,Tesco Beef Brisket,£10.50
fresh-food,Tesco Organic Salted Butter 250G,£3.20
fresh-food,Tesco 2 Boneless Cod Fillets 280G,£8.15
fresh-food,"Tesco Finest Ham Hock, Leek & Gratin 400G",£4.75
fresh-food,Cauldron Foods Tofu 396G,£2.90
fresh-food,Tesco Prosciutto Crudo & Salami Platter 120G,£3.00
fresh-food,Tesco Diced Chorizo 130G,£2.55
fresh-food,Tesco Prawn Cocktail 170G,£2.75
fresh-food,Muller Light Fat Free Yogurts with Chocolate Sprinkles 6x140g,£4.00
fresh-food,Tesco Finest Wild Sage & Buttered Onion Stuffing 225G,£3.30
fresh-food,Actimel Immune Support Live Yoghurt Drink - Multifruit 8x100g,£3.75
fresh-food,Tesco Diced Lamb Shoulder 300G,£6.50
fresh-food,Large Gala Apples Loose Class 1,£0.45
fresh-food,St Helen's Fresh Semi Skimmed Goats Milk 1 Litre,£2.30
fresh-food,Tesco Mozzarella & Slow Roasted Tomatoes 200G,£3.00
fresh-food,Munch Bunch Double Up Strawberry Raspberry Kids Yoghurt Pots 4x85g,£1.80
fresh-food,Billy Bear Slices 100G,£1.45
fresh-food,Tropicana Original Orange With Juicy Bits 900Ml,£3.15
fresh-food,Tesco Three Bean Chilli 600g,£1.90
fresh-food,Eastmans Cooked Chicken Roll Slices 250g,£1.56
fresh-food,Pukka Steak And Kidney Pie,£2.25
fresh-food,The Collective Suckies Strawberry Kids Yoghurt Pouch 90g,£1.00
fresh-food,Muller Light Greek Style Strawberry Yogurt 4X115g,£2.50
fresh-food,Tesco Organic Red Onions,£1.45
fresh-food,Philadelphia Garlic & Herbs Soft Cream Cheese 165G,£2.25
fresh-food,Ginsters Peppered Steak Slice 170G,£2.25
fresh-food,Tesco 100% Pure Squeezed Pink Grapefruit Juice 1 Litre,£2.00
fresh-food,Tesco Chicken & Chorizo Fresh Tortelloni 300g,£2.25
fresh-food,Tesco Finest Cavolo Nero Kale 200G,£1.35
fresh-food,Tesco Finest Ribeye Steak 227G,£8.00
fresh-food,Tesco British Chicken Sausages 6 Pack 400G,£2.65
fresh-food,Tesco Plums 400G,£1.50
fresh-food,Tesco Pork Loin Joint,£14.40
fresh-food,Tesco Roast In Bag Butter Basted Whole Chicken 1.5Kg,£7.25
fresh-food,Président French Unsalted Block Butter 250g,£3.65
fresh-food,Tesco Finest Garlic & Extra Virgin Olive Oil Flatbread 200G,£3.20
fresh-food,Tesco British Mature Cheddar Cheese 220G,£2.50
fresh-food,Tesco Chicken Korma With Pilau Rice 400g,£3.75
fresh-food,Tesco Fat Free Cottage Cheese 300G,£1.65
fresh-food,Benecol Buttery Spread 500G,£4.50
fresh-food,Tesco Finest Prawn Cocktail 170G,£3.50
fresh-food,Cully & Sully Chicken & Vegetable Soup 400G,£2.45
fresh-food,Muller Corner Vanilla Chocolate Yogurt 124g,£0.95
fresh-food,Tesco Finest Gluten Free 18 British Pork Cocktail Sausages 270G,£3.30
fresh-food,Tesco Fusilli 300G,£1.50
fresh-food,Stork Original Baking Block 250G,£1.50
fresh-food,Britannia Finest Beef Dripping 250G,£1.25
fresh-food,Graham's Skyr Passion Fruit Mango Papaya Yogurt 150G,£0.80
fresh-food,Rachel's Organic Divine Rice 2 X150g,£2.25
fresh-food,Alpro Vanilla Dairy Free Soya Custard 525g,£1.20
fresh-food,Tesco Minced Lamb Hotpot 400G,£3.75
fresh-food,Yop Strawberry Yoghurt Drink 500g,£1.40
fresh-food,Tesco Chicken Mince 5% Fat 500G,£2.59
fresh-food,Tesco 100% Pure Squeezed Orange Juice With Bits 1.75 L,£3.25
fresh-food,Tesco Sliced Red Onion 180G,£0.95
fresh-food,Tesco Garlic & Cheese Mushrooms 200g,£2.20
fresh-food,Tesco Honey Roast Ham Slices 125g,£0.82
fresh-food,Eastmans Pork Luncheon Meat Slices 250g,£1.00
fresh-food,Tesco Singapore Noodles 300G,£1.15
fresh-food,Arla Big Milk Fresh Whole Milk 2L Vitamin Enriched for kids 1+,£2.75
fresh-food,Tesco Roast In Bag Ready Basted Whole Chicken 1.5Kg,£7.25
fresh-food,Fage Total 0%Fat Greek Recipe Yogurt 950G,£5.90
fresh-food,Tesco Finest Sirloin Steak 454G,£15.25
fresh-food,Tesco Finest Spaghetti Carbonara 400G,£4.75
fresh-food,Tesco Butter Chicken With Pilau Rice 400G,£3.75
fresh-food,Lindahls Protein Pudding Chocolate 140G,£1.40
fresh-food,Tesco Unsmoked Gammon Steaks 2 Pack 450G,£4.75
fresh-food,Tesco Parmigiano Reggiano 100G,£2.80
fresh-food,"Tesco Organic Free Range Skimmed Milk 1.136L, 2 Pint",£2.00
fresh-food,Tesco Finest Moroccan Inspired Chicken Soup 600G,£3.20
fresh-food,Innocent Smooth Orange Juice 900ml,£3.20
fresh-food,Tesco Carrot & Coriander Soup 600G,£1.90
fresh-food,Richmond Skinless Pork Sausages 12 Pack 319g,£2.30
fresh-food,Tesco Double Gloucester Cheese 400G,£3.25
fresh-food,St Helen's Fresh Whole Goats Milk 1 Litre,£2.30
fresh-food,Arla LactoFREE Whole Milk Drink 1L,£1.95
fresh-food,Tesco British Cumberland Sausage Slices 150g,£2.30
fresh-food,Tesco Grated Pecorino Cheese 50G,£1.45
fresh-food,Tesco Chicken Casserole & Dumplings 400G,£3.75
fresh-food,Tesco 50% Less Fat Creme Fraiche 600Ml,£1.45
fresh-food,Tesco Wafer Thin Smoked Ham Slices 125g,£1.30
fresh-food,Muller Light Greek Style Yogurt - Smooth Coconut & Vanilla 4x115g,£2.50
fresh-food,Tesco Organic Gala Apples 630G,£2.35
fresh-food,"Tesco Carrot, Cauliflower & Broccoli 370g",£1.75
fresh-food,Tesco Mango 250G,£2.50
fresh-food,Tesco Cheese & Tomato Fresh Tortelloni 300g,£2.25
fresh-food,Tesco Finest 2 Smoked Haddock Fishcakes 290G,£3.75
fresh-food,Tesco Beef Lasagne 750G,£4.50
fresh-food,Tesco Spanish Serrano Ham 80G,£1.51
fresh-food,Tesco Grated Carrots 200g,£0.59
fresh-food,Tesco Lamb Chops 300G,£6.10
fresh-food,Tesco German Style Peppered Salami Slices 11 Pack 110g,£0.81
fresh-food,Tesco Finest Fillet Steak 210G,£10.50
fresh-food,Tesco Boneless Smoked Haddock 280G,£8.50
fresh-food,Tesco Cholesterol Reducing Strawberry Yogurt Drink 6 X100g,£3.10
fresh-food,Tesco Finest Rump Steak 255G,£7.00
fresh-food,Tesco Finest Aged Blue Stilton 215G,£3.70
fresh-food,Tesco Cold Water Prawns 150G,£3.75
fresh-food,Tesco Finest 4 Pork Sausage Rolls 188G,£3.00
fresh-food,"innocent Kids Smoothies Oranges, Mangoes & Pineapples 4 x 150ml",£3.60
fresh-food,Tesco Finest Basil Pesto 130G,£2.85
fresh-food,Rustlers Quarter Pounder Cheese Burger 190 G,£2.50
fresh-food,Cauldron Foods Falafel 200G,£2.60
fresh-food,Quorn Vegan Chicken Free Slices 100G,£2.70
fresh-food,Chavroux Goat's Cheese Log 150G,£2.70
fresh-food,Linda McCartney 6 Vegan Sausages 270g,£2.50
fresh-food,Tesco 50% Less Fat Garlic & Herb Soft Cheese 200g,£1.55
fresh-food,Bertolli Light 450G,£3.00
fresh-food,Leerdammer Light Cheese Slices 160g,£2.35
fresh-food,Tesco Finest Strawberry Yogurt 150G,£1.00
fresh-food,Jus-Rol Gluten Free Ready Rolled Puff Pastry Sheet 280g,£2.45
fresh-food,Tesco 10 Extra Mature Cheddar Slices 250G,£2.85
fresh-food,Tesco Organic Tomatoes On The Vine 400g,£2.25
fresh-food,Tesco Ricotta Cheese 250 G,£1.50
fresh-food,Tesco Organic Beetroot 450g,£2.20
fresh-food,Tesco Large Selection Grapes 800G Pack,£3.50
fresh-food,Nestle Nesquik Milk Slice - Chocolate 4x26g,£1.40
fresh-food,Tesco 10 Mature Slices 200G,£1.45
fresh-food,Tesco Smoked Mackerel,£6.00
fresh-food,Tesco Raspberries 250G,£3.50
fresh-food,Tesco Apricots 320G,£2.50
fresh-food,Tesco Protein Noodles 300G,£1.15
fresh-food,Tesco Figs Minimum 3 Pack,£2.10
fresh-food,Tesco British Skimmed Uht Milk 6 X 1 Litre,£6.15
fresh-food,Tesco Finest Pork Chops 500G,£5.80
fresh-food,ProActiv Buttery Taste Spread 450G,£4.75
fresh-food,Fage Total 0%Fat Greek Recipe Yogurt 450G,£3.75
fresh-food,Tesco Beef Stir Fry Strips 357G,£6.40
fresh-food,Tesco Vegetable Samosas 4 Pack 216g,£2.85
fresh-food,Alpro Greek Style Plain Dairy Free Yoghurt Alternative 400g,£2.50
fresh-food,Tesco German Smoked Selection 120g,£3.00
fresh-food,Tesco Bramley Apple Pie,£2.20
fresh-food,Lurpak Garlic Butter 125G,£2.50
fresh-food,Innocent Tropical Juice 900Ml,£3.20
fresh-food,Tesco Finest Madagascan Vanilla Yogurt 150G,£1.00
fresh-food,"Mini Babybel Original Cheese 6 Pack, 120 G",£2.45
fresh-food,Pilgrims Choice Mature Cheddar Cheese 350 G,£4.20
fresh-food,Tesco Cambozola Blue Brie 175G,£3.15
fresh-food,Alpro Plain No Sugars Dairy Free Soya Yoghurt Alternative 500g,£2.50
fresh-food,Activia Gut Health Fusion Yoghurt - Prune 4x120g,£3.00
fresh-food,"Tesco British Medium Cheddar 10 Slices, 250 G",£2.85
fresh-food,Tesco Gooseberry Fool 114g,£1.00
fresh-food,Tesco Prosciutto Cotto 100G,£2.15
fresh-food,Primula Cheese & Chive Tube 140G,£2.00
fresh-food,Muller Rice Original Low Fat Dessert 170G,£0.95
fresh-food,Tesco Basil Medium Pot,£1.60
fresh-food,Tesco Lamb Sliced Liver,£2.46
fresh-food,Tesco Smoked Salmon 100g,£3.75
fresh-food,Tesco Steak & Ale Puff Pie 200G,£2.25
fresh-food,Happy Monkey Smoothies Strawberry & Banana 4 x 180ml,£2.40
fresh-food,Tesco Prime Cuts Roast Chicken & Stuffing 4 Slices 100G,£2.30
fresh-food,Tesco Finest Scottish Smoked Salmon Mild and Delicate 100g,£4.95
fresh-food,Tesco Carbonara Sauce 350G,£2.25
fresh-food,Tesco Smoked Kippers With Butter,£1.64
fresh-food,Tesco Finest Strong And Robust Scottish Smoked Salmon 100G,£4.75
fresh-food,Tesco British Lincolnshire Sausages 8 Pack 454G,£1.79
fresh-food,Tesco Smoked Boneless Gammon Joint,£10.50
fresh-food,Davidstow Crackler Extra Mature Cornish Cheddar Cheese 320g,£5.00
fresh-food,Country Life Original Salted Spreadable 750G,£5.50
fresh-food,Tesco Finest Creamy Buttery Mash 450G,£3.30
fresh-food,Tesco Finest Skinless & Boneless Cod Loins 280G,£8.70
fresh-food,Mattessons Smoked Pork Sausage - Original 260g,£3.00
fresh-food,Alpro Vanilla Dairy Free Soya Yoghurt Alternative 500g,£2.50
fresh-food,Yeo Valley Natural Greek Style Yogurt 450G,£2.25
fresh-food,Petits Filous No Added Sugar Fromage Frais - Strawberry & Banana 6 x 47g,£1.95
fresh-food,Tesco 0% Fat Greek Style Yogurt 4X100g,£1.45
fresh-food,Tesco Finest Spanish Spicy Chorizo Ring 225G,£2.40
fresh-food,Innocent Orange Juice With Bits 1.35 Litre,£4.40
fresh-food,Tesco 10 Red Leicester Slices 250G,£2.85
fresh-food,Munch Bunch Double Up Strawberry Banana Fromage Frais 4X85g,£1.80
fresh-food,Tesco Mango Passion Fruit Smoothie 750Ml,£1.95
fresh-food,Tesco Pineapple Chunks 145G,£1.50
fresh-food,Oatly Creamy Oat Single Cream Alternative 250Ml,£1.25
fresh-food,Galbani Italian Mozzarella Cheese 125g,£1.95
fresh-food,Seachill Cooked& Peeled King Prawns 150G,£2.49
fresh-food,Tesco Shredded Ham Hock 100G,£2.30
fresh-food,Tesco 4 Beef Quarter Pounders 454G,£4.00
fresh-food,Tesco British Crumbed Ham Slices 400g,£5.00
fresh-food,Tesco Four Cheese Tortelloni 300G,£2.25
fresh-food,Yazoo Strawberry Milk Drink 400ml,£1.60
fresh-food,Nestle Rolo Dessert 2X65g,£2.00
fresh-food,Seriously Spreadable Lighter Cheese Spread 125g,£1.35
fresh-food,Suntrail Farms Ripen At Home Peach Minimum 4 Pack,£1.89
fresh-food,Tesco British Cumberland Sausages 12 Pack 681G,£2.65
fresh-food,Tesco Reduced Fat Cumberland Sausage 454G,£1.79
fresh-food,Tesco Honey Roast Ham Chunks 100G,£2.30
fresh-food,Tesco Beef Medallion Steak 227G,£3.29
fresh-food,Tesco Pork Shoulder Steaks 700G,£6.40
fresh-food,Tesco Fish Pie Mix 340G,£6.75
fresh-food,Tesco Tomato & Mozzarella Pasta Bake 400G,£3.75
fresh-food,Koko Dairy Free Unsweetened Alternative Longlife Drink 1L,£1.80
