Category,Name,Price
fresh-food,Tesco Double Gloucester Onion & Chives 200G,£2.85
fresh-food,Tesco Lightly Dusted Cod Fillets 255G,£5.50
fresh-food,Muller Light Fat Free Mango Psn/Fruit Peach Yogurt 6X140g,£4.00
fresh-food,Pure Dairy Free Sunflower Spread 500G,£2.15
fresh-food,Benecol Light Spread 500G,£4.50
fresh-food,Tesco Finest Cheddar & Onion Flatbread 295 G,£3.20
fresh-food,Tesco Wensleydale Cheese 220G,£2.50
fresh-food,Alpro Barista Oat Long Life Dairy Free Drink 1L,£2.35
fresh-food,Tesco Organic Chestnut Mushrooms 250 G,£2.25
fresh-food,Tesco Finest Roasted Hazelnut Yogurt 150G,£1.00
fresh-food,Fage Total 0% Fat Greek Recipe Yogurt 150G,£1.65
fresh-food,Leerdammer Original Cheese Slices 160g,£2.35
fresh-food,Najma Smoked Turkey Rasher Slice 150G,£2.95
fresh-food,Primula Cheese & Ham Tube 140G,£2.00
fresh-food,Innocent Apple Juice 1.35 Litre,£4.40
fresh-food,Tesco Crackling Pork Loin Joint 637G,£6.75
fresh-food,Tesco Strawberry Sensation Smoothie 750Ml,£1.95
fresh-food,Yeo Valley Organic Little Yeos Fruity Favourites Kids Yogurt 4x85g,£2.15
